No.,Time,Source,Destination,Protocol,Length,Info,TBP
1167490,2284.784527,192.168.0.2,213.160.141.62,UDP,159,12236  >  61921 Len=117,0.0
1167491,2284.784863,192.168.0.2,5.137.190.58,UDP,159,12236  >  6881 Len=117,0.00033600000006117625
1167492,2284.785112,192.168.0.2,27.72.45.42,UDP,159,12236  >  30215 Len=117,0.0002490000001671433
1167493,2284.785232,192.168.0.2,79.182.11.233,UDP,159,12236  >  14443 Len=117,0.00012000000015177648
1167496,2284.786597,192.168.0.2,104.25.202.21,TCP,54,4218  >  443 [ACK] Seq=2519 Ack=13000798 Win=1959168 Len=0,0.001364999999623251
1167499,2284.786669,192.168.0.2,104.25.202.21,TCP,54,4218  >  443 [ACK] Seq=2519 Ack=13003718 Win=1959168 Len=0,7.200000027296483e-05
1167502,2284.786746,192.168.0.2,104.25.202.21,TCP,54,4218  >  443 [ACK] Seq=2519 Ack=13006638 Win=1959168 Len=0,7.70000001466542e-05
1167508,2284.786893,192.168.0.2,104.25.202.21,TCP,54,4218  >  443 [ACK] Seq=2519 Ack=13009558 Win=1959168 Len=0,0.00014699999974254752
1167511,2284.786960000001,192.168.0.2,104.25.202.21,TCP,54,4218  >  443 [ACK] Seq=2519 Ack=13012478 Win=1959168 Len=0,6.70000008540228e-05
1167514,2284.787583,192.168.0.2,104.25.202.21,TCP,54,4218  >  443 [ACK] Seq=2519 Ack=13015398 Win=1959168 Len=0,0.0006229999989955104
1167517,2284.787662,192.168.0.2,104.25.202.21,TCP,54,4218  >  443 [ACK] Seq=2519 Ack=13018318 Win=1959168 Len=0,7.900000036897836e-05
1167531,2284.789193,192.168.0.2,104.25.202.21,TCP,54,4218  >  443 [ACK] Seq=2519 Ack=13021238 Win=1959168 Len=0,0.0015309999998862622
1167536,2284.793739,192.168.0.2,104.25.202.21,TCP,54,4218  >  443 [ACK] Seq=2519 Ack=13024158 Win=1959168 Len=0,0.004546000000118511
1167539,2284.793821,192.168.0.2,104.25.202.21,TCP,54,4218  >  443 [ACK] Seq=2519 Ack=13027078 Win=1959168 Len=0,8.200000002034358e-05
1167540,2284.793831,192.168.0.2,106.71.19.184,BitTorrent,61,Port  ,9.999999747378752e-06
1167543,2284.79389,192.168.0.2,104.25.202.21,TCP,54,4218  >  443 [ACK] Seq=2519 Ack=13029998 Win=1959168 Len=0,5.899999996472616e-05
1167546,2284.793953000001,192.168.0.2,104.25.202.21,TCP,54,4218  >  443 [ACK] Seq=2519 Ack=13032918 Win=1959168 Len=0,6.300000086412183e-05
1167549,2284.794018,192.168.0.2,104.25.202.21,TCP,54,4218  >  443 [ACK] Seq=2519 Ack=13035838 Win=1959168 Len=0,6.499999926745659e-05
1167552,2284.794087,192.168.0.2,104.25.202.21,TCP,54,4218  >  443 [ACK] Seq=2519 Ack=13038758 Win=1959168 Len=0,6.900000016685226e-05
1167555,2284.794159,192.168.0.2,104.25.202.21,TCP,54,4218  >  443 [ACK] Seq=2519 Ack=13041678 Win=1959168 Len=0,7.199999981821747e-05
1167558,2284.7942350000008,192.168.0.2,104.25.202.21,TCP,54,4218  >  443 [ACK] Seq=2519 Ack=13044598 Win=1959168 Len=0,7.600000071761315e-05
1167561,2284.794312,192.168.0.2,104.25.202.21,TCP,54,4218  >  443 [ACK] Seq=2519 Ack=13047518 Win=1959168 Len=0,7.69999992371595e-05
1167564,2284.794382,192.168.0.2,104.25.202.21,TCP,54,4218  >  443 [ACK] Seq=2519 Ack=13050438 Win=1959168 Len=0,7.000000005064066e-05
1167567,2284.79445,192.168.0.2,104.25.202.21,TCP,54,4218  >  443 [ACK] Seq=2519 Ack=13053358 Win=1959168 Len=0,6.79999998283165e-05
1167570,2284.794679,192.168.0.2,104.25.202.21,TCP,54,4218  >  443 [ACK] Seq=2519 Ack=13056278 Win=1959168 Len=0,0.00022900000021763844
1167573,2284.794752,192.168.0.2,104.25.202.21,TCP,54,4218  >  443 [ACK] Seq=2519 Ack=13059198 Win=1959168 Len=0,7.299999970200588e-05
1167576,2284.796996,192.168.0.2,104.25.202.21,TCP,54,4218  >  443 [ACK] Seq=2519 Ack=13062118 Win=1959168 Len=0,0.00224400000024616
1167579,2284.797068,192.168.0.2,104.25.202.21,TCP,54,4218  >  443 [ACK] Seq=2519 Ack=13065038 Win=1959168 Len=0,7.199999981821747e-05
1167582,2284.797142000001,192.168.0.2,104.25.202.21,TCP,54,4218  >  443 [ACK] Seq=2519 Ack=13067958 Win=1959168 Len=0,7.400000095003634e-05
1167585,2284.797213,192.168.0.2,104.25.202.21,TCP,54,4218  >  443 [ACK] Seq=2519 Ack=13070878 Win=1959168 Len=0,7.099999902493437e-05
1167588,2284.797285,192.168.0.2,104.25.202.21,TCP,54,4218  >  443 [ACK] Seq=2519 Ack=13073798 Win=1959168 Len=0,7.200000027296483e-05
1167592,2284.801568,192.168.0.2,104.25.202.21,TCP,54,4218  >  443 [ACK] Seq=2519 Ack=13076718 Win=1959168 Len=0,0.00428299999975934
1167595,2284.80167,192.168.0.2,104.25.202.21,TCP,54,4218  >  443 [ACK] Seq=2519 Ack=13079638 Win=1959168 Len=0,0.00010199999996984843
1167598,2284.801751,192.168.0.2,104.25.202.21,TCP,54,4218  >  443 [ACK] Seq=2519 Ack=13082558 Win=1959168 Len=0,8.100000013655517e-05
1167601,2284.8018239999997,192.168.0.2,104.25.202.21,TCP,54,4218  >  443 [ACK] Seq=2519 Ack=13085478 Win=1959168 Len=0,7.299999970200588e-05
1167604,2284.801894,192.168.0.2,104.25.202.21,TCP,54,4218  >  443 [ACK] Seq=2519 Ack=13088398 Win=1959168 Len=0,7.000000050538802e-05
1167607,2284.801952,192.168.0.2,104.25.202.21,TCP,54,4218  >  443 [ACK] Seq=2519 Ack=13091318 Win=1959168 Len=0,5.79999996261904e-05
1167610,2284.802019,192.168.0.2,104.25.202.21,TCP,54,4218  >  443 [ACK] Seq=2519 Ack=13094238 Win=1959168 Len=0,6.700000039927545e-05
1167613,2284.8020899999997,192.168.0.2,104.25.202.21,TCP,54,4218  >  443 [ACK] Seq=2519 Ack=13097158 Win=1959168 Len=0,7.099999947968172e-05
1167616,2284.802327,192.168.0.2,104.25.202.21,TCP,54,4218  >  443 [ACK] Seq=2519 Ack=13100078 Win=1959168 Len=0,0.00023700000019744039
1167619,2284.802389,192.168.0.2,104.25.202.21,TCP,54,4218  >  443 [ACK] Seq=2519 Ack=13102998 Win=1959168 Len=0,6.200000007083872e-05
1167622,2284.8024579999997,192.168.0.2,104.25.202.21,TCP,54,4218  >  443 [ACK] Seq=2519 Ack=13105918 Win=1959168 Len=0,6.899999971210491e-05
1167625,2284.805124,192.168.0.2,104.25.202.21,TCP,54,4218  >  443 [ACK] Seq=2519 Ack=13108838 Win=1959168 Len=0,0.002666000000317581
1167628,2284.805206,192.168.0.2,104.25.202.21,TCP,54,4218  >  443 [ACK] Seq=2519 Ack=13111758 Win=1959168 Len=0,8.200000002034358e-05
1167629,2284.805666,192.168.0.2,201.52.67.173,TCP,66,[TCP Retransmission] 4228  >  12236 [SYN] Seq=0 Win=17520 Len=0 MSS=1460 WS=256 SACK_PERM=1,0.0004600000002028537
1167632,2284.80856,192.168.0.2,104.25.202.21,TCP,54,4218  >  443 [ACK] Seq=2519 Ack=13114678 Win=1959168 Len=0,0.0028939999997419363
1167635,2284.808629,192.168.0.2,104.25.202.21,TCP,54,4218  >  443 [ACK] Seq=2519 Ack=13117598 Win=1959168 Len=0,6.900000016685226e-05
1167638,2284.80869,192.168.0.2,104.25.202.21,TCP,54,4218  >  443 [ACK] Seq=2519 Ack=13120518 Win=1959168 Len=0,6.099999973230297e-05
1167641,2284.8087570000002,192.168.0.2,104.25.202.21,TCP,54,4218  >  443 [ACK] Seq=2519 Ack=13123438 Win=1959168 Len=0,6.700000039927545e-05
1167644,2284.808823,192.168.0.2,104.25.202.21,TCP,54,4218  >  443 [ACK] Seq=2519 Ack=13126358 Win=1959168 Len=0,6.599999960599234e-05
1167647,2284.808888,192.168.0.2,104.25.202.21,TCP,54,4218  >  443 [ACK] Seq=2519 Ack=13129278 Win=1959168 Len=0,6.500000017695129e-05
1167650,2284.8089609999997,192.168.0.2,104.25.202.21,TCP,54,4218  >  443 [ACK] Seq=2519 Ack=13132198 Win=1959168 Len=0,7.299999970200588e-05
1167653,2284.809028,192.168.0.2,104.25.202.21,TCP,54,4218  >  443 [ACK] Seq=2519 Ack=13135118 Win=1959168 Len=0,6.700000039927545e-05
1167656,2284.812042,192.168.0.2,104.25.202.21,TCP,54,4218  >  443 [ACK] Seq=2519 Ack=13138038 Win=1959168 Len=0,0.003013999999893713
1167659,2284.812128,192.168.0.2,104.25.202.21,TCP,54,4218  >  443 [ACK] Seq=2519 Ack=13140958 Win=1959168 Len=0,8.600000001024455e-05
1167662,2284.812202,192.168.0.2,104.25.202.21,TCP,54,4218  >  443 [ACK] Seq=2519 Ack=13143878 Win=1959168 Len=0,7.400000004054164e-05
1167665,2284.8122789999998,192.168.0.2,104.25.202.21,TCP,54,4218  >  443 [ACK] Seq=2519 Ack=13146798 Win=1959168 Len=0,7.699999969190685e-05
1167668,2284.812347,192.168.0.2,104.25.202.21,TCP,54,4218  >  443 [ACK] Seq=2519 Ack=13149718 Win=1959168 Len=0,6.800000028306386e-05
1167671,2284.8124199999997,192.168.0.2,104.25.202.21,TCP,54,4218  >  443 [ACK] Seq=2519 Ack=13152638 Win=1959168 Len=0,7.299999970200588e-05
1167674,2284.812491,192.168.0.2,104.25.202.21,TCP,54,4218  >  443 [ACK] Seq=2519 Ack=13155558 Win=1959168 Len=0,7.100000038917642e-05
1167677,2284.812553,192.168.0.2,104.25.202.21,TCP,54,4218  >  443 [ACK] Seq=2519 Ack=13158478 Win=1959168 Len=0,6.200000007083872e-05
1167680,2284.8127210000002,192.168.0.2,104.25.202.21,TCP,54,4218  >  443 [ACK] Seq=2519 Ack=13161398 Win=1959168 Len=0,0.00016800000003058813
1167691,2284.818618,192.168.0.2,104.25.202.21,TCP,54,4218  >  443 [ACK] Seq=2519 Ack=13164318 Win=1959168 Len=0,0.005896999999549735
1167694,2284.818701,192.168.0.2,104.25.202.21,TCP,54,4218  >  443 [ACK] Seq=2519 Ack=13167238 Win=1959168 Len=0,8.300000035887933e-05
1167697,2284.818765,192.168.0.2,104.25.202.21,TCP,54,4218  >  443 [ACK] Seq=2519 Ack=13170158 Win=1959168 Len=0,6.399999983841553e-05
1167700,2284.818833,192.168.0.2,104.25.202.21,TCP,54,4218  >  443 [ACK] Seq=2519 Ack=13173078 Win=1959168 Len=0,6.79999998283165e-05
1167703,2284.818906,192.168.0.2,104.25.202.21,TCP,54,4218  >  443 [ACK] Seq=2519 Ack=13175998 Win=1959168 Len=0,7.300000015675323e-05
1167706,2284.818975,192.168.0.2,104.25.202.21,TCP,54,4218  >  443 [ACK] Seq=2519 Ack=13178918 Win=1959168 Len=0,6.900000016685226e-05
1167709,2284.819027,192.168.0.2,104.25.202.21,TCP,54,4218  >  443 [ACK] Seq=2519 Ack=13180404 Win=1959168 Len=0,5.199999986871262e-05
1167720,2284.886105,192.168.0.2,45.33.3.7,TCP,66,4235  >  443 [SYN] Seq=0 Win=17520 Len=0 MSS=1460 WS=256 SACK_PERM=1,0.06707800000003772
1167734,2284.976574,192.168.0.2,201.52.67.173,UDP,62,12236  >  12236 Len=20,0.09046899999975722
1167751,2285.001563,192.168.0.2,178.48.53.33,UDP,1123,12236  >  8999 Len=1081,0.024989000000005035
1167765,2285.05817,192.168.0.2,45.33.3.7,TCP,54,4235  >  443 [ACK] Seq=1 Ack=1 Win=17408 Len=0,0.05660699999998542
1167766,2285.0592579999998,192.168.0.2,45.33.3.7,TLSv1.2,270,Client Hello,0.0010879999999815482
1167769,2285.077194,192.168.0.2,201.6.2.77,DNS,78,Standard query 0x0ae9 AAAA assets.zendesk.com,0.01793600000019069
1167772,2285.105696,192.168.0.2,72.21.91.110,TCP,66,4236  >  443 [SYN] Seq=0 Win=17520 Len=0 MSS=1460 WS=256 SACK_PERM=1,0.028502000000116823
1167784,2285.218617,192.168.0.2,104.25.202.21,TCP,54,4218  >  443 [ACK] Seq=2519 Ack=13183324 Win=1959168 Len=0,0.11292099999991478
1167787,2285.218682,192.168.0.2,104.25.202.21,TCP,54,4218  >  443 [ACK] Seq=2519 Ack=13186244 Win=1959168 Len=0,6.500000017695129e-05
1167790,2285.218839,192.168.0.2,104.25.202.21,TCP,54,4218  >  443 [ACK] Seq=2519 Ack=13189164 Win=1959168 Len=0,0.00015699999994467362
1167793,2285.220071,192.168.0.2,104.25.202.21,TCP,54,4218  >  443 [ACK] Seq=2519 Ack=13192084 Win=1959168 Len=0,0.0012320000000727305
1167796,2285.220136,192.168.0.2,104.25.202.21,TCP,54,4218  >  443 [ACK] Seq=2519 Ack=13195004 Win=1959168 Len=0,6.499999972220394e-05
1167799,2285.220206,192.168.0.2,104.25.202.21,TCP,54,4218  >  443 [ACK] Seq=2519 Ack=13196571 Win=1959168 Len=0,7.000000005064066e-05
1167802,2285.220275,192.168.0.2,104.25.202.21,TCP,54,4218  >  443 [ACK] Seq=2519 Ack=13199491 Win=1959168 Len=0,6.900000016685226e-05
1167805,2285.2220399999997,192.168.0.2,104.25.202.21,TCP,54,4218  >  443 [ACK] Seq=2519 Ack=13202411 Win=1959168 Len=0,0.0017649999995228427
1167808,2285.2254550000002,192.168.0.2,104.25.202.21,TCP,54,4218  >  443 [ACK] Seq=2519 Ack=13205331 Win=1959168 Len=0,0.0034150000005865877
1167811,2285.2258899999997,192.168.0.2,104.25.202.21,TCP,54,4218  >  443 [ACK] Seq=2519 Ack=13208251 Win=1959168 Len=0,0.00043499999947016477
1167814,2285.22623,192.168.0.2,104.25.202.21,TCP,54,4218  >  443 [ACK] Seq=2519 Ack=13211171 Win=1959168 Len=0,0.0003400000005058246
1167817,2285.2266010000008,192.168.0.2,104.25.202.21,TCP,54,4218  >  443 [ACK] Seq=2519 Ack=13214091 Win=1959168 Len=0,0.00037100000054124394
1167820,2285.2267420000007,192.168.0.2,104.25.202.21,TCP,54,4218  >  443 [ACK] Seq=2519 Ack=13217011 Win=1959168 Len=0,0.00014099999998506973
1167823,2285.2268129999998,192.168.0.2,104.25.202.21,TCP,54,4218  >  443 [ACK] Seq=2519 Ack=13219931 Win=1959168 Len=0,7.099999902493437e-05
1167826,2285.226877,192.168.0.2,104.25.202.21,TCP,54,4218  >  443 [ACK] Seq=2519 Ack=13222851 Win=1959168 Len=0,6.400000029316288e-05
1167829,2285.226946,192.168.0.2,104.25.202.21,TCP,54,4218  >  443 [ACK] Seq=2519 Ack=13225771 Win=1959168 Len=0,6.900000016685226e-05
1167832,2285.227141,192.168.0.2,104.25.202.21,TCP,54,4218  >  443 [ACK] Seq=2519 Ack=13228691 Win=1959168 Len=0,0.00019499999962135917
1167835,2285.227211,192.168.0.2,104.25.202.21,TCP,54,4218  >  443 [ACK] Seq=2519 Ack=13231611 Win=1959168 Len=0,7.000000005064066e-05
1167838,2285.227291,192.168.0.2,104.25.202.21,TCP,54,4218  >  443 [ACK] Seq=2519 Ack=13234531 Win=1959168 Len=0,8.000000025276677e-05
1167841,2285.227393,192.168.0.2,104.25.202.21,TCP,54,4218  >  443 [ACK] Seq=2519 Ack=13236461 Win=1959168 Len=0,0.00010199999996984843
1167847,2285.239535,192.168.0.2,45.33.3.7,TCP,54,4235  >  443 [ACK] Seq=217 Ack=2921 Win=17408 Len=0,0.012142000000039843
1167852,2285.247141,192.168.0.2,45.33.3.7,TLSv1.2,180,"Client Key Exchange, Change Cipher Spec, Hello Request, Hello Request",0.007605999999668711
1167855,2285.256664,192.168.0.2,106.71.19.184,GVSP,331,Unknown Format (0x70) [Block ID: 14953 Packet ID: 3553898] Unknown Payload Type (0x3866) ,0.009523000000172033
1167857,2285.2625120000002,192.168.0.2,72.21.91.110,TCP,54,4236  >  443 [ACK] Seq=1 Ack=1 Win=17408 Len=0,0.005848000000241882
1167858,2285.262702,192.168.0.2,72.21.91.110,TLSv1.2,260,Client Hello,0.0001899999997476698
1167872,2285.3689440000007,192.168.0.2,23.73.74.14,TCP,66,4238  >  443 [SYN] Seq=0 Win=17520 Len=0 MSS=1460 WS=256 SACK_PERM=1,0.1062420000007478
1167874,2285.395113,192.168.0.2,23.73.74.14,TCP,54,4238  >  443 [ACK] Seq=1 Ack=1 Win=17408 Len=0,0.026168999999299558
1167875,2285.395344,192.168.0.2,23.73.74.14,TLSv1.2,571,Client Hello,0.00023099999998521525
1167878,2285.414419,192.168.0.2,45.33.3.7,TLSv1.2,550,Application Data,0.01907500000015716
1167889,2285.431632,192.168.0.2,72.21.91.110,TCP,54,4236  >  443 [ACK] Seq=207 Ack=2921 Win=17408 Len=0,0.017212999999628664
1167892,2285.443304,192.168.0.2,72.21.91.110,TCP,54,4236  >  443 [ACK] Seq=207 Ack=4978 Win=17408 Len=0,0.01167200000008961
1167893,2285.444851,192.168.0.2,72.21.91.110,TLSv1.2,180,"Client Key Exchange, Change Cipher Spec, Hello Request, Hello Request",0.0015470000003006135
1167894,2285.448445,192.168.0.2,72.21.91.110,TLSv1.2,147,Application Data,0.0035939999997935956
1167895,2285.448602,192.168.0.2,72.21.91.110,TLSv1.2,314,Application Data,0.00015699999994467362
1167899,2285.460791,192.168.0.2,23.73.74.14,TLSv1.2,105,"Change Cipher Spec, Hello Request, Hello Request",0.012189000000034866
1167900,2285.4615280000007,192.168.0.2,23.73.74.14,TLSv1.2,147,Application Data,0.0007370000007540511
1167901,2285.461819,192.168.0.2,23.73.74.14,TLSv1.2,713,Application Data,0.00029099999937898247
1167907,2285.4799,192.168.0.2,23.73.74.14,TLSv1.2,92,Application Data,0.01808099999971091
1167908,2285.484586,192.168.0.2,113.193.151.171,UDP,1312,62257  >  50670 Len=1270,0.004686000000219792
1167909,2285.484589,192.168.0.2,188.49.129.56,GVSP,62,Unknown Format (0x28) [Block ID: 16865311826554962768 Packet ID: 951267160] [RANGE_ERROR] Unknown Payload Type (0x0) ,3.000000106112566e-06
1167913,2285.573556,192.168.0.2,45.33.3.7,TCP,54,4235  >  443 [ACK] Seq=839 Ack=7255 Win=17408 Len=0,0.08896699999968405
1167916,2285.573947,192.168.0.2,45.33.3.7,TCP,54,4235  >  443 [ACK] Seq=839 Ack=10175 Win=17408 Len=0,0.00039100000003600144
1167919,2285.57402,192.168.0.2,45.33.3.7,TCP,54,4235  >  443 [ACK] Seq=839 Ack=12001 Win=17408 Len=0,7.300000015675323e-05
1167921,2285.578079,192.168.0.2,72.21.91.110,TCP,66,[TCP Dup ACK 1167892#1] 4236  >  443 [ACK] Seq=686 Ack=4978 Win=17408 Len=0 SLE=5220 SRE=5288,0.004058999999870139
1167923,2285.578126000001,192.168.0.2,72.21.91.110,TCP,66,[TCP Dup ACK 1167892#2] 4236  >  443 [ACK] Seq=686 Ack=4978 Win=17408 Len=0 SLE=5220 SRE=5326,4.700000090451795e-05
1167925,2285.578152,192.168.0.2,72.21.91.110,TCP,66,[TCP Dup ACK 1167892#3] 4236  >  443 [ACK] Seq=686 Ack=4978 Win=17408 Len=0 SLE=5220 SRE=5368,2.5999999252235284e-05
1167927,2285.58128,192.168.0.2,72.21.91.110,TCP,54,4236  >  443 [ACK] Seq=686 Ack=5368 Win=16896 Len=0,0.003127999999833264
1167928,2285.581503000001,192.168.0.2,72.21.91.110,TLSv1.2,92,Application Data,0.00022300000091490801
1167930,2285.692876,192.168.0.2,23.73.74.14,TCP,54,4238  >  443 [ACK] Seq=1359 Ack=845 Win=16640 Len=0,0.11137299999927563
1167932,2285.706409,192.168.0.2,72.21.91.110,TCP,66,[TCP Dup ACK 1167927#1] 4236  >  443 [ACK] Seq=724 Ack=5368 Win=16896 Len=0 SLE=4978 SRE=5220,0.013532999999824824
1167934,2285.789467,192.168.0.2,177.203.49.96,UDP,159,12236  >  1024 Len=117,0.08305800000016461
1167935,2285.789633,192.168.0.2,164.138.38.112,UDP,159,12236  >  49001 Len=117,0.00016599999980826396
1167936,2285.789757,192.168.0.2,105.104.121.127,UDP,159,12236  >  47783 Len=117,0.00012400000014167745
1167937,2285.7898600000008,192.168.0.2,89.177.10.123,UDP,159,12236  >  24209 Len=117,0.00010300000076313154
1167938,2285.798923,192.168.0.2,45.33.3.7,TLSv1.2,592,Application Data,0.009062999999059684
1167940,2285.90818,192.168.0.2,113.193.151.171,UDP,1312,62257  >  50670 Len=1270,0.10925700000007055
1167942,2285.983759,192.168.0.2,24.226.180.60,GVSP,62,Unknown Format (0x28) [Block ID: 7081337014431302468 Packet ID: -1454349134] [BLOCK_DROPPED] Unknown Payload Type (0x0) ,0.07557900000028894
1167943,2285.996604,192.168.0.2,45.33.3.7,TCP,54,4235  >  443 [ACK] Seq=1377 Ack=12614 Win=16896 Len=0,0.012844999999742868
1167946,2286.0572190000007,192.168.0.2,72.21.91.110,TCP,54,4236  >  443 [ACK] Seq=724 Ack=5672 Win=16640 Len=0,0.06061500000078013
1167949,2286.059053,192.168.0.2,72.21.91.110,TCP,54,4236  >  443 [ACK] Seq=724 Ack=8592 Win=17408 Len=0,0.0018339999992349476
1167952,2286.059977,192.168.0.2,72.21.91.110,TCP,54,4236  >  443 [ACK] Seq=724 Ack=11512 Win=17408 Len=0,0.000923999999940861
1167955,2286.0600489999997,192.168.0.2,72.21.91.110,TCP,54,4236  >  443 [ACK] Seq=724 Ack=14432 Win=17408 Len=0,7.199999981821747e-05
1167958,2286.060117,192.168.0.2,72.21.91.110,TCP,54,4236  >  443 [ACK] Seq=724 Ack=17352 Win=17408 Len=0,6.800000028306386e-05
1167961,2286.060188,192.168.0.2,72.21.91.110,TCP,54,4236  >  443 [ACK] Seq=724 Ack=20272 Win=17408 Len=0,7.099999993442907e-05
1167964,2286.061561,192.168.0.2,72.21.91.110,TCP,54,4236  >  443 [ACK] Seq=724 Ack=22084 Win=17408 Len=0,0.0013730000000578002
1167967,2286.061611,192.168.0.2,72.21.91.110,TCP,54,4236  >  443 [ACK] Seq=724 Ack=22152 Win=17408 Len=0,5.000000010113581e-05
1167971,2286.135749,192.168.0.2,178.48.53.33,UDP,62,12236  >  8999 Len=20,0.07413799999994808
1167973,2286.143698,192.168.0.2,49.130.131.180,UDP,159,12236  >  6881 Len=117,0.007948999999825901
1167974,2286.143805,192.168.0.2,178.48.53.33,UDP,62,12236  >  8999 Len=20,0.00010700000029828516
1167975,2286.143869,192.168.0.2,178.48.53.33,UDP,1468,12236  >  8999 Len=1426,6.399999983841553e-05
1167976,2286.143905,192.168.0.2,178.48.53.33,UDP,1468,12236  >  8999 Len=1426,3.599999990910874e-05
1167977,2286.14394,192.168.0.2,178.48.53.33,UDP,1468,12236  >  8999 Len=1426,3.500000002532033e-05
1167978,2286.143973,192.168.0.2,178.48.53.33,UDP,1468,12236  >  8999 Len=1426,3.300000025774352e-05
1167979,2286.1440079999998,192.168.0.2,178.48.53.33,UDP,1468,12236  >  8999 Len=1426,3.499999957057298e-05
1167980,2286.144041,192.168.0.2,178.48.53.33,UDP,1468,12236  >  8999 Len=1426,3.300000025774352e-05
1167981,2286.144075,192.168.0.2,178.48.53.33,UDP,1468,12236  >  8999 Len=1426,3.400000014153193e-05
1167982,2286.144112,192.168.0.2,178.48.53.33,UDP,1468,12236  >  8999 Len=1426,3.699999979289714e-05
1167983,2286.1441489999997,192.168.0.2,178.48.53.33,UDP,1468,12236  >  8999 Len=1426,3.699999979289714e-05
1167984,2286.144187000001,192.168.0.2,178.48.53.33,UDP,1468,12236  >  8999 Len=1426,3.80000010409276e-05
1167985,2286.144225,192.168.0.2,178.48.53.33,UDP,1468,12236  >  8999 Len=1426,3.7999999221938197e-05
1167986,2286.1442620000007,192.168.0.2,178.48.53.33,UDP,1468,12236  >  8999 Len=1426,3.7000000702391844e-05
1167987,2286.1443,192.168.0.2,178.48.53.33,UDP,1468,12236  >  8999 Len=1426,3.7999999221938197e-05
1167988,2286.144337,192.168.0.2,178.48.53.33,UDP,1468,12236  >  8999 Len=1426,3.700000024764449e-05
1167989,2286.144373,192.168.0.2,178.48.53.33,UDP,1468,12236  >  8999 Len=1426,3.599999990910874e-05
1167990,2286.1444070000002,192.168.0.2,178.48.53.33,UDP,1468,12236  >  8999 Len=1426,3.400000014153193e-05
1167991,2286.144441,192.168.0.2,178.48.53.33,UDP,1468,12236  >  8999 Len=1426,3.399999968678458e-05
1167992,2286.144475,192.168.0.2,178.48.53.33,UDP,1468,12236  >  8999 Len=1426,3.400000014153193e-05
1167993,2286.144506,192.168.0.2,178.48.53.33,UDP,1468,12236  >  8999 Len=1426,3.100000003541936e-05
1167994,2286.144541,192.168.0.2,178.48.53.33,UDP,1468,12236  >  8999 Len=1426,3.500000002532033e-05
1167995,2286.144579,192.168.0.2,178.48.53.33,UDP,1468,12236  >  8999 Len=1426,3.799999967668555e-05
1167996,2286.144616,192.168.0.2,178.48.53.33,UDP,1468,12236  >  8999 Len=1426,3.700000024764449e-05
1167997,2286.1446920000008,192.168.0.2,178.48.53.33,UDP,1468,12236  >  8999 Len=1426,7.600000071761315e-05
1167998,2286.1447350000008,192.168.0.2,178.48.53.33,UDP,1468,12236  >  8999 Len=1426,4.3000000005122274e-05
1167999,2286.144773,192.168.0.2,178.48.53.33,UDP,1468,12236  >  8999 Len=1426,3.7999999221938197e-05
1168000,2286.144808,192.168.0.2,178.48.53.33,UDP,1468,12236  >  8999 Len=1426,3.500000002532033e-05
1168001,2286.144844,192.168.0.2,178.48.53.33,UDP,1468,12236  >  8999 Len=1426,3.599999990910874e-05
1168002,2286.144882,192.168.0.2,178.48.53.33,UDP,1468,12236  >  8999 Len=1426,3.80000001314329e-05
1168003,2286.144918,192.168.0.2,178.48.53.33,UDP,1468,12236  >  8999 Len=1426,3.599999990910874e-05
1168004,2286.144956,192.168.0.2,178.48.53.33,UDP,1468,12236  >  8999 Len=1426,3.80000001314329e-05
1168005,2286.144993,192.168.0.2,178.48.53.33,UDP,1468,12236  >  8999 Len=1426,3.699999979289714e-05
1168006,2286.145029,192.168.0.2,178.48.53.33,UDP,1468,12236  >  8999 Len=1426,3.599999990910874e-05
1168007,2286.145066,192.168.0.2,178.48.53.33,UDP,1468,12236  >  8999 Len=1426,3.700000024764449e-05
1168008,2286.145102,192.168.0.2,178.48.53.33,UDP,1468,12236  >  8999 Len=1426,3.599999990910874e-05
1168009,2286.1451420000008,192.168.0.2,178.48.53.33,UDP,1468,12236  >  8999 Len=1426,4.000000080850441e-05
1168010,2286.145181,192.168.0.2,178.48.53.33,UDP,1468,12236  >  8999 Len=1426,3.89999991057266e-05
1168011,2286.145219,192.168.0.2,178.48.53.33,UDP,1468,12236  >  8999 Len=1426,3.80000001314329e-05
1168012,2286.145255,192.168.0.2,178.48.53.33,UDP,1468,12236  >  8999 Len=1426,3.599999990910874e-05
1168013,2286.145289,192.168.0.2,178.48.53.33,UDP,1468,12236  >  8999 Len=1426,3.400000014153193e-05
1168014,2286.1453239999996,192.168.0.2,178.48.53.33,UDP,1468,12236  >  8999 Len=1426,3.499999957057298e-05
1168015,2286.14536,192.168.0.2,178.48.53.33,UDP,1468,12236  >  8999 Len=1426,3.600000036385609e-05
1168016,2286.145395,192.168.0.2,178.48.53.33,UDP,1468,12236  >  8999 Len=1426,3.500000002532033e-05
1168017,2286.14544,192.168.0.2,178.48.53.33,UDP,1468,12236  >  8999 Len=1426,4.4999999772699084e-05
1168018,2286.1454870000002,192.168.0.2,178.48.53.33,UDP,1468,12236  >  8999 Len=1426,4.7000000449770596e-05
1168019,2286.145565,192.168.0.2,178.48.53.33,UDP,1468,12236  >  8999 Len=1426,7.799999957569526e-05
1168020,2286.145602,192.168.0.2,178.48.53.33,UDP,1468,12236  >  8999 Len=1426,3.700000024764449e-05
1168021,2286.1456350000008,192.168.0.2,178.48.53.33,UDP,1468,12236  >  8999 Len=1426,3.3000000712490873e-05
1168022,2286.14567,192.168.0.2,178.48.53.33,UDP,1468,12236  >  8999 Len=1426,3.499999911582563e-05
1168023,2286.145704,192.168.0.2,178.48.53.33,UDP,1468,12236  >  8999 Len=1426,3.400000014153193e-05
1168024,2286.1457370000007,192.168.0.2,178.48.53.33,UDP,1468,12236  >  8999 Len=1426,3.3000000712490873e-05
1168025,2286.145771,192.168.0.2,178.48.53.33,UDP,1468,12236  >  8999 Len=1426,3.3999999232037226e-05
1168026,2286.145805,192.168.0.2,178.48.53.33,UDP,1468,12236  >  8999 Len=1426,3.400000014153193e-05
1168027,2286.1458390000007,192.168.0.2,178.48.53.33,UDP,1468,12236  >  8999 Len=1426,3.400000059627928e-05
1168028,2286.145872,192.168.0.2,178.48.53.33,UDP,1468,12236  >  8999 Len=1426,3.299999934824882e-05
1168029,2286.145905,192.168.0.2,178.48.53.33,UDP,1468,12236  >  8999 Len=1426,3.299999980299617e-05
1168030,2286.145938,192.168.0.2,178.48.53.33,UDP,1468,12236  >  8999 Len=1426,3.300000025774352e-05
1168031,2286.145971,192.168.0.2,178.48.53.33,UDP,1468,12236  >  8999 Len=1426,3.299999980299617e-05
1168032,2286.1460039999997,192.168.0.2,178.48.53.33,UDP,1468,12236  >  8999 Len=1426,3.299999980299617e-05
1168033,2286.146038,192.168.0.2,178.48.53.33,UDP,1468,12236  >  8999 Len=1426,3.400000014153193e-05
1168034,2286.146072,192.168.0.2,178.48.53.33,UDP,1468,12236  >  8999 Len=1426,3.400000014153193e-05
1168037,2286.190951,192.168.0.2,72.21.91.110,TCP,54,4236  >  443 [ACK] Seq=724 Ack=25072 Win=17408 Len=0,0.044879000000037195
1168040,2286.193281,192.168.0.2,72.21.91.110,TCP,54,4236  >  443 [ACK] Seq=724 Ack=27992 Win=17408 Len=0,0.0023299999998016574
1168043,2286.193362,192.168.0.2,72.21.91.110,TCP,54,4236  >  443 [ACK] Seq=724 Ack=30912 Win=17408 Len=0,8.100000013655517e-05
1168046,2286.193441,192.168.0.2,72.21.91.110,TCP,54,4236  >  443 [ACK] Seq=724 Ack=33832 Win=17408 Len=0,7.899999991423101e-05
1168049,2286.193511,192.168.0.2,72.21.91.110,TCP,54,4236  >  443 [ACK] Seq=724 Ack=36752 Win=17408 Len=0,7.000000005064066e-05
1168051,2286.233198,192.168.0.2,72.21.91.110,TCP,54,4236  >  443 [ACK] Seq=724 Ack=38212 Win=17408 Len=0,0.03968699999995806
1168054,2286.3222690000002,192.168.0.2,72.21.91.110,TCP,54,4236  >  443 [ACK] Seq=724 Ack=41132 Win=17408 Len=0,0.08907100000033097
1168057,2286.322347,192.168.0.2,72.21.91.110,TCP,54,4236  >  443 [ACK] Seq=724 Ack=44052 Win=17408 Len=0,7.799999957569526e-05
1168060,2286.323823,192.168.0.2,72.21.91.110,TCP,54,4236  >  443 [ACK] Seq=724 Ack=46972 Win=17408 Len=0,0.0014760000003661844
1168063,2286.3241129999997,192.168.0.2,72.21.91.110,TCP,54,4236  >  443 [ACK] Seq=724 Ack=49892 Win=17408 Len=0,0.00028999999949519406
1168066,2286.324372,192.168.0.2,72.21.91.110,TCP,54,4236  >  443 [ACK] Seq=724 Ack=52812 Win=17408 Len=0,0.0002590000003692694
1168068,2286.4009079999996,192.168.0.2,72.21.91.110,TCP,54,4236  >  443 [ACK] Seq=724 Ack=54272 Win=17408 Len=0,0.07653599999957805
1168071,2286.45042,192.168.0.2,72.21.91.110,TCP,54,4236  >  443 [ACK] Seq=724 Ack=57192 Win=17408 Len=0,0.049512000000504486
1168074,2286.450797,192.168.0.2,72.21.91.110,TCP,54,4236  >  443 [ACK] Seq=724 Ack=60112 Win=17408 Len=0,0.00037699999984397436
1168077,2286.45572,192.168.0.2,72.21.91.110,TCP,54,4236  >  443 [ACK] Seq=724 Ack=63032 Win=129792 Len=0,0.004922999999962485
1168080,2286.456485,192.168.0.2,72.21.91.110,TCP,54,4236  >  443 [ACK] Seq=724 Ack=65952 Win=129792 Len=0,0.0007650000002286106
1168083,2286.456561,192.168.0.2,72.21.91.110,TCP,54,4236  >  443 [ACK] Seq=724 Ack=68872 Win=129792 Len=0,7.599999980811845e-05
1168086,2286.547016,192.168.0.2,113.193.151.171,UDP,1312,62257  >  50670 Len=1270,0.09045500000001994
1168087,2286.547117,192.168.0.2,113.193.151.171,UDP,1312,62257  >  50670 Len=1270,0.00010100000008606003
1168088,2286.547165,192.168.0.2,113.193.151.171,UDP,1312,62257  >  50670 Len=1270,4.799999987881165e-05
1168089,2286.567678000001,192.168.0.2,72.21.91.110,TCP,54,4236  >  443 [ACK] Seq=724 Ack=70332 Win=129792 Len=0,0.02051300000084666
1168092,2286.577691,192.168.0.2,72.21.91.110,TCP,54,4236  >  443 [ACK] Seq=724 Ack=73252 Win=129792 Len=0,0.010012999999162275
1168095,2286.577938,192.168.0.2,72.21.91.110,TCP,54,4236  >  443 [ACK] Seq=724 Ack=76172 Win=129792 Len=0,0.00024699999994481914
1168098,2286.583876,192.168.0.2,72.21.91.110,TCP,54,4236  >  443 [ACK] Seq=724 Ack=79092 Win=129792 Len=0,0.0059380000002420275
1168101,2286.583993,192.168.0.2,72.21.91.110,TCP,54,4236  >  443 [ACK] Seq=724 Ack=82012 Win=129792 Len=0,0.00011700000004566391
1168104,2286.589434,192.168.0.2,72.21.91.110,TCP,54,4236  >  443 [ACK] Seq=724 Ack=84932 Win=262656 Len=0,0.005440999999791529
1168107,2286.589546,192.168.0.2,72.21.91.110,TCP,54,4236  >  443 [ACK] Seq=724 Ack=87852 Win=262656 Len=0,0.00011200000017197453
1168110,2286.589661,192.168.0.2,72.21.91.110,TCP,54,4236  >  443 [ACK] Seq=724 Ack=90772 Win=262656 Len=0,0.00011499999982333975
1168113,2286.589746,192.168.0.2,72.21.91.110,TCP,54,4236  >  443 [ACK] Seq=724 Ack=93692 Win=262656 Len=0,8.500000012645614e-05
1168116,2286.589831,192.168.0.2,72.21.91.110,TCP,54,4236  >  443 [ACK] Seq=724 Ack=96612 Win=262656 Len=0,8.499999967170879e-05
1168119,2286.589924,192.168.0.2,72.21.91.110,TCP,54,4236  >  443 [ACK] Seq=724 Ack=99532 Win=262656 Len=0,9.300000010625808e-05
1168122,2286.590102,192.168.0.2,72.21.91.110,TCP,54,4236  >  443 [ACK] Seq=724 Ack=102452 Win=262656 Len=0,0.00017800000023271423
1168125,2286.59017,192.168.0.2,72.21.91.110,TCP,54,4236  >  443 [ACK] Seq=724 Ack=105372 Win=262656 Len=0,6.79999998283165e-05
1168128,2286.592658,192.168.0.2,72.21.91.110,TCP,54,4236  >  443 [ACK] Seq=724 Ack=108292 Win=262656 Len=0,0.0024880000000848668
1168131,2286.593366,192.168.0.2,72.21.91.110,TCP,54,4236  >  443 [ACK] Seq=724 Ack=111212 Win=262656 Len=0,0.0007080000000314612
1168134,2286.5939120000007,192.168.0.2,72.21.91.110,TCP,54,4236  >  443 [ACK] Seq=724 Ack=114132 Win=262656 Len=0,0.0005460000006678456
1168137,2286.594235,192.168.0.2,72.21.91.110,TCP,54,4236  >  443 [ACK] Seq=724 Ack=117052 Win=262656 Len=0,0.00032299999929819023
1168139,2286.634736,192.168.0.2,72.21.91.110,TCP,54,4236  >  443 [ACK] Seq=724 Ack=118512 Win=262656 Len=0,0.04050099999994927
1168142,2286.694214,192.168.0.2,72.21.91.110,TCP,54,4236  >  443 [ACK] Seq=724 Ack=121432 Win=262656 Len=0,0.059478000000126485
1168145,2286.7062100000007,192.168.0.2,72.21.91.110,TCP,54,4236  >  443 [ACK] Seq=724 Ack=124352 Win=262656 Len=0,0.011996000000635831
1168148,2286.706291,192.168.0.2,72.21.91.110,TCP,54,4236  >  443 [ACK] Seq=724 Ack=127272 Win=262656 Len=0,8.099999922706047e-05
1168151,2286.708116,192.168.0.2,72.21.91.110,TCP,54,4236  >  443 [ACK] Seq=724 Ack=130192 Win=262656 Len=0,0.0018249999998261046
1168154,2286.7081940000007,192.168.0.2,72.21.91.110,TCP,54,4236  >  443 [ACK] Seq=724 Ack=133112 Win=262656 Len=0,7.800000093993731e-05
1168157,2286.713944,192.168.0.2,72.21.91.110,TCP,54,4236  >  443 [ACK] Seq=724 Ack=136032 Win=262656 Len=0,0.00574999999935244
1168160,2286.714008,192.168.0.2,72.21.91.110,TCP,54,4236  >  443 [ACK] Seq=724 Ack=138952 Win=262656 Len=0,6.399999983841553e-05
1168163,2286.714907,192.168.0.2,72.21.91.110,TCP,54,4236  >  443 [ACK] Seq=724 Ack=141872 Win=262656 Len=0,0.0008990000001176668
1168166,2286.714977,192.168.0.2,72.21.91.110,TCP,54,4236  >  443 [ACK] Seq=724 Ack=144792 Win=262656 Len=0,7.000000005064066e-05
1168169,2286.719273,192.168.0.2,72.21.91.110,TCP,54,4236  >  443 [ACK] Seq=724 Ack=147712 Win=262656 Len=0,0.004296000000067579
1168172,2286.720053,192.168.0.2,72.21.91.110,TCP,54,4236  >  443 [ACK] Seq=724 Ack=150632 Win=262656 Len=0,0.0007799999998496787
1168175,2286.720112,192.168.0.2,72.21.91.110,TCP,54,4236  >  443 [ACK] Seq=724 Ack=153552 Win=262656 Len=0,5.899999996472616e-05
1168178,2286.720182,192.168.0.2,72.21.91.110,TCP,54,4236  >  443 [ACK] Seq=724 Ack=156472 Win=262656 Len=0,7.000000005064066e-05
1168181,2286.72346,192.168.0.2,72.21.91.110,TCP,54,4236  >  443 [ACK] Seq=724 Ack=159392 Win=262656 Len=0,0.0032780000001366716
1168184,2286.723555,192.168.0.2,72.21.91.110,TCP,54,4236  >  443 [ACK] Seq=724 Ack=162312 Win=262656 Len=0,9.49999998738349e-05
1168187,2286.723622,192.168.0.2,72.21.91.110,TCP,54,4236  >  443 [ACK] Seq=724 Ack=165232 Win=262656 Len=0,6.69999999445281e-05
1168190,2286.723686,192.168.0.2,72.21.91.110,TCP,54,4236  >  443 [ACK] Seq=724 Ack=168152 Win=262656 Len=0,6.399999983841553e-05
1168193,2286.72375,192.168.0.2,72.21.91.110,TCP,54,4236  >  443 [ACK] Seq=724 Ack=171072 Win=262656 Len=0,6.400000029316288e-05
1168196,2286.7238350000002,192.168.0.2,72.21.91.110,TCP,54,4236  >  443 [ACK] Seq=724 Ack=173992 Win=262656 Len=0,8.500000012645614e-05
1168199,2286.723998,192.168.0.2,72.21.91.110,TCP,54,4236  >  443 [ACK] Seq=724 Ack=176912 Win=262656 Len=0,0.0001629999997021514
1168202,2286.724168,192.168.0.2,72.21.91.110,TCP,54,4236  >  443 [ACK] Seq=724 Ack=179832 Win=262656 Len=0,0.0001700000002529123
1168205,2286.725237,192.168.0.2,72.21.91.110,TCP,54,4236  >  443 [ACK] Seq=724 Ack=182752 Win=262656 Len=0,0.0010689999999158317
1168208,2286.725319,192.168.0.2,72.21.91.110,TCP,54,4236  >  443 [ACK] Seq=724 Ack=185672 Win=262656 Len=0,8.200000002034358e-05
1168211,2286.7253969999997,192.168.0.2,72.21.91.110,TCP,54,4236  >  443 [ACK] Seq=724 Ack=188592 Win=262656 Len=0,7.799999957569526e-05
1168214,2286.7274199999997,192.168.0.2,72.21.91.110,TCP,54,4236  >  443 [ACK] Seq=724 Ack=191512 Win=262656 Len=0,0.0020230000000083237
1168217,2286.7278100000008,192.168.0.2,72.21.91.110,TCP,54,4236  >  443 [ACK] Seq=724 Ack=194432 Win=262656 Len=0,0.00039000000106170774
1168220,2286.727924,192.168.0.2,72.21.91.110,TCP,54,4236  >  443 [ACK] Seq=724 Ack=197352 Win=262656 Len=0,0.00011399999903005664
1168223,2286.729159,192.168.0.2,72.21.91.110,TCP,54,4236  >  443 [ACK] Seq=724 Ack=200272 Win=262656 Len=0,0.001235000000178843
1168226,2286.729259,192.168.0.2,72.21.91.110,TCP,54,4236  >  443 [ACK] Seq=724 Ack=203192 Win=262656 Len=0,0.00010000000020227162
1168229,2286.729325,192.168.0.2,72.21.91.110,TCP,54,4236  >  443 [ACK] Seq=724 Ack=206112 Win=262656 Len=0,6.599999960599234e-05
1168232,2286.729401,192.168.0.2,72.21.91.110,TCP,54,4236  >  443 [ACK] Seq=724 Ack=209032 Win=262656 Len=0,7.60000002628658e-05
1168235,2286.729471,192.168.0.2,72.21.91.110,TCP,54,4236  >  443 [ACK] Seq=724 Ack=211952 Win=262656 Len=0,7.000000005064066e-05
1168238,2286.729543,192.168.0.2,72.21.91.110,TCP,54,4236  >  443 [ACK] Seq=724 Ack=214872 Win=262656 Len=0,7.199999981821747e-05
1168241,2286.732909,192.168.0.2,178.48.53.33,UDP,1468,12236  >  8999 Len=1426,0.003365999999914493
1168247,2286.733344,192.168.0.2,178.48.53.33,UDP,1468,12236  >  8999 Len=1426,0.00043500000037965947
1168248,2286.7333949999997,192.168.0.2,178.48.53.33,UDP,1468,12236  >  8999 Len=1426,5.0999999530176865e-05
1168249,2286.733446,192.168.0.2,178.48.53.33,UDP,1468,12236  >  8999 Len=1426,5.100000043967157e-05
1168250,2286.733489,192.168.0.2,178.48.53.33,UDP,1468,12236  >  8999 Len=1426,4.3000000005122274e-05
1168251,2286.7335350000008,192.168.0.2,178.48.53.33,UDP,1468,12236  >  8999 Len=1426,4.600000056598219e-05
1168252,2286.733576,192.168.0.2,178.48.53.33,UDP,1468,12236  >  8999 Len=1426,4.099999932805076e-05
1168253,2286.733623,192.168.0.2,178.48.53.33,UDP,1468,12236  >  8999 Len=1426,4.6999999995023245e-05
1168254,2286.733656,192.168.0.2,178.48.53.33,UDP,1468,12236  >  8999 Len=1426,3.299999980299617e-05
1168255,2286.733686,192.168.0.2,178.48.53.33,UDP,1468,12236  >  8999 Len=1426,3.0000000151630957e-05
1168256,2286.733723,192.168.0.2,178.48.53.33,UDP,1468,12236  >  8999 Len=1426,3.699999979289714e-05
1168258,2286.737004,192.168.0.2,178.48.53.33,UDP,1468,12236  >  8999 Len=1426,0.003281000000242784
1168259,2286.737048,192.168.0.2,178.48.53.33,UDP,1468,12236  >  8999 Len=1426,4.399999988891068e-05
1168260,2286.741954,192.168.0.2,104.25.202.21,TLSv1.2,347,Application Data,0.004906000000119093
1168261,2286.745605,192.168.0.2,104.25.202.21,TLSv1.2,198,Application Data,0.003650999999990745
1168262,2286.745759,192.168.0.2,104.25.202.21,TLSv1.2,195,Application Data,0.00015399999983856105
1168263,2286.751814,192.168.0.2,104.25.202.21,TLSv1.2,187,Application Data,0.006055000000287691
1168267,2286.7621289999997,192.168.0.2,72.21.91.110,TCP,54,4236  >  443 [ACK] Seq=724 Ack=217792 Win=528384 Len=0,0.010314999999536667
1168270,2286.770227,192.168.0.2,104.25.202.21,TCP,54,4218  >  443 [ACK] Seq=3230 Ack=13239257 Win=1959168 Len=0,0.00809800000024552
1168273,2286.770779,192.168.0.2,104.25.202.21,TCP,54,4218  >  443 [ACK] Seq=3230 Ack=13242053 Win=1959168 Len=0,0.000551999999970576
1168275,2286.7720480000007,192.168.0.2,104.25.202.21,TLSv1.2,157,Application Data,0.0012690000007751223
1168276,2286.772739,192.168.0.2,104.25.202.21,TLSv1.2,147,Application Data,0.0006909999992785743
1168277,2286.772797,192.168.0.2,104.25.202.21,TLSv1.2,146,Application Data,5.800000008093775e-05
1168279,2286.775589,192.168.0.2,104.25.202.21,TCP,54,4218  >  443 [ACK] Seq=3518 Ack=13244822 Win=1959168 Len=0,0.002791999999772088
1168281,2286.776546,192.168.0.2,104.25.202.21,TCP,54,4218  >  443 [ACK] Seq=3518 Ack=13246220 Win=1957888 Len=0,0.0009570000001986045
1168283,2286.776617,192.168.0.2,104.25.202.21,TCP,54,4218  >  443 [ACK] Seq=3518 Ack=13247618 Win=1959168 Len=0,7.099999993442907e-05
1168285,2286.776678,192.168.0.2,104.25.202.21,TCP,54,4218  >  443 [ACK] Seq=3518 Ack=13249078 Win=1959168 Len=0,6.100000018705032e-05
1168288,2286.77675,192.168.0.2,104.25.202.21,TCP,54,4218  >  443 [ACK] Seq=3518 Ack=13251874 Win=1959168 Len=0,7.199999981821747e-05
1168290,2286.777609,192.168.0.2,104.25.202.21,TCP,54,4218  >  443 [ACK] Seq=3518 Ack=13253334 Win=1959168 Len=0,0.0008590000002186571
1168292,2286.777664,192.168.0.2,104.25.202.21,TCP,54,4218  >  443 [ACK] Seq=3518 Ack=13254794 Win=1959168 Len=0,5.499999997482519e-05
1168295,2286.7793030000007,192.168.0.2,104.25.202.21,TCP,54,4218  >  443 [ACK] Seq=3518 Ack=13257466 Win=1959168 Len=0,0.0016390000005230831
1168297,2286.788064,192.168.0.2,47.188.177.63,UDP,145,12236  >  6881 Len=103,0.00876099999914004
1168300,2286.792775,192.168.0.2,104.25.202.21,TCP,54,4218  >  443 [ACK] Seq=3518 Ack=13259099 Win=1959168 Len=0,0.004711000000042986
1168303,2286.793043,192.168.0.2,104.25.202.21,TCP,54,4218  >  443 [ACK] Seq=3518 Ack=13259812 Win=1958400 Len=0,0.00026800000023285975
1168306,2286.79323,192.168.0.2,104.25.202.21,TCP,54,4218  >  443 [ACK] Seq=3518 Ack=13260812 Win=1959168 Len=0,0.00018700000009630457
1168309,2286.798905,192.168.0.2,104.25.202.21,TCP,54,4218  >  443 [ACK] Seq=3518 Ack=13263608 Win=1959168 Len=0,0.005674999999882857
1168312,2286.799221,192.168.0.2,104.25.202.21,TCP,54,4218  >  443 [ACK] Seq=3518 Ack=13266466 Win=1959168 Len=0,0.0003160000001116714
1168315,2286.7992679999998,192.168.0.2,104.25.202.21,TCP,54,4218  >  443 [ACK] Seq=3518 Ack=13267759 Win=1957888 Len=0,4.6999999540275894e-05
1168317,2286.8055879999997,192.168.0.2,178.48.53.33,UDP,1468,12236  >  8999 Len=1426,0.006319999999959691
1168318,2286.80565,192.168.0.2,178.48.53.33,UDP,1468,12236  >  8999 Len=1426,6.200000007083872e-05
1168320,2286.8058,192.168.0.2,178.48.53.33,UDP,1468,12236  >  8999 Len=1426,0.00015000000030340743
1168321,2286.805855,192.168.0.2,178.48.53.33,UDP,1468,12236  >  8999 Len=1426,5.499999997482519e-05
1168323,2286.811773,192.168.0.2,178.48.53.33,UDP,1468,12236  >  8999 Len=1426,0.005917999999837775
1168325,2286.8121149999997,192.168.0.2,178.48.53.33,UDP,1468,12236  >  8999 Len=1426,0.00034199999981865403
1168326,2286.812198,192.168.0.2,178.48.53.33,UDP,1468,12236  >  8999 Len=1426,8.300000035887933e-05
1168328,2286.818566,192.168.0.2,178.48.53.33,UDP,1468,12236  >  8999 Len=1426,0.006367999999838503
1168347,2286.8198620000007,192.168.0.2,178.48.53.33,UDP,1468,12236  >  8999 Len=1426,0.0012960000008206407
1168348,2286.819918,192.168.0.2,178.48.53.33,UDP,1468,12236  >  8999 Len=1426,5.599999940386624e-05
1168349,2286.819969,192.168.0.2,178.48.53.33,UDP,1468,12236  >  8999 Len=1426,5.0999999984924216e-05
1168350,2286.820011,192.168.0.2,178.48.53.33,UDP,1468,12236  >  8999 Len=1426,4.199999966658652e-05
1168351,2286.820055,192.168.0.2,178.48.53.33,UDP,1468,12236  >  8999 Len=1426,4.400000034365803e-05
1168352,2286.820093,192.168.0.2,178.48.53.33,UDP,1468,12236  >  8999 Len=1426,3.799999967668555e-05
1168353,2286.820136,192.168.0.2,178.48.53.33,UDP,1468,12236  >  8999 Len=1426,4.3000000005122274e-05
1168354,2286.820164,192.168.0.2,178.48.53.33,UDP,1468,12236  >  8999 Len=1426,2.8000000384054147e-05
