No.,Time,Source,Destination,Protocol,Length,Info
1167490,2284.784527,192.168.0.2,213.160.141.62,UDP,159,12236  >  61921 Len=117
1167491,2284.784863,192.168.0.2,5.137.190.58,UDP,159,12236  >  6881 Len=117
1167492,2284.785112,192.168.0.2,27.72.45.42,UDP,159,12236  >  30215 Len=117
1167493,2284.785232,192.168.0.2,79.182.11.233,UDP,159,12236  >  14443 Len=117
1167496,2284.786597,192.168.0.2,104.25.202.21,TCP,54,4218  >  443 [ACK] Seq=2519 Ack=13000798 Win=1959168 Len=0
1167499,2284.786669,192.168.0.2,104.25.202.21,TCP,54,4218  >  443 [ACK] Seq=2519 Ack=13003718 Win=1959168 Len=0
1167502,2284.786746,192.168.0.2,104.25.202.21,TCP,54,4218  >  443 [ACK] Seq=2519 Ack=13006638 Win=1959168 Len=0
1167508,2284.786893,192.168.0.2,104.25.202.21,TCP,54,4218  >  443 [ACK] Seq=2519 Ack=13009558 Win=1959168 Len=0
1167511,2284.7869600000004,192.168.0.2,104.25.202.21,TCP,54,4218  >  443 [ACK] Seq=2519 Ack=13012478 Win=1959168 Len=0
1167514,2284.787583,192.168.0.2,104.25.202.21,TCP,54,4218  >  443 [ACK] Seq=2519 Ack=13015398 Win=1959168 Len=0
1167517,2284.787662,192.168.0.2,104.25.202.21,TCP,54,4218  >  443 [ACK] Seq=2519 Ack=13018318 Win=1959168 Len=0
1167531,2284.789193,192.168.0.2,104.25.202.21,TCP,54,4218  >  443 [ACK] Seq=2519 Ack=13021238 Win=1959168 Len=0
1167536,2284.793739,192.168.0.2,104.25.202.21,TCP,54,4218  >  443 [ACK] Seq=2519 Ack=13024158 Win=1959168 Len=0
1167539,2284.793821,192.168.0.2,104.25.202.21,TCP,54,4218  >  443 [ACK] Seq=2519 Ack=13027078 Win=1959168 Len=0
1167540,2284.793831,192.168.0.2,106.71.19.184,BitTorrent,61,Port  
1167543,2284.79389,192.168.0.2,104.25.202.21,TCP,54,4218  >  443 [ACK] Seq=2519 Ack=13029998 Win=1959168 Len=0
1167546,2284.7939530000003,192.168.0.2,104.25.202.21,TCP,54,4218  >  443 [ACK] Seq=2519 Ack=13032918 Win=1959168 Len=0
1167549,2284.794018,192.168.0.2,104.25.202.21,TCP,54,4218  >  443 [ACK] Seq=2519 Ack=13035838 Win=1959168 Len=0
1167552,2284.794087,192.168.0.2,104.25.202.21,TCP,54,4218  >  443 [ACK] Seq=2519 Ack=13038758 Win=1959168 Len=0
1167555,2284.794159,192.168.0.2,104.25.202.21,TCP,54,4218  >  443 [ACK] Seq=2519 Ack=13041678 Win=1959168 Len=0
1167558,2284.7942350000003,192.168.0.2,104.25.202.21,TCP,54,4218  >  443 [ACK] Seq=2519 Ack=13044598 Win=1959168 Len=0
1167561,2284.794312,192.168.0.2,104.25.202.21,TCP,54,4218  >  443 [ACK] Seq=2519 Ack=13047518 Win=1959168 Len=0
1167564,2284.794382,192.168.0.2,104.25.202.21,TCP,54,4218  >  443 [ACK] Seq=2519 Ack=13050438 Win=1959168 Len=0
1167567,2284.79445,192.168.0.2,104.25.202.21,TCP,54,4218  >  443 [ACK] Seq=2519 Ack=13053358 Win=1959168 Len=0
1167570,2284.794679,192.168.0.2,104.25.202.21,TCP,54,4218  >  443 [ACK] Seq=2519 Ack=13056278 Win=1959168 Len=0
1167573,2284.794752,192.168.0.2,104.25.202.21,TCP,54,4218  >  443 [ACK] Seq=2519 Ack=13059198 Win=1959168 Len=0
1167576,2284.796996,192.168.0.2,104.25.202.21,TCP,54,4218  >  443 [ACK] Seq=2519 Ack=13062118 Win=1959168 Len=0
1167579,2284.797068,192.168.0.2,104.25.202.21,TCP,54,4218  >  443 [ACK] Seq=2519 Ack=13065038 Win=1959168 Len=0
1167582,2284.7971420000003,192.168.0.2,104.25.202.21,TCP,54,4218  >  443 [ACK] Seq=2519 Ack=13067958 Win=1959168 Len=0
1167585,2284.797213,192.168.0.2,104.25.202.21,TCP,54,4218  >  443 [ACK] Seq=2519 Ack=13070878 Win=1959168 Len=0
1167588,2284.797285,192.168.0.2,104.25.202.21,TCP,54,4218  >  443 [ACK] Seq=2519 Ack=13073798 Win=1959168 Len=0
1167592,2284.801568,192.168.0.2,104.25.202.21,TCP,54,4218  >  443 [ACK] Seq=2519 Ack=13076718 Win=1959168 Len=0
1167595,2284.80167,192.168.0.2,104.25.202.21,TCP,54,4218  >  443 [ACK] Seq=2519 Ack=13079638 Win=1959168 Len=0
1167598,2284.801751,192.168.0.2,104.25.202.21,TCP,54,4218  >  443 [ACK] Seq=2519 Ack=13082558 Win=1959168 Len=0
1167601,2284.8018239999997,192.168.0.2,104.25.202.21,TCP,54,4218  >  443 [ACK] Seq=2519 Ack=13085478 Win=1959168 Len=0
1167604,2284.801894,192.168.0.2,104.25.202.21,TCP,54,4218  >  443 [ACK] Seq=2519 Ack=13088398 Win=1959168 Len=0
1167607,2284.801952,192.168.0.2,104.25.202.21,TCP,54,4218  >  443 [ACK] Seq=2519 Ack=13091318 Win=1959168 Len=0
1167610,2284.802019,192.168.0.2,104.25.202.21,TCP,54,4218  >  443 [ACK] Seq=2519 Ack=13094238 Win=1959168 Len=0
1167613,2284.8020899999997,192.168.0.2,104.25.202.21,TCP,54,4218  >  443 [ACK] Seq=2519 Ack=13097158 Win=1959168 Len=0
1167616,2284.802327,192.168.0.2,104.25.202.21,TCP,54,4218  >  443 [ACK] Seq=2519 Ack=13100078 Win=1959168 Len=0
1167619,2284.802389,192.168.0.2,104.25.202.21,TCP,54,4218  >  443 [ACK] Seq=2519 Ack=13102998 Win=1959168 Len=0
1167622,2284.8024579999997,192.168.0.2,104.25.202.21,TCP,54,4218  >  443 [ACK] Seq=2519 Ack=13105918 Win=1959168 Len=0
1167625,2284.805124,192.168.0.2,104.25.202.21,TCP,54,4218  >  443 [ACK] Seq=2519 Ack=13108838 Win=1959168 Len=0
1167628,2284.805206,192.168.0.2,104.25.202.21,TCP,54,4218  >  443 [ACK] Seq=2519 Ack=13111758 Win=1959168 Len=0
1167629,2284.805666,192.168.0.2,201.52.67.173,TCP,66,[TCP Retransmission] 4228  >  12236 [SYN] Seq=0 Win=17520 Len=0 MSS=1460 WS=256 SACK_PERM=1
1167632,2284.80856,192.168.0.2,104.25.202.21,TCP,54,4218  >  443 [ACK] Seq=2519 Ack=13114678 Win=1959168 Len=0
1167635,2284.808629,192.168.0.2,104.25.202.21,TCP,54,4218  >  443 [ACK] Seq=2519 Ack=13117598 Win=1959168 Len=0
1167638,2284.80869,192.168.0.2,104.25.202.21,TCP,54,4218  >  443 [ACK] Seq=2519 Ack=13120518 Win=1959168 Len=0
1167641,2284.8087570000002,192.168.0.2,104.25.202.21,TCP,54,4218  >  443 [ACK] Seq=2519 Ack=13123438 Win=1959168 Len=0
1167644,2284.808823,192.168.0.2,104.25.202.21,TCP,54,4218  >  443 [ACK] Seq=2519 Ack=13126358 Win=1959168 Len=0
1167647,2284.808888,192.168.0.2,104.25.202.21,TCP,54,4218  >  443 [ACK] Seq=2519 Ack=13129278 Win=1959168 Len=0
1167650,2284.8089609999997,192.168.0.2,104.25.202.21,TCP,54,4218  >  443 [ACK] Seq=2519 Ack=13132198 Win=1959168 Len=0
1167653,2284.809028,192.168.0.2,104.25.202.21,TCP,54,4218  >  443 [ACK] Seq=2519 Ack=13135118 Win=1959168 Len=0
1167656,2284.812042,192.168.0.2,104.25.202.21,TCP,54,4218  >  443 [ACK] Seq=2519 Ack=13138038 Win=1959168 Len=0
1167659,2284.812128,192.168.0.2,104.25.202.21,TCP,54,4218  >  443 [ACK] Seq=2519 Ack=13140958 Win=1959168 Len=0
1167662,2284.812202,192.168.0.2,104.25.202.21,TCP,54,4218  >  443 [ACK] Seq=2519 Ack=13143878 Win=1959168 Len=0
1167665,2284.8122789999998,192.168.0.2,104.25.202.21,TCP,54,4218  >  443 [ACK] Seq=2519 Ack=13146798 Win=1959168 Len=0
1167668,2284.812347,192.168.0.2,104.25.202.21,TCP,54,4218  >  443 [ACK] Seq=2519 Ack=13149718 Win=1959168 Len=0
1167671,2284.8124199999997,192.168.0.2,104.25.202.21,TCP,54,4218  >  443 [ACK] Seq=2519 Ack=13152638 Win=1959168 Len=0
1167674,2284.812491,192.168.0.2,104.25.202.21,TCP,54,4218  >  443 [ACK] Seq=2519 Ack=13155558 Win=1959168 Len=0
1167677,2284.812553,192.168.0.2,104.25.202.21,TCP,54,4218  >  443 [ACK] Seq=2519 Ack=13158478 Win=1959168 Len=0
1167680,2284.8127210000002,192.168.0.2,104.25.202.21,TCP,54,4218  >  443 [ACK] Seq=2519 Ack=13161398 Win=1959168 Len=0
1167691,2284.818618,192.168.0.2,104.25.202.21,TCP,54,4218  >  443 [ACK] Seq=2519 Ack=13164318 Win=1959168 Len=0
1167694,2284.818701,192.168.0.2,104.25.202.21,TCP,54,4218  >  443 [ACK] Seq=2519 Ack=13167238 Win=1959168 Len=0
1167697,2284.818765,192.168.0.2,104.25.202.21,TCP,54,4218  >  443 [ACK] Seq=2519 Ack=13170158 Win=1959168 Len=0
1167700,2284.818833,192.168.0.2,104.25.202.21,TCP,54,4218  >  443 [ACK] Seq=2519 Ack=13173078 Win=1959168 Len=0
1167703,2284.818906,192.168.0.2,104.25.202.21,TCP,54,4218  >  443 [ACK] Seq=2519 Ack=13175998 Win=1959168 Len=0
1167706,2284.818975,192.168.0.2,104.25.202.21,TCP,54,4218  >  443 [ACK] Seq=2519 Ack=13178918 Win=1959168 Len=0
1167709,2284.819027,192.168.0.2,104.25.202.21,TCP,54,4218  >  443 [ACK] Seq=2519 Ack=13180404 Win=1959168 Len=0
1167720,2284.886105,192.168.0.2,45.33.3.7,TCP,66,4235  >  443 [SYN] Seq=0 Win=17520 Len=0 MSS=1460 WS=256 SACK_PERM=1
1167734,2284.976574,192.168.0.2,201.52.67.173,UDP,62,12236  >  12236 Len=20
1167751,2285.001563,192.168.0.2,178.48.53.33,UDP,1123,12236  >  8999 Len=1081
1167765,2285.05817,192.168.0.2,45.33.3.7,TCP,54,4235  >  443 [ACK] Seq=1 Ack=1 Win=17408 Len=0
1167766,2285.0592579999998,192.168.0.2,45.33.3.7,TLSv1.2,270,Client Hello
1167769,2285.077194,192.168.0.2,201.6.2.77,DNS,78,Standard query 0x0ae9 AAAA assets.zendesk.com
1167772,2285.105696,192.168.0.2,72.21.91.110,TCP,66,4236  >  443 [SYN] Seq=0 Win=17520 Len=0 MSS=1460 WS=256 SACK_PERM=1
1167784,2285.218617,192.168.0.2,104.25.202.21,TCP,54,4218  >  443 [ACK] Seq=2519 Ack=13183324 Win=1959168 Len=0
1167787,2285.218682,192.168.0.2,104.25.202.21,TCP,54,4218  >  443 [ACK] Seq=2519 Ack=13186244 Win=1959168 Len=0
1167790,2285.218839,192.168.0.2,104.25.202.21,TCP,54,4218  >  443 [ACK] Seq=2519 Ack=13189164 Win=1959168 Len=0
1167793,2285.220071,192.168.0.2,104.25.202.21,TCP,54,4218  >  443 [ACK] Seq=2519 Ack=13192084 Win=1959168 Len=0
1167796,2285.220136,192.168.0.2,104.25.202.21,TCP,54,4218  >  443 [ACK] Seq=2519 Ack=13195004 Win=1959168 Len=0
1167799,2285.220206,192.168.0.2,104.25.202.21,TCP,54,4218  >  443 [ACK] Seq=2519 Ack=13196571 Win=1959168 Len=0
1167802,2285.220275,192.168.0.2,104.25.202.21,TCP,54,4218  >  443 [ACK] Seq=2519 Ack=13199491 Win=1959168 Len=0
1167805,2285.2220399999997,192.168.0.2,104.25.202.21,TCP,54,4218  >  443 [ACK] Seq=2519 Ack=13202411 Win=1959168 Len=0
1167808,2285.2254550000002,192.168.0.2,104.25.202.21,TCP,54,4218  >  443 [ACK] Seq=2519 Ack=13205331 Win=1959168 Len=0
1167811,2285.2258899999997,192.168.0.2,104.25.202.21,TCP,54,4218  >  443 [ACK] Seq=2519 Ack=13208251 Win=1959168 Len=0
1167814,2285.22623,192.168.0.2,104.25.202.21,TCP,54,4218  >  443 [ACK] Seq=2519 Ack=13211171 Win=1959168 Len=0
1167817,2285.2266010000003,192.168.0.2,104.25.202.21,TCP,54,4218  >  443 [ACK] Seq=2519 Ack=13214091 Win=1959168 Len=0
1167820,2285.2267420000003,192.168.0.2,104.25.202.21,TCP,54,4218  >  443 [ACK] Seq=2519 Ack=13217011 Win=1959168 Len=0
1167823,2285.2268129999998,192.168.0.2,104.25.202.21,TCP,54,4218  >  443 [ACK] Seq=2519 Ack=13219931 Win=1959168 Len=0
1167826,2285.226877,192.168.0.2,104.25.202.21,TCP,54,4218  >  443 [ACK] Seq=2519 Ack=13222851 Win=1959168 Len=0
1167829,2285.226946,192.168.0.2,104.25.202.21,TCP,54,4218  >  443 [ACK] Seq=2519 Ack=13225771 Win=1959168 Len=0
1167832,2285.227141,192.168.0.2,104.25.202.21,TCP,54,4218  >  443 [ACK] Seq=2519 Ack=13228691 Win=1959168 Len=0
1167835,2285.227211,192.168.0.2,104.25.202.21,TCP,54,4218  >  443 [ACK] Seq=2519 Ack=13231611 Win=1959168 Len=0
1167838,2285.227291,192.168.0.2,104.25.202.21,TCP,54,4218  >  443 [ACK] Seq=2519 Ack=13234531 Win=1959168 Len=0
1167841,2285.227393,192.168.0.2,104.25.202.21,TCP,54,4218  >  443 [ACK] Seq=2519 Ack=13236461 Win=1959168 Len=0
1167847,2285.239535,192.168.0.2,45.33.3.7,TCP,54,4235  >  443 [ACK] Seq=217 Ack=2921 Win=17408 Len=0
1167852,2285.247141,192.168.0.2,45.33.3.7,TLSv1.2,180,"Client Key Exchange, Change Cipher Spec, Hello Request, Hello Request"
1167855,2285.256664,192.168.0.2,106.71.19.184,GVSP,331,Unknown Format (0x70) [Block ID: 14953 Packet ID: 3553898] Unknown Payload Type (0x3866) 
1167857,2285.2625120000002,192.168.0.2,72.21.91.110,TCP,54,4236  >  443 [ACK] Seq=1 Ack=1 Win=17408 Len=0
1167858,2285.262702,192.168.0.2,72.21.91.110,TLSv1.2,260,Client Hello
1167872,2285.3689440000003,192.168.0.2,23.73.74.14,TCP,66,4238  >  443 [SYN] Seq=0 Win=17520 Len=0 MSS=1460 WS=256 SACK_PERM=1
1167874,2285.395113,192.168.0.2,23.73.74.14,TCP,54,4238  >  443 [ACK] Seq=1 Ack=1 Win=17408 Len=0
1167875,2285.395344,192.168.0.2,23.73.74.14,TLSv1.2,571,Client Hello
1167878,2285.414419,192.168.0.2,45.33.3.7,TLSv1.2,550,Application Data
1167889,2285.431632,192.168.0.2,72.21.91.110,TCP,54,4236  >  443 [ACK] Seq=207 Ack=2921 Win=17408 Len=0
1167892,2285.443304,192.168.0.2,72.21.91.110,TCP,54,4236  >  443 [ACK] Seq=207 Ack=4978 Win=17408 Len=0
1167893,2285.444851,192.168.0.2,72.21.91.110,TLSv1.2,180,"Client Key Exchange, Change Cipher Spec, Hello Request, Hello Request"
1167894,2285.448445,192.168.0.2,72.21.91.110,TLSv1.2,147,Application Data
1167895,2285.448602,192.168.0.2,72.21.91.110,TLSv1.2,314,Application Data
1167899,2285.460791,192.168.0.2,23.73.74.14,TLSv1.2,105,"Change Cipher Spec, Hello Request, Hello Request"
1167900,2285.4615280000003,192.168.0.2,23.73.74.14,TLSv1.2,147,Application Data
1167901,2285.461819,192.168.0.2,23.73.74.14,TLSv1.2,713,Application Data
1167907,2285.4799,192.168.0.2,23.73.74.14,TLSv1.2,92,Application Data
1167908,2285.484586,192.168.0.2,113.193.151.171,UDP,1312,62257  >  50670 Len=1270
1167909,2285.484589,192.168.0.2,188.49.129.56,GVSP,62,Unknown Format (0x28) [Block ID: 16865311826554962768 Packet ID: 951267160] [RANGE_ERROR] Unknown Payload Type (0x0) 
1167913,2285.573556,192.168.0.2,45.33.3.7,TCP,54,4235  >  443 [ACK] Seq=839 Ack=7255 Win=17408 Len=0
1167916,2285.573947,192.168.0.2,45.33.3.7,TCP,54,4235  >  443 [ACK] Seq=839 Ack=10175 Win=17408 Len=0
1167919,2285.57402,192.168.0.2,45.33.3.7,TCP,54,4235  >  443 [ACK] Seq=839 Ack=12001 Win=17408 Len=0
1167921,2285.578079,192.168.0.2,72.21.91.110,TCP,66,[TCP Dup ACK 1167892#1] 4236  >  443 [ACK] Seq=686 Ack=4978 Win=17408 Len=0 SLE=5220 SRE=5288
1167923,2285.5781260000003,192.168.0.2,72.21.91.110,TCP,66,[TCP Dup ACK 1167892#2] 4236  >  443 [ACK] Seq=686 Ack=4978 Win=17408 Len=0 SLE=5220 SRE=5326
1167925,2285.578152,192.168.0.2,72.21.91.110,TCP,66,[TCP Dup ACK 1167892#3] 4236  >  443 [ACK] Seq=686 Ack=4978 Win=17408 Len=0 SLE=5220 SRE=5368
1167927,2285.58128,192.168.0.2,72.21.91.110,TCP,54,4236  >  443 [ACK] Seq=686 Ack=5368 Win=16896 Len=0
1167928,2285.5815030000003,192.168.0.2,72.21.91.110,TLSv1.2,92,Application Data
1167930,2285.692876,192.168.0.2,23.73.74.14,TCP,54,4238  >  443 [ACK] Seq=1359 Ack=845 Win=16640 Len=0
1167932,2285.706409,192.168.0.2,72.21.91.110,TCP,66,[TCP Dup ACK 1167927#1] 4236  >  443 [ACK] Seq=724 Ack=5368 Win=16896 Len=0 SLE=4978 SRE=5220
1167934,2285.789467,192.168.0.2,177.203.49.96,UDP,159,12236  >  1024 Len=117
1167935,2285.789633,192.168.0.2,164.138.38.112,UDP,159,12236  >  49001 Len=117
1167936,2285.789757,192.168.0.2,105.104.121.127,UDP,159,12236  >  47783 Len=117
1167937,2285.7898600000003,192.168.0.2,89.177.10.123,UDP,159,12236  >  24209 Len=117
1167938,2285.798923,192.168.0.2,45.33.3.7,TLSv1.2,592,Application Data
1167940,2285.90818,192.168.0.2,113.193.151.171,UDP,1312,62257  >  50670 Len=1270
1167942,2285.983759,192.168.0.2,24.226.180.60,GVSP,62,Unknown Format (0x28) [Block ID: 7081337014431302468 Packet ID: -1454349134] [BLOCK_DROPPED] Unknown Payload Type (0x0) 
1167943,2285.996604,192.168.0.2,45.33.3.7,TCP,54,4235  >  443 [ACK] Seq=1377 Ack=12614 Win=16896 Len=0
1167946,2286.0572190000003,192.168.0.2,72.21.91.110,TCP,54,4236  >  443 [ACK] Seq=724 Ack=5672 Win=16640 Len=0
1167949,2286.059053,192.168.0.2,72.21.91.110,TCP,54,4236  >  443 [ACK] Seq=724 Ack=8592 Win=17408 Len=0
1167952,2286.059977,192.168.0.2,72.21.91.110,TCP,54,4236  >  443 [ACK] Seq=724 Ack=11512 Win=17408 Len=0
1167955,2286.0600489999997,192.168.0.2,72.21.91.110,TCP,54,4236  >  443 [ACK] Seq=724 Ack=14432 Win=17408 Len=0
1167958,2286.060117,192.168.0.2,72.21.91.110,TCP,54,4236  >  443 [ACK] Seq=724 Ack=17352 Win=17408 Len=0
1167961,2286.060188,192.168.0.2,72.21.91.110,TCP,54,4236  >  443 [ACK] Seq=724 Ack=20272 Win=17408 Len=0
1167964,2286.061561,192.168.0.2,72.21.91.110,TCP,54,4236  >  443 [ACK] Seq=724 Ack=22084 Win=17408 Len=0
1167967,2286.061611,192.168.0.2,72.21.91.110,TCP,54,4236  >  443 [ACK] Seq=724 Ack=22152 Win=17408 Len=0
1167971,2286.135749,192.168.0.2,178.48.53.33,UDP,62,12236  >  8999 Len=20
1167973,2286.143698,192.168.0.2,49.130.131.180,UDP,159,12236  >  6881 Len=117
1167974,2286.143805,192.168.0.2,178.48.53.33,UDP,62,12236  >  8999 Len=20
1167975,2286.143869,192.168.0.2,178.48.53.33,UDP,1468,12236  >  8999 Len=1426
1167976,2286.143905,192.168.0.2,178.48.53.33,UDP,1468,12236  >  8999 Len=1426
1167977,2286.14394,192.168.0.2,178.48.53.33,UDP,1468,12236  >  8999 Len=1426
1167978,2286.143973,192.168.0.2,178.48.53.33,UDP,1468,12236  >  8999 Len=1426
1167979,2286.1440079999998,192.168.0.2,178.48.53.33,UDP,1468,12236  >  8999 Len=1426
1167980,2286.144041,192.168.0.2,178.48.53.33,UDP,1468,12236  >  8999 Len=1426
1167981,2286.144075,192.168.0.2,178.48.53.33,UDP,1468,12236  >  8999 Len=1426
1167982,2286.144112,192.168.0.2,178.48.53.33,UDP,1468,12236  >  8999 Len=1426
1167983,2286.1441489999997,192.168.0.2,178.48.53.33,UDP,1468,12236  >  8999 Len=1426
1167984,2286.1441870000003,192.168.0.2,178.48.53.33,UDP,1468,12236  >  8999 Len=1426
1167985,2286.144225,192.168.0.2,178.48.53.33,UDP,1468,12236  >  8999 Len=1426
1167986,2286.1442620000003,192.168.0.2,178.48.53.33,UDP,1468,12236  >  8999 Len=1426
1167987,2286.1443,192.168.0.2,178.48.53.33,UDP,1468,12236  >  8999 Len=1426
1167988,2286.144337,192.168.0.2,178.48.53.33,UDP,1468,12236  >  8999 Len=1426
1167989,2286.144373,192.168.0.2,178.48.53.33,UDP,1468,12236  >  8999 Len=1426
1167990,2286.1444070000002,192.168.0.2,178.48.53.33,UDP,1468,12236  >  8999 Len=1426
1167991,2286.144441,192.168.0.2,178.48.53.33,UDP,1468,12236  >  8999 Len=1426
1167992,2286.144475,192.168.0.2,178.48.53.33,UDP,1468,12236  >  8999 Len=1426
1167993,2286.144506,192.168.0.2,178.48.53.33,UDP,1468,12236  >  8999 Len=1426
1167994,2286.144541,192.168.0.2,178.48.53.33,UDP,1468,12236  >  8999 Len=1426
1167995,2286.144579,192.168.0.2,178.48.53.33,UDP,1468,12236  >  8999 Len=1426
1167996,2286.144616,192.168.0.2,178.48.53.33,UDP,1468,12236  >  8999 Len=1426
1167997,2286.1446920000003,192.168.0.2,178.48.53.33,UDP,1468,12236  >  8999 Len=1426
1167998,2286.1447350000003,192.168.0.2,178.48.53.33,UDP,1468,12236  >  8999 Len=1426
1167999,2286.144773,192.168.0.2,178.48.53.33,UDP,1468,12236  >  8999 Len=1426
1168000,2286.144808,192.168.0.2,178.48.53.33,UDP,1468,12236  >  8999 Len=1426
1168001,2286.144844,192.168.0.2,178.48.53.33,UDP,1468,12236  >  8999 Len=1426
1168002,2286.144882,192.168.0.2,178.48.53.33,UDP,1468,12236  >  8999 Len=1426
1168003,2286.144918,192.168.0.2,178.48.53.33,UDP,1468,12236  >  8999 Len=1426
1168004,2286.144956,192.168.0.2,178.48.53.33,UDP,1468,12236  >  8999 Len=1426
1168005,2286.144993,192.168.0.2,178.48.53.33,UDP,1468,12236  >  8999 Len=1426
1168006,2286.145029,192.168.0.2,178.48.53.33,UDP,1468,12236  >  8999 Len=1426
1168007,2286.145066,192.168.0.2,178.48.53.33,UDP,1468,12236  >  8999 Len=1426
1168008,2286.145102,192.168.0.2,178.48.53.33,UDP,1468,12236  >  8999 Len=1426
1168009,2286.1451420000003,192.168.0.2,178.48.53.33,UDP,1468,12236  >  8999 Len=1426
1168010,2286.145181,192.168.0.2,178.48.53.33,UDP,1468,12236  >  8999 Len=1426
1168011,2286.145219,192.168.0.2,178.48.53.33,UDP,1468,12236  >  8999 Len=1426
1168012,2286.145255,192.168.0.2,178.48.53.33,UDP,1468,12236  >  8999 Len=1426
1168013,2286.145289,192.168.0.2,178.48.53.33,UDP,1468,12236  >  8999 Len=1426
1168014,2286.1453239999996,192.168.0.2,178.48.53.33,UDP,1468,12236  >  8999 Len=1426
1168015,2286.14536,192.168.0.2,178.48.53.33,UDP,1468,12236  >  8999 Len=1426
1168016,2286.145395,192.168.0.2,178.48.53.33,UDP,1468,12236  >  8999 Len=1426
1168017,2286.14544,192.168.0.2,178.48.53.33,UDP,1468,12236  >  8999 Len=1426
1168018,2286.1454870000002,192.168.0.2,178.48.53.33,UDP,1468,12236  >  8999 Len=1426
1168019,2286.145565,192.168.0.2,178.48.53.33,UDP,1468,12236  >  8999 Len=1426
1168020,2286.145602,192.168.0.2,178.48.53.33,UDP,1468,12236  >  8999 Len=1426
1168021,2286.1456350000003,192.168.0.2,178.48.53.33,UDP,1468,12236  >  8999 Len=1426
1168022,2286.14567,192.168.0.2,178.48.53.33,UDP,1468,12236  >  8999 Len=1426
1168023,2286.145704,192.168.0.2,178.48.53.33,UDP,1468,12236  >  8999 Len=1426
1168024,2286.1457370000003,192.168.0.2,178.48.53.33,UDP,1468,12236  >  8999 Len=1426
1168025,2286.145771,192.168.0.2,178.48.53.33,UDP,1468,12236  >  8999 Len=1426
1168026,2286.145805,192.168.0.2,178.48.53.33,UDP,1468,12236  >  8999 Len=1426
1168027,2286.1458390000003,192.168.0.2,178.48.53.33,UDP,1468,12236  >  8999 Len=1426
1168028,2286.145872,192.168.0.2,178.48.53.33,UDP,1468,12236  >  8999 Len=1426
1168029,2286.145905,192.168.0.2,178.48.53.33,UDP,1468,12236  >  8999 Len=1426
1168030,2286.145938,192.168.0.2,178.48.53.33,UDP,1468,12236  >  8999 Len=1426
1168031,2286.145971,192.168.0.2,178.48.53.33,UDP,1468,12236  >  8999 Len=1426
1168032,2286.1460039999997,192.168.0.2,178.48.53.33,UDP,1468,12236  >  8999 Len=1426
1168033,2286.146038,192.168.0.2,178.48.53.33,UDP,1468,12236  >  8999 Len=1426
1168034,2286.146072,192.168.0.2,178.48.53.33,UDP,1468,12236  >  8999 Len=1426
1168037,2286.190951,192.168.0.2,72.21.91.110,TCP,54,4236  >  443 [ACK] Seq=724 Ack=25072 Win=17408 Len=0
1168040,2286.193281,192.168.0.2,72.21.91.110,TCP,54,4236  >  443 [ACK] Seq=724 Ack=27992 Win=17408 Len=0
1168043,2286.193362,192.168.0.2,72.21.91.110,TCP,54,4236  >  443 [ACK] Seq=724 Ack=30912 Win=17408 Len=0
1168046,2286.193441,192.168.0.2,72.21.91.110,TCP,54,4236  >  443 [ACK] Seq=724 Ack=33832 Win=17408 Len=0
1168049,2286.193511,192.168.0.2,72.21.91.110,TCP,54,4236  >  443 [ACK] Seq=724 Ack=36752 Win=17408 Len=0
1168051,2286.233198,192.168.0.2,72.21.91.110,TCP,54,4236  >  443 [ACK] Seq=724 Ack=38212 Win=17408 Len=0
1168054,2286.3222690000002,192.168.0.2,72.21.91.110,TCP,54,4236  >  443 [ACK] Seq=724 Ack=41132 Win=17408 Len=0
1168057,2286.322347,192.168.0.2,72.21.91.110,TCP,54,4236  >  443 [ACK] Seq=724 Ack=44052 Win=17408 Len=0
1168060,2286.323823,192.168.0.2,72.21.91.110,TCP,54,4236  >  443 [ACK] Seq=724 Ack=46972 Win=17408 Len=0
1168063,2286.3241129999997,192.168.0.2,72.21.91.110,TCP,54,4236  >  443 [ACK] Seq=724 Ack=49892 Win=17408 Len=0
1168066,2286.324372,192.168.0.2,72.21.91.110,TCP,54,4236  >  443 [ACK] Seq=724 Ack=52812 Win=17408 Len=0
1168068,2286.4009079999996,192.168.0.2,72.21.91.110,TCP,54,4236  >  443 [ACK] Seq=724 Ack=54272 Win=17408 Len=0
1168071,2286.45042,192.168.0.2,72.21.91.110,TCP,54,4236  >  443 [ACK] Seq=724 Ack=57192 Win=17408 Len=0
1168074,2286.450797,192.168.0.2,72.21.91.110,TCP,54,4236  >  443 [ACK] Seq=724 Ack=60112 Win=17408 Len=0
1168077,2286.45572,192.168.0.2,72.21.91.110,TCP,54,4236  >  443 [ACK] Seq=724 Ack=63032 Win=129792 Len=0
1168080,2286.456485,192.168.0.2,72.21.91.110,TCP,54,4236  >  443 [ACK] Seq=724 Ack=65952 Win=129792 Len=0
1168083,2286.456561,192.168.0.2,72.21.91.110,TCP,54,4236  >  443 [ACK] Seq=724 Ack=68872 Win=129792 Len=0
1168086,2286.547016,192.168.0.2,113.193.151.171,UDP,1312,62257  >  50670 Len=1270
1168087,2286.547117,192.168.0.2,113.193.151.171,UDP,1312,62257  >  50670 Len=1270
1168088,2286.547165,192.168.0.2,113.193.151.171,UDP,1312,62257  >  50670 Len=1270
1168089,2286.5676780000003,192.168.0.2,72.21.91.110,TCP,54,4236  >  443 [ACK] Seq=724 Ack=70332 Win=129792 Len=0
1168092,2286.577691,192.168.0.2,72.21.91.110,TCP,54,4236  >  443 [ACK] Seq=724 Ack=73252 Win=129792 Len=0
1168095,2286.577938,192.168.0.2,72.21.91.110,TCP,54,4236  >  443 [ACK] Seq=724 Ack=76172 Win=129792 Len=0
1168098,2286.583876,192.168.0.2,72.21.91.110,TCP,54,4236  >  443 [ACK] Seq=724 Ack=79092 Win=129792 Len=0
1168101,2286.583993,192.168.0.2,72.21.91.110,TCP,54,4236  >  443 [ACK] Seq=724 Ack=82012 Win=129792 Len=0
1168104,2286.589434,192.168.0.2,72.21.91.110,TCP,54,4236  >  443 [ACK] Seq=724 Ack=84932 Win=262656 Len=0
1168107,2286.589546,192.168.0.2,72.21.91.110,TCP,54,4236  >  443 [ACK] Seq=724 Ack=87852 Win=262656 Len=0
1168110,2286.589661,192.168.0.2,72.21.91.110,TCP,54,4236  >  443 [ACK] Seq=724 Ack=90772 Win=262656 Len=0
1168113,2286.589746,192.168.0.2,72.21.91.110,TCP,54,4236  >  443 [ACK] Seq=724 Ack=93692 Win=262656 Len=0
1168116,2286.589831,192.168.0.2,72.21.91.110,TCP,54,4236  >  443 [ACK] Seq=724 Ack=96612 Win=262656 Len=0
1168119,2286.589924,192.168.0.2,72.21.91.110,TCP,54,4236  >  443 [ACK] Seq=724 Ack=99532 Win=262656 Len=0
1168122,2286.590102,192.168.0.2,72.21.91.110,TCP,54,4236  >  443 [ACK] Seq=724 Ack=102452 Win=262656 Len=0
1168125,2286.59017,192.168.0.2,72.21.91.110,TCP,54,4236  >  443 [ACK] Seq=724 Ack=105372 Win=262656 Len=0
1168128,2286.592658,192.168.0.2,72.21.91.110,TCP,54,4236  >  443 [ACK] Seq=724 Ack=108292 Win=262656 Len=0
1168131,2286.593366,192.168.0.2,72.21.91.110,TCP,54,4236  >  443 [ACK] Seq=724 Ack=111212 Win=262656 Len=0
1168134,2286.5939120000003,192.168.0.2,72.21.91.110,TCP,54,4236  >  443 [ACK] Seq=724 Ack=114132 Win=262656 Len=0
1168137,2286.594235,192.168.0.2,72.21.91.110,TCP,54,4236  >  443 [ACK] Seq=724 Ack=117052 Win=262656 Len=0
1168139,2286.634736,192.168.0.2,72.21.91.110,TCP,54,4236  >  443 [ACK] Seq=724 Ack=118512 Win=262656 Len=0
1168142,2286.694214,192.168.0.2,72.21.91.110,TCP,54,4236  >  443 [ACK] Seq=724 Ack=121432 Win=262656 Len=0
1168145,2286.7062100000003,192.168.0.2,72.21.91.110,TCP,54,4236  >  443 [ACK] Seq=724 Ack=124352 Win=262656 Len=0
1168148,2286.706291,192.168.0.2,72.21.91.110,TCP,54,4236  >  443 [ACK] Seq=724 Ack=127272 Win=262656 Len=0
1168151,2286.708116,192.168.0.2,72.21.91.110,TCP,54,4236  >  443 [ACK] Seq=724 Ack=130192 Win=262656 Len=0
1168154,2286.7081940000003,192.168.0.2,72.21.91.110,TCP,54,4236  >  443 [ACK] Seq=724 Ack=133112 Win=262656 Len=0
1168157,2286.713944,192.168.0.2,72.21.91.110,TCP,54,4236  >  443 [ACK] Seq=724 Ack=136032 Win=262656 Len=0
1168160,2286.714008,192.168.0.2,72.21.91.110,TCP,54,4236  >  443 [ACK] Seq=724 Ack=138952 Win=262656 Len=0
1168163,2286.714907,192.168.0.2,72.21.91.110,TCP,54,4236  >  443 [ACK] Seq=724 Ack=141872 Win=262656 Len=0
1168166,2286.714977,192.168.0.2,72.21.91.110,TCP,54,4236  >  443 [ACK] Seq=724 Ack=144792 Win=262656 Len=0
1168169,2286.719273,192.168.0.2,72.21.91.110,TCP,54,4236  >  443 [ACK] Seq=724 Ack=147712 Win=262656 Len=0
1168172,2286.720053,192.168.0.2,72.21.91.110,TCP,54,4236  >  443 [ACK] Seq=724 Ack=150632 Win=262656 Len=0
1168175,2286.720112,192.168.0.2,72.21.91.110,TCP,54,4236  >  443 [ACK] Seq=724 Ack=153552 Win=262656 Len=0
1168178,2286.720182,192.168.0.2,72.21.91.110,TCP,54,4236  >  443 [ACK] Seq=724 Ack=156472 Win=262656 Len=0
1168181,2286.72346,192.168.0.2,72.21.91.110,TCP,54,4236  >  443 [ACK] Seq=724 Ack=159392 Win=262656 Len=0
1168184,2286.723555,192.168.0.2,72.21.91.110,TCP,54,4236  >  443 [ACK] Seq=724 Ack=162312 Win=262656 Len=0
1168187,2286.723622,192.168.0.2,72.21.91.110,TCP,54,4236  >  443 [ACK] Seq=724 Ack=165232 Win=262656 Len=0
1168190,2286.723686,192.168.0.2,72.21.91.110,TCP,54,4236  >  443 [ACK] Seq=724 Ack=168152 Win=262656 Len=0
1168193,2286.72375,192.168.0.2,72.21.91.110,TCP,54,4236  >  443 [ACK] Seq=724 Ack=171072 Win=262656 Len=0
1168196,2286.7238350000002,192.168.0.2,72.21.91.110,TCP,54,4236  >  443 [ACK] Seq=724 Ack=173992 Win=262656 Len=0
1168199,2286.723998,192.168.0.2,72.21.91.110,TCP,54,4236  >  443 [ACK] Seq=724 Ack=176912 Win=262656 Len=0
1168202,2286.724168,192.168.0.2,72.21.91.110,TCP,54,4236  >  443 [ACK] Seq=724 Ack=179832 Win=262656 Len=0
1168205,2286.725237,192.168.0.2,72.21.91.110,TCP,54,4236  >  443 [ACK] Seq=724 Ack=182752 Win=262656 Len=0
1168208,2286.725319,192.168.0.2,72.21.91.110,TCP,54,4236  >  443 [ACK] Seq=724 Ack=185672 Win=262656 Len=0
1168211,2286.7253969999997,192.168.0.2,72.21.91.110,TCP,54,4236  >  443 [ACK] Seq=724 Ack=188592 Win=262656 Len=0
1168214,2286.7274199999997,192.168.0.2,72.21.91.110,TCP,54,4236  >  443 [ACK] Seq=724 Ack=191512 Win=262656 Len=0
1168217,2286.7278100000003,192.168.0.2,72.21.91.110,TCP,54,4236  >  443 [ACK] Seq=724 Ack=194432 Win=262656 Len=0
1168220,2286.727924,192.168.0.2,72.21.91.110,TCP,54,4236  >  443 [ACK] Seq=724 Ack=197352 Win=262656 Len=0
1168223,2286.729159,192.168.0.2,72.21.91.110,TCP,54,4236  >  443 [ACK] Seq=724 Ack=200272 Win=262656 Len=0
1168226,2286.729259,192.168.0.2,72.21.91.110,TCP,54,4236  >  443 [ACK] Seq=724 Ack=203192 Win=262656 Len=0
1168229,2286.729325,192.168.0.2,72.21.91.110,TCP,54,4236  >  443 [ACK] Seq=724 Ack=206112 Win=262656 Len=0
1168232,2286.729401,192.168.0.2,72.21.91.110,TCP,54,4236  >  443 [ACK] Seq=724 Ack=209032 Win=262656 Len=0
1168235,2286.729471,192.168.0.2,72.21.91.110,TCP,54,4236  >  443 [ACK] Seq=724 Ack=211952 Win=262656 Len=0
1168238,2286.729543,192.168.0.2,72.21.91.110,TCP,54,4236  >  443 [ACK] Seq=724 Ack=214872 Win=262656 Len=0
1168241,2286.732909,192.168.0.2,178.48.53.33,UDP,1468,12236  >  8999 Len=1426
1168247,2286.733344,192.168.0.2,178.48.53.33,UDP,1468,12236  >  8999 Len=1426
1168248,2286.7333949999997,192.168.0.2,178.48.53.33,UDP,1468,12236  >  8999 Len=1426
1168249,2286.733446,192.168.0.2,178.48.53.33,UDP,1468,12236  >  8999 Len=1426
1168250,2286.733489,192.168.0.2,178.48.53.33,UDP,1468,12236  >  8999 Len=1426
1168251,2286.7335350000003,192.168.0.2,178.48.53.33,UDP,1468,12236  >  8999 Len=1426
1168252,2286.733576,192.168.0.2,178.48.53.33,UDP,1468,12236  >  8999 Len=1426
1168253,2286.733623,192.168.0.2,178.48.53.33,UDP,1468,12236  >  8999 Len=1426
1168254,2286.733656,192.168.0.2,178.48.53.33,UDP,1468,12236  >  8999 Len=1426
1168255,2286.733686,192.168.0.2,178.48.53.33,UDP,1468,12236  >  8999 Len=1426
1168256,2286.733723,192.168.0.2,178.48.53.33,UDP,1468,12236  >  8999 Len=1426
1168258,2286.737004,192.168.0.2,178.48.53.33,UDP,1468,12236  >  8999 Len=1426
1168259,2286.737048,192.168.0.2,178.48.53.33,UDP,1468,12236  >  8999 Len=1426
1168260,2286.741954,192.168.0.2,104.25.202.21,TLSv1.2,347,Application Data
1168261,2286.745605,192.168.0.2,104.25.202.21,TLSv1.2,198,Application Data
1168262,2286.745759,192.168.0.2,104.25.202.21,TLSv1.2,195,Application Data
1168263,2286.751814,192.168.0.2,104.25.202.21,TLSv1.2,187,Application Data
1168267,2286.7621289999997,192.168.0.2,72.21.91.110,TCP,54,4236  >  443 [ACK] Seq=724 Ack=217792 Win=528384 Len=0
1168270,2286.770227,192.168.0.2,104.25.202.21,TCP,54,4218  >  443 [ACK] Seq=3230 Ack=13239257 Win=1959168 Len=0
1168273,2286.770779,192.168.0.2,104.25.202.21,TCP,54,4218  >  443 [ACK] Seq=3230 Ack=13242053 Win=1959168 Len=0
1168275,2286.7720480000003,192.168.0.2,104.25.202.21,TLSv1.2,157,Application Data
1168276,2286.772739,192.168.0.2,104.25.202.21,TLSv1.2,147,Application Data
1168277,2286.772797,192.168.0.2,104.25.202.21,TLSv1.2,146,Application Data
1168279,2286.775589,192.168.0.2,104.25.202.21,TCP,54,4218  >  443 [ACK] Seq=3518 Ack=13244822 Win=1959168 Len=0
1168281,2286.776546,192.168.0.2,104.25.202.21,TCP,54,4218  >  443 [ACK] Seq=3518 Ack=13246220 Win=1957888 Len=0
1168283,2286.776617,192.168.0.2,104.25.202.21,TCP,54,4218  >  443 [ACK] Seq=3518 Ack=13247618 Win=1959168 Len=0
1168285,2286.776678,192.168.0.2,104.25.202.21,TCP,54,4218  >  443 [ACK] Seq=3518 Ack=13249078 Win=1959168 Len=0
1168288,2286.77675,192.168.0.2,104.25.202.21,TCP,54,4218  >  443 [ACK] Seq=3518 Ack=13251874 Win=1959168 Len=0
1168290,2286.777609,192.168.0.2,104.25.202.21,TCP,54,4218  >  443 [ACK] Seq=3518 Ack=13253334 Win=1959168 Len=0
1168292,2286.777664,192.168.0.2,104.25.202.21,TCP,54,4218  >  443 [ACK] Seq=3518 Ack=13254794 Win=1959168 Len=0
1168295,2286.7793030000003,192.168.0.2,104.25.202.21,TCP,54,4218  >  443 [ACK] Seq=3518 Ack=13257466 Win=1959168 Len=0
1168297,2286.788064,192.168.0.2,47.188.177.63,UDP,145,12236  >  6881 Len=103
1168300,2286.792775,192.168.0.2,104.25.202.21,TCP,54,4218  >  443 [ACK] Seq=3518 Ack=13259099 Win=1959168 Len=0
1168303,2286.793043,192.168.0.2,104.25.202.21,TCP,54,4218  >  443 [ACK] Seq=3518 Ack=13259812 Win=1958400 Len=0
1168306,2286.79323,192.168.0.2,104.25.202.21,TCP,54,4218  >  443 [ACK] Seq=3518 Ack=13260812 Win=1959168 Len=0
1168309,2286.798905,192.168.0.2,104.25.202.21,TCP,54,4218  >  443 [ACK] Seq=3518 Ack=13263608 Win=1959168 Len=0
1168312,2286.799221,192.168.0.2,104.25.202.21,TCP,54,4218  >  443 [ACK] Seq=3518 Ack=13266466 Win=1959168 Len=0
1168315,2286.7992679999998,192.168.0.2,104.25.202.21,TCP,54,4218  >  443 [ACK] Seq=3518 Ack=13267759 Win=1957888 Len=0
1168317,2286.8055879999997,192.168.0.2,178.48.53.33,UDP,1468,12236  >  8999 Len=1426
1168318,2286.80565,192.168.0.2,178.48.53.33,UDP,1468,12236  >  8999 Len=1426
1168320,2286.8058,192.168.0.2,178.48.53.33,UDP,1468,12236  >  8999 Len=1426
1168321,2286.805855,192.168.0.2,178.48.53.33,UDP,1468,12236  >  8999 Len=1426
1168323,2286.811773,192.168.0.2,178.48.53.33,UDP,1468,12236  >  8999 Len=1426
1168325,2286.8121149999997,192.168.0.2,178.48.53.33,UDP,1468,12236  >  8999 Len=1426
1168326,2286.812198,192.168.0.2,178.48.53.33,UDP,1468,12236  >  8999 Len=1426
1168328,2286.818566,192.168.0.2,178.48.53.33,UDP,1468,12236  >  8999 Len=1426
1168347,2286.8198620000003,192.168.0.2,178.48.53.33,UDP,1468,12236  >  8999 Len=1426
1168348,2286.819918,192.168.0.2,178.48.53.33,UDP,1468,12236  >  8999 Len=1426
1168349,2286.819969,192.168.0.2,178.48.53.33,UDP,1468,12236  >  8999 Len=1426
1168350,2286.820011,192.168.0.2,178.48.53.33,UDP,1468,12236  >  8999 Len=1426
1168351,2286.820055,192.168.0.2,178.48.53.33,UDP,1468,12236  >  8999 Len=1426
1168352,2286.820093,192.168.0.2,178.48.53.33,UDP,1468,12236  >  8999 Len=1426
1168353,2286.820136,192.168.0.2,178.48.53.33,UDP,1468,12236  >  8999 Len=1426
1168354,2286.820164,192.168.0.2,178.48.53.33,UDP,1468,12236  >  8999 Len=1426
1168355,2286.8202109999997,192.168.0.2,178.48.53.33,UDP,1468,12236  >  8999 Len=1426
1168356,2286.8202530000003,192.168.0.2,178.48.53.33,UDP,1468,12236  >  8999 Len=1426
1168357,2286.8202929999998,192.168.0.2,178.48.53.33,UDP,1468,12236  >  8999 Len=1426
1168359,2286.820331,192.168.0.2,178.48.53.33,UDP,1468,12236  >  8999 Len=1426
1168361,2286.820391,192.168.0.2,104.25.202.21,TCP,54,4218  >  443 [ACK] Seq=3518 Ack=13269769 Win=1959168 Len=0
1168362,2286.8203989999997,192.168.0.2,178.48.53.33,UDP,1468,12236  >  8999 Len=1426
1168364,2286.820455,192.168.0.2,178.48.53.33,UDP,1468,12236  >  8999 Len=1426
1168365,2286.820544,192.168.0.2,178.48.53.33,UDP,1468,12236  >  8999 Len=1426
1168366,2286.820607,192.168.0.2,178.48.53.33,UDP,1468,12236  >  8999 Len=1426
1168367,2286.8207030000003,192.168.0.2,178.48.53.33,UDP,1468,12236  >  8999 Len=1426
1168368,2286.820772,192.168.0.2,178.48.53.33,UDP,1468,12236  >  8999 Len=1426
1168369,2286.820816,192.168.0.2,178.48.53.33,UDP,1468,12236  >  8999 Len=1426
1168370,2286.820868,192.168.0.2,178.48.53.33,UDP,1468,12236  >  8999 Len=1426
1168371,2286.820909,192.168.0.2,178.48.53.33,UDP,1468,12236  >  8999 Len=1426
1168372,2286.820957,192.168.0.2,178.48.53.33,UDP,1468,12236  >  8999 Len=1426
1168373,2286.821002,192.168.0.2,178.48.53.33,UDP,1468,12236  >  8999 Len=1426
1168374,2286.8210440000003,192.168.0.2,178.48.53.33,UDP,1468,12236  >  8999 Len=1426
1168375,2286.821095,192.168.0.2,178.48.53.33,UDP,1468,12236  >  8999 Len=1426
1168376,2286.821143,192.168.0.2,178.48.53.33,UDP,1468,12236  >  8999 Len=1426
1168377,2286.821188,192.168.0.2,178.48.53.33,UDP,1468,12236  >  8999 Len=1426
1168383,2286.827574,192.168.0.2,72.21.91.110,TCP,54,4236  >  443 [ACK] Seq=724 Ack=220712 Win=528384 Len=0
1168385,2286.827639,192.168.0.2,178.48.53.33,UDP,1468,12236  >  8999 Len=1426
1168387,2286.8276739999997,192.168.0.2,72.21.91.110,TCP,54,4236  >  443 [ACK] Seq=724 Ack=223632 Win=528384 Len=0
1168388,2286.8277129999997,192.168.0.2,178.48.53.33,UDP,1468,12236  >  8999 Len=1426
1168389,2286.8277550000003,192.168.0.2,178.48.53.33,UDP,1468,12236  >  8999 Len=1426
1168390,2286.827796,192.168.0.2,178.48.53.33,UDP,1468,12236  >  8999 Len=1426
1168391,2286.827842,192.168.0.2,178.48.53.33,UDP,1468,12236  >  8999 Len=1426
1168392,2286.827882,192.168.0.2,178.48.53.33,UDP,1468,12236  >  8999 Len=1426
1168395,2286.8338719999997,192.168.0.2,72.21.91.110,TCP,54,4236  >  443 [ACK] Seq=724 Ack=226552 Win=528384 Len=0
1168398,2286.833957,192.168.0.2,72.21.91.110,TCP,54,4236  >  443 [ACK] Seq=724 Ack=229472 Win=528384 Len=0
1168401,2286.834849,192.168.0.2,72.21.91.110,TCP,54,4236  >  443 [ACK] Seq=724 Ack=232392 Win=528384 Len=0
1168404,2286.834924,192.168.0.2,72.21.91.110,TCP,54,4236  >  443 [ACK] Seq=724 Ack=235312 Win=528384 Len=0
1168407,2286.841129,192.168.0.2,72.21.91.110,TCP,54,4236  >  443 [ACK] Seq=724 Ack=238232 Win=528384 Len=0
1168410,2286.841622,192.168.0.2,72.21.91.110,TCP,54,4236  >  443 [ACK] Seq=724 Ack=241152 Win=528384 Len=0
1168413,2286.841725,192.168.0.2,72.21.91.110,TCP,54,4236  >  443 [ACK] Seq=724 Ack=244072 Win=528384 Len=0
1168416,2286.842964,192.168.0.2,72.21.91.110,TCP,54,4236  >  443 [ACK] Seq=724 Ack=246992 Win=528384 Len=0
1168420,2286.8458579999997,192.168.0.2,178.48.53.33,UDP,1468,12236  >  8999 Len=1426
1168422,2286.846599,192.168.0.2,72.21.91.110,TCP,54,4236  >  443 [ACK] Seq=724 Ack=249912 Win=528384 Len=0
1168425,2286.846685,192.168.0.2,72.21.91.110,TCP,54,4236  >  443 [ACK] Seq=724 Ack=252832 Win=528384 Len=0
1168428,2286.846716,192.168.0.2,72.21.91.110,TCP,54,4236  >  443 [ACK] Seq=724 Ack=252872 Win=528384 Len=0
1168431,2286.848261,192.168.0.2,72.21.91.110,TCP,54,4236  >  443 [ACK] Seq=724 Ack=255792 Win=528384 Len=0
1168434,2286.848325,192.168.0.2,72.21.91.110,TCP,54,4236  >  443 [ACK] Seq=724 Ack=258712 Win=528384 Len=0
1168437,2286.848383,192.168.0.2,72.21.91.110,TCP,54,4236  >  443 [ACK] Seq=724 Ack=261632 Win=528384 Len=0
1168440,2286.8515899999998,192.168.0.2,72.21.91.110,TCP,54,4236  >  443 [ACK] Seq=724 Ack=264552 Win=528384 Len=0
1168443,2286.853195,192.168.0.2,72.21.91.110,TCP,54,4236  >  443 [ACK] Seq=724 Ack=267472 Win=528384 Len=0
1168446,2286.853298,192.168.0.2,72.21.91.110,TCP,54,4236  >  443 [ACK] Seq=724 Ack=270392 Win=528384 Len=0
1168449,2286.853364,192.168.0.2,72.21.91.110,TCP,54,4236  >  443 [ACK] Seq=724 Ack=273312 Win=528384 Len=0
1168452,2286.85343,192.168.0.2,72.21.91.110,TCP,54,4236  >  443 [ACK] Seq=724 Ack=276232 Win=528384 Len=0
1168455,2286.8557579999997,192.168.0.2,72.21.91.110,TCP,54,4236  >  443 [ACK] Seq=724 Ack=279152 Win=528384 Len=0
1168458,2286.8558359999997,192.168.0.2,72.21.91.110,TCP,54,4236  >  443 [ACK] Seq=724 Ack=282072 Win=528384 Len=0
1168461,2286.855909,192.168.0.2,72.21.91.110,TCP,54,4236  >  443 [ACK] Seq=724 Ack=284992 Win=528384 Len=0
1168464,2286.860071,192.168.0.2,72.21.91.110,TCP,54,4236  >  443 [ACK] Seq=724 Ack=287912 Win=528384 Len=0
1168467,2286.860163,192.168.0.2,72.21.91.110,TCP,54,4236  >  443 [ACK] Seq=724 Ack=290832 Win=528384 Len=0
1168470,2286.8602339999998,192.168.0.2,72.21.91.110,TCP,54,4236  >  443 [ACK] Seq=724 Ack=293752 Win=528384 Len=0
1168473,2286.860311,192.168.0.2,72.21.91.110,TCP,54,4236  >  443 [ACK] Seq=724 Ack=296672 Win=528384 Len=0
1168476,2286.860381,192.168.0.2,72.21.91.110,TCP,54,4236  >  443 [ACK] Seq=724 Ack=299592 Win=528384 Len=0
1168479,2286.86045,192.168.0.2,72.21.91.110,TCP,54,4236  >  443 [ACK] Seq=724 Ack=302512 Win=528384 Len=0
1168482,2286.8606760000002,192.168.0.2,72.21.91.110,TCP,54,4236  >  443 [ACK] Seq=724 Ack=305432 Win=528384 Len=0
1168485,2286.860748,192.168.0.2,72.21.91.110,TCP,54,4236  >  443 [ACK] Seq=724 Ack=308352 Win=528384 Len=0
1168487,2286.860885,192.168.0.2,104.25.202.21,TCP,54,4218  >  443 [ACK] Seq=3518 Ack=13269807 Win=1959168 Len=0
1168489,2286.866734,192.168.0.2,72.21.91.110,TCP,54,4236  >  443 [ACK] Seq=724 Ack=311272 Win=528384 Len=0
1168492,2286.866822,192.168.0.2,72.21.91.110,TCP,54,4236  >  443 [ACK] Seq=724 Ack=314192 Win=528384 Len=0
1168495,2286.866897,192.168.0.2,72.21.91.110,TCP,54,4236  >  443 [ACK] Seq=724 Ack=317112 Win=528384 Len=0
1168498,2286.866972,192.168.0.2,72.21.91.110,TCP,54,4236  >  443 [ACK] Seq=724 Ack=320032 Win=528384 Len=0
1168501,2286.8670420000003,192.168.0.2,72.21.91.110,TCP,54,4236  >  443 [ACK] Seq=724 Ack=322952 Win=528384 Len=0
1168504,2286.867114,192.168.0.2,72.21.91.110,TCP,54,4236  >  443 [ACK] Seq=724 Ack=325872 Win=528384 Len=0
1168507,2286.867186,192.168.0.2,72.21.91.110,TCP,54,4236  >  443 [ACK] Seq=724 Ack=328792 Win=528384 Len=0
1168510,2286.867259,192.168.0.2,72.21.91.110,TCP,54,4236  >  443 [ACK] Seq=724 Ack=331712 Win=528384 Len=0
1168513,2286.867332,192.168.0.2,72.21.91.110,TCP,54,4236  >  443 [ACK] Seq=724 Ack=334632 Win=528384 Len=0
1168516,2286.867402,192.168.0.2,72.21.91.110,TCP,54,4236  >  443 [ACK] Seq=724 Ack=337552 Win=528384 Len=0
1168519,2286.8674760000004,192.168.0.2,72.21.91.110,TCP,54,4236  >  443 [ACK] Seq=724 Ack=340472 Win=528384 Len=0
1168522,2286.869359,192.168.0.2,72.21.91.110,TCP,54,4236  >  443 [ACK] Seq=724 Ack=343392 Win=528384 Len=0
1168525,2286.869516,192.168.0.2,72.21.91.110,TCP,54,4236  >  443 [ACK] Seq=724 Ack=346312 Win=528384 Len=0
