No.,Time,Source,Destination,Protocol,Length,Info,TBP
1155680,2282.871048,192.168.0.2,104.25.202.21,TCP,54,4218  >  443 [ACK] Seq=1477 Ack=3894778 Win=1959168 Len=0,0.0
1155683,2282.873351,192.168.0.2,178.48.53.33,UDP,1468,12236  >  8999 Len=1426,0.0023030000002108864
1155685,2282.873437,192.168.0.2,178.48.53.33,UDP,1468,12236  >  8999 Len=1426,8.600000001024455e-05
1155686,2282.873482,192.168.0.2,104.25.202.21,TCP,54,4218  >  443 [ACK] Seq=1477 Ack=3897698 Win=1959168 Len=0,4.4999999772699084e-05
1155689,2282.873607,192.168.0.2,104.25.202.21,TCP,54,4218  >  443 [ACK] Seq=1477 Ack=3900618 Win=1959168 Len=0,0.00012500000002546585
1155692,2282.873734,192.168.0.2,104.25.202.21,TCP,54,4218  >  443 [ACK] Seq=1477 Ack=3903538 Win=1959168 Len=0,0.00012699999979304266
1155695,2282.874008,192.168.0.2,104.25.202.21,TCP,54,4218  >  443 [ACK] Seq=1477 Ack=3906458 Win=1959168 Len=0,0.00027399999999033753
1155698,2282.874119,192.168.0.2,104.25.202.21,TCP,54,4218  >  443 [ACK] Seq=1477 Ack=3909378 Win=1959168 Len=0,0.00011100000028818613
1155701,2282.874452,192.168.0.2,104.25.202.21,TCP,54,4218  >  443 [ACK] Seq=1477 Ack=3912298 Win=1959168 Len=0,0.0003329999999550637
1155704,2282.8777170000008,192.168.0.2,104.25.202.21,TCP,54,4218  >  443 [ACK] Seq=1477 Ack=3915218 Win=1959168 Len=0,0.0032650000007379276
1155707,2282.877879,192.168.0.2,104.25.202.21,TCP,54,4218  >  443 [ACK] Seq=1477 Ack=3918138 Win=1959168 Len=0,0.00016199999936361564
1155710,2282.877968,192.168.0.2,104.25.202.21,TCP,54,4218  >  443 [ACK] Seq=1477 Ack=3921058 Win=1959168 Len=0,8.899999966160976e-05
1155713,2282.878051,192.168.0.2,104.25.202.21,TCP,54,4218  >  443 [ACK] Seq=1477 Ack=3923978 Win=1959168 Len=0,8.300000035887933e-05
1155716,2282.878134,192.168.0.2,104.25.202.21,TCP,54,4218  >  443 [ACK] Seq=1477 Ack=3926898 Win=1959168 Len=0,8.299999990413198e-05
1155719,2282.878221,192.168.0.2,104.25.202.21,TCP,54,4218  >  443 [ACK] Seq=1477 Ack=3929818 Win=1959168 Len=0,8.699999989403295e-05
1155722,2282.878308,192.168.0.2,104.25.202.21,TCP,54,4218  >  443 [ACK] Seq=1477 Ack=3932738 Win=1959168 Len=0,8.699999989403295e-05
1155725,2282.878397,192.168.0.2,104.25.202.21,TCP,54,4218  >  443 [ACK] Seq=1477 Ack=3935658 Win=1959168 Len=0,8.900000011635711e-05
1155731,2282.881843,192.168.0.2,104.25.202.21,TCP,54,4218  >  443 [ACK] Seq=1477 Ack=3938578 Win=1959168 Len=0,0.0034460000001672597
1155732,2282.881881,192.168.0.2,178.48.53.33,UDP,1468,12236  >  8999 Len=1426,3.799999967668555e-05
1155735,2282.881947,192.168.0.2,104.25.202.21,TCP,54,4218  >  443 [ACK] Seq=1477 Ack=3941498 Win=1959168 Len=0,6.60000000607397e-05
1155738,2282.8820379999997,192.168.0.2,178.48.53.33,UDP,1468,12236  >  8999 Len=1426,9.099999988393392e-05
1155739,2282.882049,192.168.0.2,104.25.202.21,TCP,54,4218  >  443 [ACK] Seq=1477 Ack=3944418 Win=1959168 Len=0,1.1000000085914508e-05
1155742,2282.882152,192.168.0.2,104.25.202.21,TCP,54,4218  >  443 [ACK] Seq=1477 Ack=3947338 Win=1959168 Len=0,0.00010300000030838419
1155743,2282.882159,192.168.0.2,178.48.53.33,UDP,1468,12236  >  8999 Len=1426,6.999999641266186e-06
1155746,2282.88225,192.168.0.2,104.25.202.21,TCP,54,4218  >  443 [ACK] Seq=1477 Ack=3950258 Win=1959168 Len=0,9.100000033868128e-05
1155748,2282.88229,192.168.0.2,178.48.53.33,UDP,1468,12236  >  8999 Len=1426,3.999999989900971e-05
1155750,2282.882348,192.168.0.2,104.25.202.21,TCP,54,4218  >  443 [ACK] Seq=1477 Ack=3953178 Win=1959168 Len=0,5.800000008093775e-05
1155753,2282.882428000001,192.168.0.2,104.25.202.21,TCP,54,4218  >  443 [ACK] Seq=1477 Ack=3956098 Win=1959168 Len=0,8.000000070751412e-05
1155756,2282.882515,192.168.0.2,104.25.202.21,TCP,54,4218  >  443 [ACK] Seq=1477 Ack=3959018 Win=1959168 Len=0,8.699999898453825e-05
1155759,2282.8826059999997,192.168.0.2,104.25.202.21,TCP,54,4218  >  443 [ACK] Seq=1477 Ack=3961938 Win=1959168 Len=0,9.099999988393392e-05
1155762,2282.8828120000007,192.168.0.2,104.25.202.21,TCP,54,4218  >  443 [ACK] Seq=1477 Ack=3964858 Win=1959168 Len=0,0.00020600000107151573
1155763,2282.8843420000007,192.168.0.2,23.73.80.224,TCP,54,4216  >  443 [ACK] Seq=1126 Ack=139541 Win=248064 Len=0,0.0015300000000024738
1155770,2282.885499,192.168.0.2,104.25.202.21,TCP,54,4218  >  443 [ACK] Seq=1477 Ack=3967778 Win=1959168 Len=0,0.0011569999992389057
1155773,2282.8855949999997,192.168.0.2,104.25.202.21,TCP,54,4218  >  443 [ACK] Seq=1477 Ack=3970698 Win=1959168 Len=0,9.59999997576233e-05
1155776,2282.885685,192.168.0.2,104.25.202.21,TCP,54,4218  >  443 [ACK] Seq=1477 Ack=3973618 Win=1959168 Len=0,9.000000045489287e-05
1155779,2282.885776,192.168.0.2,104.25.202.21,TCP,54,4218  >  443 [ACK] Seq=1477 Ack=3976538 Win=1959168 Len=0,9.099999988393392e-05
1155782,2282.8858649999997,192.168.0.2,104.25.202.21,TCP,54,4218  >  443 [ACK] Seq=1477 Ack=3979458 Win=1959168 Len=0,8.899999966160976e-05
1155784,2282.885902,192.168.0.2,178.48.53.33,UDP,1468,12236  >  8999 Len=1426,3.700000024764449e-05
1155786,2282.885956,192.168.0.2,104.25.202.21,TCP,54,4218  >  443 [ACK] Seq=1477 Ack=3982378 Win=1959168 Len=0,5.400000009103678e-05
1155788,2282.8859989999996,192.168.0.2,178.48.53.33,UDP,1468,12236  >  8999 Len=1426,4.299999955037492e-05
1155790,2282.886043,192.168.0.2,104.25.202.21,TCP,54,4218  >  443 [ACK] Seq=1477 Ack=3985298 Win=1959168 Len=0,4.400000034365803e-05
1155791,2282.88607,192.168.0.2,178.48.53.33,UDP,1468,12236  >  8999 Len=1426,2.700000004551839e-05
1155793,2282.886126000001,192.168.0.2,178.48.53.33,UDP,1468,12236  >  8999 Len=1426,5.6000000768108293e-05
1155794,2282.8861829999996,192.168.0.2,178.48.53.33,UDP,1468,12236  >  8999 Len=1426,5.6999998832907295e-05
1155795,2282.886254,192.168.0.2,178.48.53.33,UDP,1468,12236  >  8999 Len=1426,7.100000038917642e-05
1155797,2282.888389,192.168.0.2,104.25.202.21,TCP,54,4218  >  443 [ACK] Seq=1477 Ack=3988218 Win=1959168 Len=0,0.0021350000001802982
1155800,2282.888493,192.168.0.2,104.25.202.21,TCP,54,4218  >  443 [ACK] Seq=1477 Ack=3991138 Win=1959168 Len=0,0.00010399999973742524
1155803,2282.888573,192.168.0.2,104.25.202.21,TCP,54,4218  >  443 [ACK] Seq=1477 Ack=3994058 Win=1959168 Len=0,8.000000025276677e-05
1155806,2282.888646,192.168.0.2,104.25.202.21,TCP,54,4218  >  443 [ACK] Seq=1477 Ack=3996978 Win=1959168 Len=0,7.299999970200588e-05
1155809,2282.8887210000007,192.168.0.2,104.25.202.21,TCP,54,4218  >  443 [ACK] Seq=1477 Ack=3999898 Win=1959168 Len=0,7.500000083382474e-05
1155812,2282.888791,192.168.0.2,104.25.202.21,TCP,54,4218  >  443 [ACK] Seq=1477 Ack=4002818 Win=1959168 Len=0,6.999999914114596e-05
1155815,2282.888861,192.168.0.2,104.25.202.21,TCP,54,4218  >  443 [ACK] Seq=1477 Ack=4005738 Win=1959168 Len=0,7.000000005064066e-05
1155818,2282.889901,192.168.0.2,104.25.202.21,TCP,54,4218  >  443 [ACK] Seq=1477 Ack=4008658 Win=1959168 Len=0,0.0010400000001027365
1155821,2282.889999,192.168.0.2,104.25.202.21,TCP,54,4218  >  443 [ACK] Seq=1477 Ack=4011578 Win=1959168 Len=0,9.799999997994746e-05
1155824,2282.890087,192.168.0.2,104.25.202.21,TCP,54,4218  >  443 [ACK] Seq=1477 Ack=4014498 Win=1959168 Len=0,8.800000023256871e-05
1155827,2282.890168,192.168.0.2,104.25.202.21,TCP,54,4218  >  443 [ACK] Seq=1477 Ack=4017418 Win=1959168 Len=0,8.099999968180782e-05
1155830,2282.894081,192.168.0.2,104.25.202.21,TCP,54,4218  >  443 [ACK] Seq=1477 Ack=4020338 Win=1959168 Len=0,0.00391300000001138
1155833,2282.894189,192.168.0.2,104.25.202.21,TCP,54,4218  >  443 [ACK] Seq=1477 Ack=4023258 Win=1959168 Len=0,0.00010800000018207356
1155836,2282.894284,192.168.0.2,104.25.202.21,TCP,54,4218  >  443 [ACK] Seq=1477 Ack=4026178 Win=1959168 Len=0,9.49999998738349e-05
1155839,2282.894381,192.168.0.2,104.25.202.21,TCP,54,4218  >  443 [ACK] Seq=1477 Ack=4029098 Win=1959168 Len=0,9.700000009615906e-05
1155842,2282.894478,192.168.0.2,104.25.202.21,TCP,54,4218  >  443 [ACK] Seq=1477 Ack=4032018 Win=1959168 Len=0,9.700000009615906e-05
1155845,2282.894563,192.168.0.2,104.25.202.21,TCP,54,4218  >  443 [ACK] Seq=1477 Ack=4034938 Win=1959168 Len=0,8.499999967170879e-05
1155848,2282.894664,192.168.0.2,104.25.202.21,TCP,54,4218  >  443 [ACK] Seq=1477 Ack=4037858 Win=1959168 Len=0,0.00010100000008606003
1155851,2282.8947550000007,192.168.0.2,104.25.202.21,TCP,54,4218  >  443 [ACK] Seq=1477 Ack=4040778 Win=1959168 Len=0,9.100000079342863e-05
1155854,2282.894848,192.168.0.2,104.25.202.21,TCP,54,4218  >  443 [ACK] Seq=1477 Ack=4043698 Win=1959168 Len=0,9.299999919676338e-05
1155857,2282.894955,192.168.0.2,104.25.202.21,TCP,54,4218  >  443 [ACK] Seq=1477 Ack=4046618 Win=1959168 Len=0,0.00010700000029828516
1155860,2282.895182,192.168.0.2,104.25.202.21,TCP,54,4218  >  443 [ACK] Seq=1477 Ack=4049538 Win=1959168 Len=0,0.00022699999999531428
1155863,2282.8971300000007,192.168.0.2,104.25.202.21,TCP,54,4218  >  443 [ACK] Seq=1477 Ack=4052458 Win=1959168 Len=0,0.001948000000538741
1155866,2282.897236,192.168.0.2,104.25.202.21,TCP,54,4218  >  443 [ACK] Seq=1477 Ack=4055378 Win=1959168 Len=0,0.0001059999990502547
1155869,2282.897325,192.168.0.2,104.25.202.21,TCP,54,4218  >  443 [ACK] Seq=1477 Ack=4058298 Win=1959168 Len=0,8.900000011635711e-05
1155872,2282.897415,192.168.0.2,104.25.202.21,TCP,54,4218  >  443 [ACK] Seq=1477 Ack=4061218 Win=1959168 Len=0,9.000000000014552e-05
1155875,2282.8975100000002,192.168.0.2,104.25.202.21,TCP,54,4218  >  443 [ACK] Seq=1477 Ack=4064138 Win=1959168 Len=0,9.500000032858225e-05
1155878,2282.897599,192.168.0.2,104.25.202.21,TCP,54,4218  >  443 [ACK] Seq=1477 Ack=4067058 Win=1959168 Len=0,8.899999966160976e-05
1155881,2282.8979289999997,192.168.0.2,104.25.202.21,TCP,54,4218  >  443 [ACK] Seq=1477 Ack=4069978 Win=1959168 Len=0,0.0003299999998489511
1155884,2282.898043,192.168.0.2,104.25.202.21,TCP,54,4218  >  443 [ACK] Seq=1477 Ack=4072898 Win=1959168 Len=0,0.0001140000003942987
1155887,2282.89813,192.168.0.2,104.25.202.21,TCP,54,4218  >  443 [ACK] Seq=1477 Ack=4075818 Win=1959168 Len=0,8.699999989403295e-05
1155890,2282.904057,192.168.0.2,104.25.202.21,TCP,54,4218  >  443 [ACK] Seq=1477 Ack=4078738 Win=1959168 Len=0,0.005927000000156113
1155893,2282.904137,192.168.0.2,104.25.202.21,TCP,54,4218  >  443 [ACK] Seq=1477 Ack=4081658 Win=1959168 Len=0,7.999999979801942e-05
1155896,2282.904225,192.168.0.2,104.25.202.21,TCP,54,4218  >  443 [ACK] Seq=1477 Ack=4084578 Win=1959168 Len=0,8.800000023256871e-05
1155899,2282.9043149999998,192.168.0.2,104.25.202.21,TCP,54,4218  >  443 [ACK] Seq=1477 Ack=4087498 Win=1959168 Len=0,8.999999954539817e-05
1155902,2282.9044089999998,192.168.0.2,104.25.202.21,TCP,54,4218  >  443 [ACK] Seq=1477 Ack=4090418 Win=1959168 Len=0,9.399999999004649e-05
1155905,2282.904498,192.168.0.2,104.25.202.21,TCP,54,4218  >  443 [ACK] Seq=1477 Ack=4093338 Win=1959168 Len=0,8.900000011635711e-05
1155908,2282.905223,192.168.0.2,104.25.202.21,TCP,54,4218  >  443 [ACK] Seq=1477 Ack=4096258 Win=1959168 Len=0,0.0007250000003296009
1155911,2282.905325,192.168.0.2,104.25.202.21,TCP,54,4218  >  443 [ACK] Seq=1477 Ack=4099178 Win=1959168 Len=0,0.00010199999996984843
1155914,2282.9054079999996,192.168.0.2,104.25.202.21,TCP,54,4218  >  443 [ACK] Seq=1477 Ack=4102098 Win=1959168 Len=0,8.299999944938463e-05
1155917,2282.9055,192.168.0.2,104.25.202.21,TCP,54,4218  >  443 [ACK] Seq=1477 Ack=4105018 Win=1959168 Len=0,9.200000022246968e-05
1155920,2282.90706,192.168.0.2,104.25.202.21,TCP,54,4218  >  443 [ACK] Seq=1477 Ack=4107938 Win=1959168 Len=0,0.0015600000001541048
1155923,2282.907159,192.168.0.2,104.25.202.21,TCP,54,4218  >  443 [ACK] Seq=1477 Ack=4110858 Win=1959168 Len=0,9.899999986373587e-05
1155926,2282.911101,192.168.0.2,104.25.202.21,TCP,54,4218  >  443 [ACK] Seq=1477 Ack=4113778 Win=1959168 Len=0,0.003942000000279222
1155929,2282.911208,192.168.0.2,104.25.202.21,TCP,54,4218  >  443 [ACK] Seq=1477 Ack=4116698 Win=1959168 Len=0,0.00010699999984353781
1155932,2282.9113039999997,192.168.0.2,104.25.202.21,TCP,54,4218  >  443 [ACK] Seq=1477 Ack=4119618 Win=1959168 Len=0,9.59999997576233e-05
1155935,2282.911397,192.168.0.2,104.25.202.21,TCP,54,4218  >  443 [ACK] Seq=1477 Ack=4122538 Win=1959168 Len=0,9.300000010625808e-05
1155938,2282.911495,192.168.0.2,104.25.202.21,TCP,54,4218  >  443 [ACK] Seq=1477 Ack=4125458 Win=1959168 Len=0,9.799999997994746e-05
1155941,2282.9115899999997,192.168.0.2,104.25.202.21,TCP,54,4218  >  443 [ACK] Seq=1477 Ack=4128378 Win=1959168 Len=0,9.49999998738349e-05
1155944,2282.911683,192.168.0.2,104.25.202.21,TCP,54,4218  >  443 [ACK] Seq=1477 Ack=4131298 Win=1959168 Len=0,9.300000010625808e-05
1155947,2282.911775,192.168.0.2,104.25.202.21,TCP,54,4218  >  443 [ACK] Seq=1477 Ack=4134218 Win=1959168 Len=0,9.200000022246968e-05
1155950,2282.911866,192.168.0.2,104.25.202.21,TCP,54,4218  >  443 [ACK] Seq=1477 Ack=4137138 Win=1959168 Len=0,9.099999988393392e-05
1155953,2282.912193,192.168.0.2,104.25.202.21,TCP,54,4218  >  443 [ACK] Seq=1477 Ack=4140058 Win=1959168 Len=0,0.0003270000001975859
1155956,2282.914259,192.168.0.2,104.25.202.21,TCP,54,4218  >  443 [ACK] Seq=1477 Ack=4142978 Win=1959168 Len=0,0.002066000000013446
1155959,2282.914364,192.168.0.2,104.25.202.21,TCP,54,4218  >  443 [ACK] Seq=1477 Ack=4145898 Win=1959168 Len=0,0.000105000000075961
1155962,2282.914465,192.168.0.2,104.25.202.21,TCP,54,4218  >  443 [ACK] Seq=1477 Ack=4148818 Win=1959168 Len=0,0.00010099999963131268
1155965,2282.9145559999997,192.168.0.2,104.25.202.21,TCP,54,4218  >  443 [ACK] Seq=1477 Ack=4151738 Win=1959168 Len=0,9.099999988393392e-05
1155968,2282.914643,192.168.0.2,104.25.202.21,TCP,54,4218  >  443 [ACK] Seq=1477 Ack=4154658 Win=1959168 Len=0,8.70000003487803e-05
1155971,2282.9147420000004,192.168.0.2,104.25.202.21,TCP,54,4218  >  443 [ACK] Seq=1477 Ack=4157578 Win=1959168 Len=0,9.900000031848322e-05
1155974,2282.914832,192.168.0.2,104.25.202.21,TCP,54,4218  >  443 [ACK] Seq=1477 Ack=4160498 Win=1959168 Len=0,8.999999954539817e-05
1155977,2282.915227,192.168.0.2,104.25.202.21,TCP,54,4218  >  443 [ACK] Seq=1477 Ack=4163418 Win=1959168 Len=0,0.0003950000000259024
1155980,2282.9153260000007,192.168.0.2,104.25.202.21,TCP,54,4218  >  443 [ACK] Seq=1477 Ack=4166338 Win=1959168 Len=0,9.900000077323057e-05
1155983,2282.918706,192.168.0.2,104.25.202.21,TCP,54,4218  >  443 [ACK] Seq=1477 Ack=4169258 Win=1959168 Len=0,0.0033799999991970253
1155986,2282.918803,192.168.0.2,104.25.202.21,TCP,54,4218  >  443 [ACK] Seq=1477 Ack=4172178 Win=1959168 Len=0,9.700000009615906e-05
1155989,2282.918877,192.168.0.2,104.25.202.21,TCP,54,4218  >  443 [ACK] Seq=1477 Ack=4175098 Win=1959168 Len=0,7.400000004054164e-05
1155992,2282.91895,192.168.0.2,104.25.202.21,TCP,54,4218  >  443 [ACK] Seq=1477 Ack=4178018 Win=1959168 Len=0,7.300000015675323e-05
1155995,2282.919019,192.168.0.2,104.25.202.21,TCP,54,4218  >  443 [ACK] Seq=1477 Ack=4180938 Win=1959168 Len=0,6.899999971210491e-05
1155998,2282.9191,192.168.0.2,104.25.202.21,TCP,54,4218  >  443 [ACK] Seq=1477 Ack=4183858 Win=1959168 Len=0,8.100000013655517e-05
1156001,2282.919189,192.168.0.2,104.25.202.21,TCP,54,4218  >  443 [ACK] Seq=1477 Ack=4186778 Win=1959168 Len=0,8.900000011635711e-05
1156004,2282.919275,192.168.0.2,104.25.202.21,TCP,54,4218  >  443 [ACK] Seq=1477 Ack=4189698 Win=1959168 Len=0,8.600000001024455e-05
1156007,2282.919362,192.168.0.2,104.25.202.21,TCP,54,4218  >  443 [ACK] Seq=1477 Ack=4192618 Win=1959168 Len=0,8.699999989403295e-05
1156010,2282.919645,192.168.0.2,104.25.202.21,TCP,54,4218  >  443 [ACK] Seq=1477 Ack=4195538 Win=1959168 Len=0,0.0002829999998539279
1156013,2282.921688,192.168.0.2,104.25.202.21,TCP,54,4218  >  443 [ACK] Seq=1477 Ack=4198458 Win=1959168 Len=0,0.0020429999999578285
1156016,2282.9218260000002,192.168.0.2,104.25.202.21,TCP,54,4218  >  443 [ACK] Seq=1477 Ack=4201378 Win=1959168 Len=0,0.00013800000033370452
1156019,2282.921893,192.168.0.2,104.25.202.21,TCP,54,4218  >  443 [ACK] Seq=1477 Ack=4204298 Win=1959168 Len=0,6.69999999445281e-05
1156022,2282.921953,192.168.0.2,104.25.202.21,TCP,54,4218  >  443 [ACK] Seq=1477 Ack=4207218 Win=1959168 Len=0,5.999999984851456e-05
1156025,2282.922007,192.168.0.2,104.25.202.21,TCP,54,4218  >  443 [ACK] Seq=1477 Ack=4210138 Win=1959168 Len=0,5.400000009103678e-05
1156028,2282.9234690000008,192.168.0.2,104.25.202.21,TCP,54,4218  >  443 [ACK] Seq=1477 Ack=4213058 Win=1959168 Len=0,0.0014620000006289047
1156031,2282.9235489999996,192.168.0.2,104.25.202.21,TCP,54,4218  >  443 [ACK] Seq=1477 Ack=4215978 Win=1959168 Len=0,7.999999888852471e-05
1156034,2282.923632,192.168.0.2,104.25.202.21,TCP,54,4218  >  443 [ACK] Seq=1477 Ack=4218898 Win=1959168 Len=0,8.300000035887933e-05
1156037,2282.923882,192.168.0.2,104.25.202.21,TCP,54,4218  >  443 [ACK] Seq=1477 Ack=4221818 Win=1959168 Len=0,0.0002500000000509317
1156040,2282.924172,192.168.0.2,104.25.202.21,TCP,54,4218  >  443 [ACK] Seq=1477 Ack=4224738 Win=1959168 Len=0,0.0002899999999499414
1156043,2282.9245809999998,192.168.0.2,104.25.202.21,TCP,54,4218  >  443 [ACK] Seq=1477 Ack=4227658 Win=1959168 Len=0,0.00040899999976318213
1156046,2282.933454,192.168.0.2,104.25.202.21,TCP,54,4218  >  443 [ACK] Seq=1477 Ack=4230578 Win=1959168 Len=0,0.00887300000022151
1156049,2282.9335579999997,192.168.0.2,104.25.202.21,TCP,54,4218  >  443 [ACK] Seq=1477 Ack=4233498 Win=1959168 Len=0,0.00010399999973742524
1156052,2282.933652,192.168.0.2,104.25.202.21,TCP,54,4218  >  443 [ACK] Seq=1477 Ack=4236418 Win=1959168 Len=0,9.400000044479384e-05
1156055,2282.933748,192.168.0.2,104.25.202.21,TCP,54,4218  >  443 [ACK] Seq=1477 Ack=4239338 Win=1959168 Len=0,9.59999997576233e-05
1156058,2282.9338399999997,192.168.0.2,104.25.202.21,TCP,54,4218  >  443 [ACK] Seq=1477 Ack=4242258 Win=1959168 Len=0,9.199999976772233e-05
1156061,2282.933933,192.168.0.2,104.25.202.21,TCP,54,4218  >  443 [ACK] Seq=1477 Ack=4245178 Win=1959168 Len=0,9.300000010625808e-05
1156064,2282.934025,192.168.0.2,104.25.202.21,TCP,54,4218  >  443 [ACK] Seq=1477 Ack=4248098 Win=1959168 Len=0,9.200000022246968e-05
1156067,2282.934115,192.168.0.2,104.25.202.21,TCP,54,4218  >  443 [ACK] Seq=1477 Ack=4251018 Win=1959168 Len=0,9.000000000014552e-05
1156070,2282.9352989999998,192.168.0.2,104.25.202.21,TCP,54,4218  >  443 [ACK] Seq=1477 Ack=4253938 Win=1959168 Len=0,0.0011839999997391715
1156073,2282.935375,192.168.0.2,104.25.202.21,TCP,54,4218  >  443 [ACK] Seq=1477 Ack=4256858 Win=1959168 Len=0,7.60000002628658e-05
1156076,2282.935437,192.168.0.2,104.25.202.21,TCP,54,4218  >  443 [ACK] Seq=1477 Ack=4259778 Win=1959168 Len=0,6.200000007083872e-05
1156079,2282.935503,192.168.0.2,104.25.202.21,TCP,54,4218  >  443 [ACK] Seq=1477 Ack=4262698 Win=1959168 Len=0,6.60000000607397e-05
1156082,2282.937408,192.168.0.2,104.25.202.21,TCP,54,4218  >  443 [ACK] Seq=1477 Ack=4265618 Win=1959168 Len=0,0.001904999999624124
1156085,2282.937468,192.168.0.2,104.25.202.21,TCP,54,4218  >  443 [ACK] Seq=1477 Ack=4268538 Win=1959168 Len=0,6.000000030326191e-05
1156088,2282.937528,192.168.0.2,104.25.202.21,TCP,54,4218  >  443 [ACK] Seq=1477 Ack=4271458 Win=1959168 Len=0,5.999999984851456e-05
1156091,2282.937584,192.168.0.2,104.25.202.21,TCP,54,4218  >  443 [ACK] Seq=1477 Ack=4274378 Win=1959168 Len=0,5.599999985861359e-05
1156094,2282.937642000001,192.168.0.2,104.25.202.21,TCP,54,4218  >  443 [ACK] Seq=1477 Ack=4277298 Win=1959168 Len=0,5.8000000990432454e-05
1156097,2282.9383399999997,192.168.0.2,104.25.202.21,TCP,54,4218  >  443 [ACK] Seq=1477 Ack=4280218 Win=1959168 Len=0,0.0006979999989198404
1156100,2282.938431,192.168.0.2,104.25.202.21,TCP,54,4218  >  443 [ACK] Seq=1477 Ack=4283138 Win=1959168 Len=0,9.100000033868128e-05
1156103,2282.938498,192.168.0.2,104.25.202.21,TCP,54,4218  >  443 [ACK] Seq=1477 Ack=4286058 Win=1959168 Len=0,6.69999999445281e-05
1156106,2282.944036,192.168.0.2,104.25.202.21,TCP,54,4218  >  443 [ACK] Seq=1477 Ack=4288978 Win=1959168 Len=0,0.005537999999887688
1156109,2282.944148,192.168.0.2,104.25.202.21,TCP,54,4218  >  443 [ACK] Seq=1477 Ack=4291898 Win=1959168 Len=0,0.00011200000017197453
1156112,2282.94425,192.168.0.2,104.25.202.21,TCP,54,4218  >  443 [ACK] Seq=1477 Ack=4294818 Win=1959168 Len=0,0.00010199999996984843
1156115,2282.944343,192.168.0.2,104.25.202.21,TCP,54,4218  >  443 [ACK] Seq=1477 Ack=4297738 Win=1959168 Len=0,9.300000010625808e-05
1156118,2282.944441,192.168.0.2,104.25.202.21,TCP,54,4218  >  443 [ACK] Seq=1477 Ack=4300658 Win=1959168 Len=0,9.799999997994746e-05
1156121,2282.944539,192.168.0.2,104.25.202.21,TCP,54,4218  >  443 [ACK] Seq=1477 Ack=4303578 Win=1959168 Len=0,9.799999997994746e-05
1156124,2282.9446350000007,192.168.0.2,104.25.202.21,TCP,54,4218  >  443 [ACK] Seq=1477 Ack=4306498 Win=1959168 Len=0,9.6000000667118e-05
1156127,2282.944729,192.168.0.2,104.25.202.21,TCP,54,4218  >  443 [ACK] Seq=1477 Ack=4309418 Win=1959168 Len=0,9.399999908055179e-05
1156130,2282.944814,192.168.0.2,104.25.202.21,TCP,54,4218  >  443 [ACK] Seq=1477 Ack=4312338 Win=1959168 Len=0,8.500000012645614e-05
1156133,2282.9449019999997,192.168.0.2,104.25.202.21,TCP,54,4218  >  443 [ACK] Seq=1477 Ack=4315258 Win=1959168 Len=0,8.799999977782136e-05
1156136,2282.944993,192.168.0.2,104.25.202.21,TCP,54,4218  >  443 [ACK] Seq=1477 Ack=4318178 Win=1959168 Len=0,9.100000033868128e-05
1156139,2282.946821,192.168.0.2,104.25.202.21,TCP,54,4218  >  443 [ACK] Seq=1477 Ack=4321098 Win=1959168 Len=0,0.0018279999999322172
1156142,2282.946895,192.168.0.2,104.25.202.21,TCP,54,4218  >  443 [ACK] Seq=1477 Ack=4324018 Win=1959168 Len=0,7.400000004054164e-05
1156145,2282.9469670000008,192.168.0.2,104.25.202.21,TCP,54,4218  >  443 [ACK] Seq=1477 Ack=4326938 Win=1959168 Len=0,7.200000072771218e-05
1156148,2282.947038,192.168.0.2,104.25.202.21,TCP,54,4218  >  443 [ACK] Seq=1477 Ack=4329858 Win=1959168 Len=0,7.099999902493437e-05
1156151,2282.947116,192.168.0.2,104.25.202.21,TCP,54,4218  >  443 [ACK] Seq=1477 Ack=4332778 Win=1959168 Len=0,7.80000000304426e-05
1156154,2282.94719,192.168.0.2,104.25.202.21,TCP,54,4218  >  443 [ACK] Seq=1477 Ack=4335698 Win=1959168 Len=0,7.400000004054164e-05
1156157,2282.947722,192.168.0.2,104.25.202.21,TCP,54,4218  >  443 [ACK] Seq=1477 Ack=4338618 Win=1959168 Len=0,0.0005320000000210712
1156160,2282.947787,192.168.0.2,104.25.202.21,TCP,54,4218  >  443 [ACK] Seq=1477 Ack=4341538 Win=1959168 Len=0,6.500000017695129e-05
1156163,2282.947875,192.168.0.2,104.25.202.21,TCP,54,4218  >  443 [ACK] Seq=1477 Ack=4344458 Win=1959168 Len=0,8.799999977782136e-05
1156166,2282.947966,192.168.0.2,104.25.202.21,TCP,54,4218  >  443 [ACK] Seq=1477 Ack=4347378 Win=1959168 Len=0,9.100000033868128e-05
1156169,2282.950534,192.168.0.2,104.25.202.21,TCP,54,4218  >  443 [ACK] Seq=1477 Ack=4350298 Win=1959168 Len=0,0.002567999999882886
1156172,2282.950612,192.168.0.2,104.25.202.21,TCP,54,4218  >  443 [ACK] Seq=1477 Ack=4353218 Win=1959168 Len=0,7.80000000304426e-05
1156175,2282.950675,192.168.0.2,104.25.202.21,TCP,54,4218  >  443 [ACK] Seq=1477 Ack=4356138 Win=1959168 Len=0,6.299999995462713e-05
1156178,2282.950735000001,192.168.0.2,104.25.202.21,TCP,54,4218  >  443 [ACK] Seq=1477 Ack=4359058 Win=1959168 Len=0,6.0000000758009264e-05
1156181,2282.9508,192.168.0.2,104.25.202.21,TCP,54,4218  >  443 [ACK] Seq=1477 Ack=4361978 Win=1959168 Len=0,6.499999926745659e-05
1156184,2282.952748,192.168.0.2,104.25.202.21,TCP,54,4218  >  443 [ACK] Seq=1477 Ack=4364898 Win=1959168 Len=0,0.0019480000000839937
1156187,2282.952860000001,192.168.0.2,104.25.202.21,TCP,54,4218  >  443 [ACK] Seq=1477 Ack=4367818 Win=1959168 Len=0,0.00011200000062672189
1156190,2282.952957,192.168.0.2,104.25.202.21,TCP,54,4218  >  443 [ACK] Seq=1477 Ack=4370738 Win=1959168 Len=0,9.699999918666435e-05
1156193,2282.95305,192.168.0.2,104.25.202.21,TCP,54,4218  >  443 [ACK] Seq=1477 Ack=4373658 Win=1959168 Len=0,9.300000010625808e-05
1156196,2282.953148,192.168.0.2,104.25.202.21,TCP,54,4218  >  443 [ACK] Seq=1477 Ack=4376578 Win=1959168 Len=0,9.799999997994746e-05
1156199,2282.958499,192.168.0.2,104.25.202.21,TCP,54,4218  >  443 [ACK] Seq=1477 Ack=4379498 Win=1959168 Len=0,0.005350999999791384
1156202,2282.958779,192.168.0.2,104.25.202.21,TCP,54,4218  >  443 [ACK] Seq=1477 Ack=4382418 Win=1959168 Len=0,0.00028000000020256266
1156205,2282.959101000001,192.168.0.2,104.25.202.21,TCP,54,4218  >  443 [ACK] Seq=1477 Ack=4385338 Win=1959168 Len=0,0.0003220000007786439
1156208,2282.959359,192.168.0.2,104.25.202.21,TCP,54,4218  >  443 [ACK] Seq=1477 Ack=4388258 Win=1959168 Len=0,0.00025799999912123894
1156211,2282.959717,192.168.0.2,104.25.202.21,TCP,54,4218  >  443 [ACK] Seq=1477 Ack=4391178 Win=1959168 Len=0,0.00035800000023300527
1156214,2282.960029,192.168.0.2,104.25.202.21,TCP,54,4218  >  443 [ACK] Seq=1477 Ack=4394098 Win=1959168 Len=0,0.0003119999996670231
1156217,2282.960344,192.168.0.2,104.25.202.21,TCP,54,4218  >  443 [ACK] Seq=1477 Ack=4397018 Win=1959168 Len=0,0.000315000000227883
1156220,2282.960651000001,192.168.0.2,104.25.202.21,TCP,54,4218  >  443 [ACK] Seq=1477 Ack=4399938 Win=1959168 Len=0,0.0003070000007028284
1156223,2282.9609530000002,192.168.0.2,104.25.202.21,TCP,54,4218  >  443 [ACK] Seq=1477 Ack=4402858 Win=1959168 Len=0,0.000301999999464897
1156226,2282.961046,192.168.0.2,104.25.202.21,TCP,54,4218  >  443 [ACK] Seq=1477 Ack=4405778 Win=1959168 Len=0,9.299999965151073e-05
1156229,2282.961143,192.168.0.2,104.25.202.21,TCP,54,4218  >  443 [ACK] Seq=1477 Ack=4408698 Win=1959168 Len=0,9.700000009615906e-05
1156232,2282.961298,192.168.0.2,104.25.202.21,TCP,54,4218  >  443 [ACK] Seq=1477 Ack=4411618 Win=1959168 Len=0,0.0001550000001770968
1156235,2282.96139,192.168.0.2,104.25.202.21,TCP,54,4218  >  443 [ACK] Seq=1477 Ack=4414538 Win=1959168 Len=0,9.199999976772233e-05
1156238,2282.963485,192.168.0.2,104.25.202.21,TCP,54,4218  >  443 [ACK] Seq=1477 Ack=4417458 Win=1959168 Len=0,0.0020950000002812885
1156241,2282.963589,192.168.0.2,104.25.202.21,TCP,54,4218  >  443 [ACK] Seq=1477 Ack=4420378 Win=1959168 Len=0,0.00010399999973742524
1156244,2282.963683,192.168.0.2,104.25.202.21,TCP,54,4218  >  443 [ACK] Seq=1477 Ack=4423298 Win=1959168 Len=0,9.399999999004649e-05
1156247,2282.963774,192.168.0.2,104.25.202.21,TCP,54,4218  >  443 [ACK] Seq=1477 Ack=4426218 Win=1959168 Len=0,9.099999988393392e-05
1156250,2282.963859,192.168.0.2,104.25.202.21,TCP,54,4218  >  443 [ACK] Seq=1477 Ack=4429138 Win=1959168 Len=0,8.500000012645614e-05
1156253,2282.96395,192.168.0.2,104.25.202.21,TCP,54,4218  >  443 [ACK] Seq=1477 Ack=4432058 Win=1959168 Len=0,9.099999988393392e-05
1156256,2282.96648,192.168.0.2,104.25.202.21,TCP,54,4218  >  443 [ACK] Seq=1477 Ack=4434978 Win=1959168 Len=0,0.0025300000002062006
1156259,2282.966601,192.168.0.2,104.25.202.21,TCP,54,4218  >  443 [ACK] Seq=1477 Ack=4437898 Win=1959168 Len=0,0.00012100000003556488
1156262,2282.966711,192.168.0.2,104.25.202.21,TCP,54,4218  >  443 [ACK] Seq=1477 Ack=4440818 Win=1959168 Len=0,0.00010999999994965037
1156265,2282.966812,192.168.0.2,104.25.202.21,TCP,54,4218  >  443 [ACK] Seq=1477 Ack=4443738 Win=1959168 Len=0,0.00010100000008606003
1156268,2282.966898,192.168.0.2,104.25.202.21,TCP,54,4218  >  443 [ACK] Seq=1477 Ack=4446658 Win=1959168 Len=0,8.600000001024455e-05
1156271,2282.966986,192.168.0.2,104.25.202.21,TCP,54,4218  >  443 [ACK] Seq=1477 Ack=4449578 Win=1959168 Len=0,8.799999977782136e-05
1156274,2282.967142,192.168.0.2,104.25.202.21,TCP,54,4218  >  443 [ACK] Seq=1477 Ack=4452498 Win=1959168 Len=0,0.0001560000000608852
1156277,2282.9738039999997,192.168.0.2,104.25.202.21,TCP,54,4218  >  443 [ACK] Seq=1477 Ack=4455418 Win=1959168 Len=0,0.006661999999778345
1156280,2282.974078,192.168.0.2,104.25.202.21,TCP,54,4218  >  443 [ACK] Seq=1477 Ack=4458338 Win=1959168 Len=0,0.0002740000004450849
1156283,2282.974388,192.168.0.2,104.25.202.21,TCP,54,4218  >  443 [ACK] Seq=1477 Ack=4461258 Win=1959168 Len=0,0.00030999999989944627
1156286,2282.974678,192.168.0.2,104.25.202.21,TCP,54,4218  >  443 [ACK] Seq=1477 Ack=4464178 Win=1959168 Len=0,0.0002899999999499414
1156289,2282.974867000001,192.168.0.2,104.25.202.21,TCP,54,4218  >  443 [ACK] Seq=1477 Ack=4467098 Win=1959168 Len=0,0.0001890000007733761
1156292,2282.974967,192.168.0.2,104.25.202.21,TCP,54,4218  >  443 [ACK] Seq=1477 Ack=4470018 Win=1959168 Len=0,9.999999929277692e-05
1156295,2282.982844,192.168.0.2,104.25.202.21,TCP,54,4218  >  443 [ACK] Seq=1477 Ack=4472938 Win=1959168 Len=0,0.007877000000007683
1156298,2282.982952,192.168.0.2,104.25.202.21,TCP,54,4218  >  443 [ACK] Seq=1477 Ack=4475858 Win=1959168 Len=0,0.00010799999972732621
1156301,2282.983045,192.168.0.2,104.25.202.21,TCP,54,4218  >  443 [ACK] Seq=1477 Ack=4478778 Win=1959168 Len=0,9.300000010625808e-05
1156304,2282.983137,192.168.0.2,104.25.202.21,TCP,54,4218  >  443 [ACK] Seq=1477 Ack=4481698 Win=1959168 Len=0,9.200000022246968e-05
1156307,2282.983236,192.168.0.2,104.25.202.21,TCP,54,4218  >  443 [ACK] Seq=1477 Ack=4484618 Win=1959168 Len=0,9.899999986373587e-05
1156310,2282.983331,192.168.0.2,104.25.202.21,TCP,54,4218  >  443 [ACK] Seq=1477 Ack=4487538 Win=1959168 Len=0,9.49999998738349e-05
1156313,2282.983425,192.168.0.2,104.25.202.21,TCP,54,4218  >  443 [ACK] Seq=1477 Ack=4490458 Win=1959168 Len=0,9.399999999004649e-05
1156316,2282.983517,192.168.0.2,104.25.202.21,TCP,54,4218  >  443 [ACK] Seq=1477 Ack=4493378 Win=1959168 Len=0,9.200000022246968e-05
1156319,2282.983619,192.168.0.2,104.25.202.21,TCP,54,4218  >  443 [ACK] Seq=1477 Ack=4496298 Win=1959168 Len=0,0.00010199999996984843
1156322,2282.98371,192.168.0.2,104.25.202.21,TCP,54,4218  >  443 [ACK] Seq=1477 Ack=4499218 Win=1959168 Len=0,9.099999988393392e-05
1156325,2283.000494000001,192.168.0.2,104.25.202.21,TCP,54,4218  >  443 [ACK] Seq=1477 Ack=4502138 Win=1959168 Len=0,0.016784000000825472
1156328,2283.0005960000008,192.168.0.2,104.25.202.21,TCP,54,4218  >  443 [ACK] Seq=1477 Ack=4505058 Win=1959168 Len=0,0.00010199999996984843
1156331,2283.000687,192.168.0.2,104.25.202.21,TCP,54,4218  >  443 [ACK] Seq=1477 Ack=4507978 Win=1959168 Len=0,9.099999942918657e-05
1156334,2283.000771,192.168.0.2,104.25.202.21,TCP,54,4218  >  443 [ACK] Seq=1477 Ack=4510898 Win=1959168 Len=0,8.399999978792039e-05
1156337,2283.000852,192.168.0.2,104.25.202.21,TCP,54,4218  >  443 [ACK] Seq=1477 Ack=4513818 Win=1959168 Len=0,8.100000013655517e-05
1156340,2283.000932,192.168.0.2,104.25.202.21,TCP,54,4218  >  443 [ACK] Seq=1477 Ack=4516738 Win=1959168 Len=0,7.999999979801942e-05
1156343,2283.0010190000007,192.168.0.2,104.25.202.21,TCP,54,4218  >  443 [ACK] Seq=1477 Ack=4519658 Win=1959168 Len=0,8.700000080352766e-05
1156346,2283.0011,192.168.0.2,104.25.202.21,TCP,54,4218  >  443 [ACK] Seq=1477 Ack=4522578 Win=1959168 Len=0,8.099999922706047e-05
1156349,2283.0020210000002,192.168.0.2,104.25.202.21,TCP,54,4218  >  443 [ACK] Seq=1477 Ack=4525498 Win=1959168 Len=0,0.0009210000002894958
1156352,2283.002138,192.168.0.2,104.25.202.21,TCP,54,4218  >  443 [ACK] Seq=1477 Ack=4528418 Win=1959168 Len=0,0.00011699999959091656
1156355,2283.0022480000002,192.168.0.2,104.25.202.21,TCP,54,4218  >  443 [ACK] Seq=1477 Ack=4531338 Win=1959168 Len=0,0.00011000000040439772
1156358,2283.0072800000007,192.168.0.2,104.25.202.21,TCP,54,4218  >  443 [ACK] Seq=1477 Ack=4534258 Win=1959168 Len=0,0.0050320000004830945
1156361,2283.00743,192.168.0.2,104.25.202.21,TCP,54,4218  >  443 [ACK] Seq=1477 Ack=4537178 Win=1959168 Len=0,0.00014999999939391273
1156364,2283.007537,192.168.0.2,104.25.202.21,TCP,54,4218  >  443 [ACK] Seq=1477 Ack=4540098 Win=1959168 Len=0,0.00010699999984353781
1156366,2283.0077579999997,192.168.0.2,104.25.202.21,TCP,66,[TCP Dup ACK 1156364#1] 4218  >  443 [ACK] Seq=1477 Ack=4540098 Win=1959168 Len=0 SLE=4557618 SRE=4559078,0.00022099999978308915
1156368,2283.007955,192.168.0.2,104.25.202.21,TCP,66,[TCP Dup ACK 1156364#2] 4218  >  443 [ACK] Seq=1477 Ack=4540098 Win=1959168 Len=0 SLE=4557618 SRE=4560538,0.00019700000029843068
1156370,2283.008189,192.168.0.2,104.25.202.21,TCP,66,[TCP Dup ACK 1156364#3] 4218  >  443 [ACK] Seq=1477 Ack=4540098 Win=1959168 Len=0 SLE=4557618 SRE=4561998,0.00023400000009132782
1156372,2283.008401,192.168.0.2,104.25.202.21,TCP,66,[TCP Dup ACK 1156364#4] 4218  >  443 [ACK] Seq=1477 Ack=4540098 Win=1959168 Len=0 SLE=4557618 SRE=4563458,0.0002119999999194988
1156374,2283.008526,192.168.0.2,104.25.202.21,TCP,66,[TCP Dup ACK 1156364#5] 4218  >  443 [ACK] Seq=1477 Ack=4540098 Win=1959168 Len=0 SLE=4557618 SRE=4564918,0.00012500000002546585
1156376,2283.008582,192.168.0.2,104.25.202.21,TCP,66,[TCP Dup ACK 1156364#6] 4218  >  443 [ACK] Seq=1477 Ack=4540098 Win=1959168 Len=0 SLE=4557618 SRE=4566378,5.599999985861359e-05
1156378,2283.00864,192.168.0.2,104.25.202.21,TCP,66,[TCP Dup ACK 1156364#7] 4218  >  443 [ACK] Seq=1477 Ack=4540098 Win=1959168 Len=0 SLE=4557618 SRE=4567838,5.800000008093775e-05
1156380,2283.008701,192.168.0.2,104.25.202.21,TCP,66,[TCP Dup ACK 1156364#8] 4218  >  443 [ACK] Seq=1477 Ack=4540098 Win=1959168 Len=0 SLE=4557618 SRE=4569298,6.100000018705032e-05
1156382,2283.00876,192.168.0.2,104.25.202.21,TCP,66,[TCP Dup ACK 1156364#9] 4218  >  443 [ACK] Seq=1477 Ack=4540098 Win=1959168 Len=0 SLE=4557618 SRE=4570758,5.899999996472616e-05
1156384,2283.008832,192.168.0.2,104.25.202.21,TCP,66,[TCP Dup ACK 1156364#10] 4218  >  443 [ACK] Seq=1477 Ack=4540098 Win=1959168 Len=0 SLE=4557618 SRE=4572218,7.199999981821747e-05
1156386,2283.009001000001,192.168.0.2,104.25.202.21,TCP,66,[TCP Dup ACK 1156364#11] 4218  >  443 [ACK] Seq=1477 Ack=4540098 Win=1959168 Len=0 SLE=4557618 SRE=4573678,0.00016900000082387123
1156388,2283.0091829999997,192.168.0.2,104.25.202.21,TCP,66,[TCP Dup ACK 1156364#12] 4218  >  443 [ACK] Seq=1477 Ack=4540098 Win=1959168 Len=0 SLE=4557618 SRE=4575138,0.00018199999885837315
1156390,2283.0093899999997,192.168.0.2,104.25.202.21,TCP,66,[TCP Dup ACK 1156364#13] 4218  >  443 [ACK] Seq=1477 Ack=4540098 Win=1959168 Len=0 SLE=4557618 SRE=4576598,0.00020700000004580943
1156392,2283.0095899999997,192.168.0.2,104.25.202.21,TCP,66,[TCP Dup ACK 1156364#14] 4218  >  443 [ACK] Seq=1477 Ack=4540098 Win=1959168 Len=0 SLE=4557618 SRE=4578058,0.0001999999999497959
1156394,2283.009788,192.168.0.2,104.25.202.21,TCP,66,[TCP Dup ACK 1156364#15] 4218  >  443 [ACK] Seq=1477 Ack=4540098 Win=1959168 Len=0 SLE=4557618 SRE=4579518,0.00019800000018221908
1156396,2283.010028,192.168.0.2,104.25.202.21,TCP,66,[TCP Dup ACK 1156364#16] 4218  >  443 [ACK] Seq=1477 Ack=4540098 Win=1959168 Len=0 SLE=4557618 SRE=4580978,0.00024000000030355295
1156398,2283.0102890000007,192.168.0.2,104.25.202.21,TCP,66,[TCP Dup ACK 1156364#17] 4218  >  443 [ACK] Seq=1477 Ack=4540098 Win=1959168 Len=0 SLE=4557618 SRE=4582438,0.00026100000059159356
1156400,2283.010526,192.168.0.2,104.25.202.21,TCP,66,[TCP Dup ACK 1156364#18] 4218  >  443 [ACK] Seq=1477 Ack=4540098 Win=1959168 Len=0 SLE=4557618 SRE=4583898,0.00023699999928794568
1156402,2283.010773,192.168.0.2,104.25.202.21,TCP,66,[TCP Dup ACK 1156364#19] 4218  >  443 [ACK] Seq=1477 Ack=4540098 Win=1959168 Len=0 SLE=4557618 SRE=4585358,0.00024699999994481914
1156404,2283.011018,192.168.0.2,104.25.202.21,TCP,66,[TCP Dup ACK 1156364#20] 4218  >  443 [ACK] Seq=1477 Ack=4540098 Win=1959168 Len=0 SLE=4557618 SRE=4586818,0.00024500000017724233
1156406,2283.011565,192.168.0.2,104.25.202.21,TCP,66,[TCP Dup ACK 1156364#21] 4218  >  443 [ACK] Seq=1477 Ack=4540098 Win=1959168 Len=0 SLE=4557618 SRE=4588278,0.0005469999996421393
1156408,2283.011668,192.168.0.2,104.25.202.21,TCP,74,[TCP Dup ACK 1156364#22] 4218  >  443 [ACK] Seq=1477 Ack=4540098 Win=1959168 Len=0 SLE=4623318 SRE=4624778 SLE=4557618 SRE=4588278,0.00010300000030838419
1156410,2283.0117579999996,192.168.0.2,104.25.202.21,TCP,74,[TCP Dup ACK 1156364#23] 4218  >  443 [ACK] Seq=1477 Ack=4540098 Win=1959168 Len=0 SLE=4623318 SRE=4626238 SLE=4557618 SRE=4588278,8.999999954539817e-05
1156412,2283.011816,192.168.0.2,104.25.202.21,TCP,74,[TCP Dup ACK 1156364#24] 4218  >  443 [ACK] Seq=1477 Ack=4540098 Win=1959168 Len=0 SLE=4623318 SRE=4627698 SLE=4557618 SRE=4588278,5.80000005356851e-05
1156414,2283.011872,192.168.0.2,104.25.202.21,TCP,74,[TCP Dup ACK 1156364#25] 4218  >  443 [ACK] Seq=1477 Ack=4540098 Win=1959168 Len=0 SLE=4623318 SRE=4629158 SLE=4557618 SRE=4588278,5.599999985861359e-05
1156416,2283.011928,192.168.0.2,104.25.202.21,TCP,74,[TCP Dup ACK 1156364#26] 4218  >  443 [ACK] Seq=1477 Ack=4540098 Win=1959168 Len=0 SLE=4623318 SRE=4630618 SLE=4557618 SRE=4588278,5.599999985861359e-05
1156418,2283.0119870000008,192.168.0.2,104.25.202.21,TCP,74,[TCP Dup ACK 1156364#27] 4218  >  443 [ACK] Seq=1477 Ack=4540098 Win=1959168 Len=0 SLE=4623318 SRE=4632078 SLE=4557618 SRE=4588278,5.900000087422086e-05
1156420,2283.012044,192.168.0.2,104.25.202.21,TCP,74,[TCP Dup ACK 1156364#28] 4218  >  443 [ACK] Seq=1477 Ack=4540098 Win=1959168 Len=0 SLE=4623318 SRE=4633538 SLE=4557618 SRE=4588278,5.6999999287654646e-05
1156422,2283.012099,192.168.0.2,104.25.202.21,TCP,74,[TCP Dup ACK 1156364#29] 4218  >  443 [ACK] Seq=1477 Ack=4540098 Win=1959168 Len=0 SLE=4623318 SRE=4634998 SLE=4557618 SRE=4588278,5.499999997482519e-05
1156424,2283.012155,192.168.0.2,104.25.202.21,TCP,74,[TCP Dup ACK 1156364#30] 4218  >  443 [ACK] Seq=1477 Ack=4540098 Win=1959168 Len=0 SLE=4623318 SRE=4636458 SLE=4557618 SRE=4588278,5.599999985861359e-05
1156426,2283.012212,192.168.0.2,104.25.202.21,TCP,74,[TCP Dup ACK 1156364#31] 4218  >  443 [ACK] Seq=1477 Ack=4540098 Win=1959168 Len=0 SLE=4623318 SRE=4637918 SLE=4557618 SRE=4588278,5.700000019714935e-05
1156428,2283.012267,192.168.0.2,104.25.202.21,TCP,74,[TCP Dup ACK 1156364#32] 4218  >  443 [ACK] Seq=1477 Ack=4540098 Win=1959168 Len=0 SLE=4623318 SRE=4639378 SLE=4557618 SRE=4588278,5.499999997482519e-05
1156430,2283.012327,192.168.0.2,104.25.202.21,TCP,74,[TCP Dup ACK 1156364#33] 4218  >  443 [ACK] Seq=1477 Ack=4540098 Win=1959168 Len=0 SLE=4623318 SRE=4640838 SLE=4557618 SRE=4588278,5.999999984851456e-05
1156432,2283.012381,192.168.0.2,104.25.202.21,TCP,74,[TCP Dup ACK 1156364#34] 4218  >  443 [ACK] Seq=1477 Ack=4540098 Win=1959168 Len=0 SLE=4623318 SRE=4642298 SLE=4557618 SRE=4588278,5.400000009103678e-05
1156434,2283.014106,192.168.0.2,104.25.202.21,TCP,74,[TCP Dup ACK 1156364#35] 4218  >  443 [ACK] Seq=1477 Ack=4540098 Win=1959168 Len=0 SLE=4623318 SRE=4643758 SLE=4557618 SRE=4588278,0.0017250000000785803
1156436,2283.014216,192.168.0.2,104.25.202.21,TCP,74,[TCP Dup ACK 1156364#36] 4218  >  443 [ACK] Seq=1477 Ack=4540098 Win=1959168 Len=0 SLE=4623318 SRE=4645218 SLE=4557618 SRE=4588278,0.00010999999994965037
1156438,2283.014288,192.168.0.2,104.25.202.21,TCP,74,[TCP Dup ACK 1156364#37] 4218  >  443 [ACK] Seq=1477 Ack=4540098 Win=1959168 Len=0 SLE=4623318 SRE=4646678 SLE=4557618 SRE=4588278,7.199999981821747e-05
1156440,2283.0143550000007,192.168.0.2,104.25.202.21,TCP,74,[TCP Dup ACK 1156364#38] 4218  >  443 [ACK] Seq=1477 Ack=4540098 Win=1959168 Len=0 SLE=4623318 SRE=4648138 SLE=4557618 SRE=4588278,6.70000008540228e-05
1156442,2283.01442,192.168.0.2,104.25.202.21,TCP,74,[TCP Dup ACK 1156364#39] 4218  >  443 [ACK] Seq=1477 Ack=4540098 Win=1959168 Len=0 SLE=4623318 SRE=4649598 SLE=4557618 SRE=4588278,6.499999926745659e-05
1156444,2283.014485,192.168.0.2,104.25.202.21,TCP,74,[TCP Dup ACK 1156364#40] 4218  >  443 [ACK] Seq=1477 Ack=4540098 Win=1959168 Len=0 SLE=4623318 SRE=4651058 SLE=4557618 SRE=4588278,6.500000017695129e-05
1156446,2283.014548,192.168.0.2,104.25.202.21,TCP,74,[TCP Dup ACK 1156364#41] 4218  >  443 [ACK] Seq=1477 Ack=4540098 Win=1959168 Len=0 SLE=4623318 SRE=4652518 SLE=4557618 SRE=4588278,6.299999995462713e-05
1156448,2283.01461,192.168.0.2,104.25.202.21,TCP,82,[TCP Dup ACK 1156364#42] 4218  >  443 [ACK] Seq=1477 Ack=4540098 Win=1959168 Len=0 SLE=4712378 SRE=4713838 SLE=4623318 SRE=4652518 SLE=4557618 SRE=4588278,6.200000007083872e-05
1156450,2283.0146760000002,192.168.0.2,104.25.202.21,TCP,82,[TCP Dup ACK 1156364#43] 4218  >  443 [ACK] Seq=1477 Ack=4540098 Win=1959168 Len=0 SLE=4712378 SRE=4715298 SLE=4623318 SRE=4652518 SLE=4557618 SRE=4588278,6.60000000607397e-05
1156452,2283.014737,192.168.0.2,104.25.202.21,TCP,82,[TCP Dup ACK 1156364#44] 4218  >  443 [ACK] Seq=1477 Ack=4540098 Win=1959168 Len=0 SLE=4712378 SRE=4716758 SLE=4623318 SRE=4652518 SLE=4557618 SRE=4588278,6.099999973230297e-05
