No.,Time,Source,Destination,Protocol,Length,Info,TBP
1217585,2481.357111,192.168.0.2,24.226.180.60,TCP,1514,[TCP segment of a reassembled PDU],0.0
1217586,2481.357111,192.168.0.2,24.226.180.60,TCP,1514,[TCP segment of a reassembled PDU],0.0
1217587,2481.357112,192.168.0.2,24.226.180.60,TCP,1514,[TCP segment of a reassembled PDU],1.0000003385357559e-06
1217588,2481.357112,192.168.0.2,24.226.180.60,TCP,1514,[TCP segment of a reassembled PDU],0.0
1217589,2481.357112,192.168.0.2,24.226.180.60,TCP,1514,[TCP segment of a reassembled PDU],0.0
1217590,2481.357113,192.168.0.2,24.226.180.60,BitTorrent,1514,"Piece, Idx:0x2076,Begin:0x4c000,Len:0x4000  [TCP segment of a reassembled PDU]",9.99999883788405e-07
1217592,2481.36289,192.168.0.2,24.226.180.60,TCP,1514,[TCP segment of a reassembled PDU],0.0057769999998527055
1217593,2481.36289,192.168.0.2,24.226.180.60,TCP,1514,[TCP segment of a reassembled PDU],0.0
1217596,2481.3630940000007,192.168.0.2,24.226.180.60,TCP,1514,[TCP segment of a reassembled PDU],0.00020400000084919157
1217597,2481.363096,192.168.0.2,24.226.180.60,TCP,1514,[TCP segment of a reassembled PDU],1.999999312829459e-06
1217598,2481.363096,192.168.0.2,24.226.180.60,TCP,1514,[TCP segment of a reassembled PDU],0.0
1217599,2481.363097,192.168.0.2,24.226.180.60,TCP,1514,[TCP segment of a reassembled PDU],9.99999883788405e-07
1217601,2481.3639510000007,192.168.0.2,24.226.180.60,TCP,1514,[TCP segment of a reassembled PDU],0.000854000000799715
1217602,2481.363952,192.168.0.2,24.226.180.60,TCP,1514,[TCP segment of a reassembled PDU],9.99999429041054e-07
1217603,2481.363952,192.168.0.2,24.226.180.60,TCP,1514,[TCP segment of a reassembled PDU],0.0
1217604,2481.363953,192.168.0.2,24.226.180.60,TCP,1514,[TCP segment of a reassembled PDU],9.99999883788405e-07
1217607,2481.408305,192.168.0.2,24.226.180.60,BitTorrent,1514,"Piece, Idx:0x2076,Begin:0x44000,Len:0x4000  [TCP segment of a reassembled PDU]",0.04435199999988981
1217608,2481.408305,192.168.0.2,24.226.180.60,TCP,1514,[TCP segment of a reassembled PDU],0.0
1217610,2481.415191,192.168.0.2,24.226.180.60,TCP,1514,[TCP segment of a reassembled PDU],0.006886000000122294
1217611,2481.415194,192.168.0.2,24.226.180.60,TCP,1514,[TCP segment of a reassembled PDU],3.000000106112566e-06
1217614,2481.4161129999998,192.168.0.2,24.226.180.60,TCP,1514,[TCP segment of a reassembled PDU],0.0009189999996124243
1217615,2481.416124,192.168.0.2,24.226.180.60,TCP,1514,[TCP segment of a reassembled PDU],1.1000000085914508e-05
1217616,2481.416126,192.168.0.2,24.226.180.60,TCP,1514,[TCP segment of a reassembled PDU],2.000000222324161e-06
1217617,2481.4161289999997,192.168.0.2,24.226.180.60,TCP,1514,[TCP segment of a reassembled PDU],2.999999651365215e-06
1217618,2481.41613,192.168.0.2,24.226.180.60,TCP,1514,[TCP segment of a reassembled PDU],1.0000003385357559e-06
1217619,2481.416132,192.168.0.2,24.226.180.60,TCP,1514,[TCP segment of a reassembled PDU],1.99999976757681e-06
1217620,2481.4161329999997,192.168.0.2,24.226.180.60,TCP,1514,[TCP segment of a reassembled PDU],9.99999883788405e-07
1217623,2481.4209149999997,192.168.0.2,24.226.180.60,BitTorrent,1065,"Piece, Idx:0x2076,Begin:0x48000,Len:0x4000  ",0.004781999999977415
1217635,2481.4357489999998,192.168.0.2,188.49.129.56,GVSP,993,Unknown Format (0x34) [Block ID: 16862788919815619408 Packet ID: -1088984987] [RANGE_ERROR] [PACKET_RESEND] Unknown Payload Type (0x2911) ,0.014834000000064407
1217640,2481.48412,192.168.0.2,24.226.180.60,TCP,1514,[TCP segment of a reassembled PDU],0.04837100000031569
1217641,2481.523733,192.168.0.2,113.193.151.171,UDP,94,62257  >  50670 Len=52,0.03961299999991752
1217642,2481.523818,192.168.0.2,113.193.151.171,UDP,94,62257  >  50670 Len=52,8.500000012645614e-05
1217655,2481.6005760000007,192.168.0.2,113.193.151.171,UDP,1312,62257  >  50670 Len=1270,0.07675800000060917
1217656,2481.60065,192.168.0.2,113.193.151.171,UDP,1312,62257  >  50670 Len=1270,7.399999913104693e-05
1217659,2481.600756,192.168.0.2,113.193.151.171,UDP,1312,62257  >  50670 Len=1270,0.0001059999999597494
1217664,2481.654465,192.168.0.2,104.25.202.21,TLSv1.2,149,Application Data,0.05370900000025358
1217665,2481.654768,192.168.0.2,104.25.202.21,TLSv1.2,149,Application Data,0.00030299999980343273
1217666,2481.65508,192.168.0.2,104.25.202.21,TLSv1.2,149,Application Data,0.0003120000001217704
1217667,2481.6551329999998,192.168.0.2,104.25.202.21,TLSv1.2,153,Application Data,5.2999999752501026e-05
1217668,2481.655177,192.168.0.2,104.25.202.21,TLSv1.2,144,Application Data,4.400000034365803e-05
1217669,2481.655223,192.168.0.2,104.25.202.21,TLSv1.2,144,Application Data,4.600000011123484e-05
1217670,2481.655268,192.168.0.2,104.25.202.21,TLSv1.2,150,Application Data,4.4999999772699084e-05
1217671,2481.655366,192.168.0.2,104.25.202.21,TLSv1.2,149,Application Data,9.799999997994746e-05
1217672,2481.6725579999998,192.168.0.2,104.25.202.21,TLSv1.2,142,Application Data,0.01719199999979537
1217673,2481.672615,192.168.0.2,104.25.202.21,TLSv1.2,142,Application Data,5.700000019714935e-05
1217674,2481.672793,192.168.0.2,104.25.202.21,TLSv1.2,149,Application Data,0.00017800000023271423
1217675,2481.6728350000008,192.168.0.2,104.25.202.21,TLSv1.2,149,Application Data,4.200000057608122e-05
1217676,2481.67286,192.168.0.2,104.25.202.21,TLSv1.2,149,Application Data,2.499999936844688e-05
1217677,2481.672886,192.168.0.2,104.25.202.21,TLSv1.2,152,Application Data,2.5999999706982635e-05
1217680,2481.691111,192.168.0.2,113.193.151.171,UDP,1312,62257  >  50670 Len=1270,0.01822500000025684
1217681,2481.6911800000007,192.168.0.2,113.193.151.171,UDP,1312,62257  >  50670 Len=1270,6.900000062159961e-05
1217683,2481.691507,192.168.0.2,113.193.151.171,UDP,1312,62257  >  50670 Len=1270,0.0003269999992880912
1217688,2481.6934899999997,192.168.0.2,113.193.151.171,UDP,1312,62257  >  50670 Len=1270,0.0019829999996545666
1217689,2481.69355,192.168.0.2,113.193.151.171,UDP,1312,62257  >  50670 Len=1270,6.000000030326191e-05
1217690,2481.6935829999998,192.168.0.2,113.193.151.171,UDP,1312,62257  >  50670 Len=1270,3.299999980299617e-05
1217691,2481.693612,192.168.0.2,113.193.151.171,UDP,1312,62257  >  50670 Len=1270,2.900000026784255e-05
1217693,2481.706701,192.168.0.2,104.25.202.21,TCP,54,4337  >  443 [ACK] Seq=20293 Ack=1628644 Win=1401600 Len=0,0.013089000000036322
1217696,2481.7119190000008,192.168.0.2,104.25.202.21,TCP,54,4337  >  443 [ACK] Seq=20293 Ack=1630042 Win=1400064 Len=0,0.005218000000695611
1217699,2481.717868,192.168.0.2,104.25.202.21,TCP,66,[TCP Dup ACK 1217696#1] 4337  >  443 [ACK] Seq=20293 Ack=1630042 Win=1400064 Len=0 SLE=1690941 SRE=1692389,0.005948999999418447
1217701,2481.7186460000007,192.168.0.2,104.25.202.21,TCP,66,4337  >  443 [ACK] Seq=20293 Ack=1631440 Win=1401600 Len=0 SLE=1690941 SRE=1692389,0.0007780000005368493
1217703,2481.718696,192.168.0.2,104.25.202.21,TCP,66,[TCP Dup ACK 1217701#1] 4337  >  443 [ACK] Seq=20293 Ack=1631440 Win=1401600 Len=0 SLE=1690941 SRE=1693837,4.999999919164111e-05
1217705,2481.719473,192.168.0.2,104.25.202.21,TCP,66,[TCP Dup ACK 1217701#2] 4337  >  443 [ACK] Seq=20293 Ack=1631440 Win=1401600 Len=0 SLE=1690941 SRE=1695199,0.0007770000001983135
1217707,2481.719512,192.168.0.2,104.25.202.21,TCP,66,[TCP Dup ACK 1217701#3] 4337  >  443 [ACK] Seq=20293 Ack=1631440 Win=1401600 Len=0 SLE=1690941 SRE=1695544,3.90000000152213e-05
1217709,2481.719536,192.168.0.2,104.25.202.21,TCP,66,[TCP Dup ACK 1217701#4] 4337  >  443 [ACK] Seq=20293 Ack=1631440 Win=1401600 Len=0 SLE=1690941 SRE=1695582,2.3999999939405825e-05
1217711,2481.722626,192.168.0.2,104.25.202.21,TCP,66,[TCP Dup ACK 1217701#5] 4337  >  443 [ACK] Seq=20293 Ack=1631440 Win=1401600 Len=0 SLE=1690941 SRE=1697030,0.0030900000001565786
1217713,2481.723067000001,192.168.0.2,104.25.202.21,TCP,66,[TCP Dup ACK 1217701#6] 4337  >  443 [ACK] Seq=20293 Ack=1631440 Win=1401600 Len=0 SLE=1690941 SRE=1698478,0.0004410000005918846
1217715,2481.7242899999997,192.168.0.2,104.25.202.21,TCP,66,[TCP Dup ACK 1217701#7] 4337  >  443 [ACK] Seq=20293 Ack=1631440 Win=1401600 Len=0 SLE=1690941 SRE=1699840,0.001222999998844898
1217717,2481.724323,192.168.0.2,104.25.202.21,TCP,66,[TCP Dup ACK 1217701#8] 4337  >  443 [ACK] Seq=20293 Ack=1631440 Win=1401600 Len=0 SLE=1690941 SRE=1701288,3.300000025774352e-05
1217719,2481.72436,192.168.0.2,104.25.202.21,TCP,66,[TCP Dup ACK 1217701#9] 4337  >  443 [ACK] Seq=20293 Ack=1631440 Win=1401600 Len=0 SLE=1690941 SRE=1702736,3.700000024764449e-05
1217721,2481.724397,192.168.0.2,104.25.202.21,TCP,66,4337  >  443 [ACK] Seq=20293 Ack=1632838 Win=1400064 Len=0 SLE=1690941 SRE=1702736,3.699999979289714e-05
1217724,2481.725261,192.168.0.2,104.25.202.21,TCP,66,[TCP Dup ACK 1217721#1] 4337  >  443 [ACK] Seq=20293 Ack=1632838 Win=1400064 Len=0 SLE=1690941 SRE=1704098,0.0008640000000923465
1217726,2481.725293,192.168.0.2,104.25.202.21,TCP,66,[TCP Dup ACK 1217721#2] 4337  >  443 [ACK] Seq=20293 Ack=1632838 Win=1400064 Len=0 SLE=1690941 SRE=1705546,3.199999991920777e-05
1217728,2481.725321,192.168.0.2,104.25.202.21,TCP,66,[TCP Dup ACK 1217721#3] 4337  >  443 [ACK] Seq=20293 Ack=1632838 Win=1400064 Len=0 SLE=1690941 SRE=1706351,2.7999999929306796e-05
1217730,2481.729082,192.168.0.2,104.25.202.21,TCP,66,4337  >  443 [ACK] Seq=20293 Ack=1634298 Win=1401600 Len=0 SLE=1690941 SRE=1706351,0.0037609999999403954
1217732,2481.730902,192.168.0.2,104.25.202.21,TCP,74,[TCP Dup ACK 1217730#1] 4337  >  443 [ACK] Seq=20293 Ack=1634298 Win=1401600 Len=0 SLE=1630042 SRE=1631440 SLE=1690941 SRE=1706351,0.0018199999999524152
1217734,2481.73136,192.168.0.2,104.25.202.21,TCP,74,[TCP Dup ACK 1217730#2] 4337  >  443 [ACK] Seq=20293 Ack=1634298 Win=1401600 Len=0 SLE=1631440 SRE=1632838 SLE=1690941 SRE=1706351,0.0004580000004352769
1217736,2481.7324710000007,192.168.0.2,104.25.202.21,TCP,74,[TCP Dup ACK 1217730#3] 4337  >  443 [ACK] Seq=20293 Ack=1634298 Win=1401600 Len=0 SLE=1632838 SRE=1634286 SLE=1690941 SRE=1706351,0.001111000000491913
1217738,2481.7325100000007,192.168.0.2,104.25.202.21,TCP,74,4337  >  443 [ACK] Seq=20293 Ack=1635634 Win=1400064 Len=0 SLE=1634286 SRE=1634298 SLE=1690941 SRE=1706351,3.90000000152213e-05
1217740,2481.735083,192.168.0.2,104.25.202.21,TCP,74,[TCP Dup ACK 1217738#1] 4337  >  443 [ACK] Seq=20293 Ack=1635634 Win=1400064 Len=0 SLE=1634298 SRE=1635634 SLE=1690941 SRE=1706351,0.002572999999301828
1217742,2481.736575,192.168.0.2,104.25.202.21,TCP,66,4337  >  443 [ACK] Seq=20293 Ack=1636397 Win=1401600 Len=0 SLE=1690941 SRE=1706351,0.001491999999871041
1217744,2481.7369989999997,192.168.0.2,104.25.202.21,TCP,66,4337  >  443 [ACK] Seq=20293 Ack=1637795 Win=1400064 Len=0 SLE=1690941 SRE=1706351,0.0004239999998389976
1217746,2481.738189,192.168.0.2,104.25.202.21,TCP,66,4337  >  443 [ACK] Seq=20293 Ack=1639193 Win=1401600 Len=0 SLE=1690941 SRE=1706351,0.001190000000406144
1217748,2481.738241,192.168.0.2,104.25.202.21,TCP,66,4337  >  443 [ACK] Seq=20293 Ack=1640591 Win=1400064 Len=0 SLE=1690941 SRE=1706351,5.199999986871262e-05
1217750,2481.738584,192.168.0.2,104.25.202.21,TCP,66,4337  >  443 [ACK] Seq=20293 Ack=1642039 Win=1401600 Len=0 SLE=1690941 SRE=1706351,0.0003430000001571898
1217752,2481.740026,192.168.0.2,104.25.202.21,TCP,74,[TCP Dup ACK 1217750#1] 4337  >  443 [ACK] Seq=20293 Ack=1642039 Win=1401600 Len=0 SLE=1635634 SRE=1636397 SLE=1690941 SRE=1706351,0.0014419999997699051
1217754,2481.741396,192.168.0.2,104.25.202.21,TCP,66,4337  >  443 [ACK] Seq=20293 Ack=1643387 Win=1400064 Len=0 SLE=1690941 SRE=1706351,0.0013699999999516876
1217756,2481.741874,192.168.0.2,104.25.202.21,TCP,66,4337  >  443 [ACK] Seq=20293 Ack=1644835 Win=1401600 Len=0 SLE=1690941 SRE=1706351,0.0004779999999300344
1217758,2481.7429850000008,192.168.0.2,104.25.202.21,TCP,66,4337  >  443 [ACK] Seq=20293 Ack=1646283 Win=1400064 Len=0 SLE=1690941 SRE=1706351,0.0011110000009466603
1217760,2481.743013,192.168.0.2,104.25.202.21,TCP,66,4337  >  443 [ACK] Seq=20293 Ack=1647731 Win=1401600 Len=0 SLE=1690941 SRE=1706351,2.7999999019812094e-05
1217762,2481.743024,192.168.0.2,104.25.202.21,TCP,66,4337  >  443 [ACK] Seq=20293 Ack=1647767 Win=1401344 Len=0 SLE=1690941 SRE=1706351,1.1000000085914508e-05
1217764,2481.743995,192.168.0.2,104.25.202.21,TCP,66,4337  >  443 [ACK] Seq=20293 Ack=1649215 Win=1401600 Len=0 SLE=1690941 SRE=1706351,0.0009709999999358843
1217766,2481.74404,192.168.0.2,104.25.202.21,TCP,66,4337  >  443 [ACK] Seq=20293 Ack=1650663 Win=1400064 Len=0 SLE=1690941 SRE=1706351,4.5000000227446435e-05
1217768,2481.744103,192.168.0.2,104.25.202.21,TCP,66,4337  >  443 [ACK] Seq=20293 Ack=1652111 Win=1401600 Len=0 SLE=1690941 SRE=1706351,6.299999995462713e-05
1217770,2481.744117,192.168.0.2,104.25.202.21,TCP,66,4337  >  443 [ACK] Seq=20293 Ack=1652147 Win=1401344 Len=0 SLE=1690941 SRE=1706351,1.4000000192027073e-05
1217772,2481.744145,192.168.0.2,104.25.202.21,TCP,66,4337  >  443 [ACK] Seq=20293 Ack=1653595 Win=1401600 Len=0 SLE=1690941 SRE=1706351,2.7999999929306796e-05
1217774,2481.74578,192.168.0.2,104.25.202.21,TCP,74,[TCP Dup ACK 1217772#1] 4337  >  443 [ACK] Seq=20293 Ack=1653595 Win=1401600 Len=0 SLE=1636397 SRE=1637795 SLE=1690941 SRE=1706351,0.0016350000000784348
1217776,2481.7471149999997,192.168.0.2,104.25.202.21,TCP,66,4337  >  443 [ACK] Seq=20293 Ack=1655043 Win=1400064 Len=0 SLE=1690941 SRE=1706351,0.00133499999947162
1217778,2481.747495,192.168.0.2,104.25.202.21,TCP,66,4337  >  443 [ACK] Seq=20293 Ack=1656074 Win=1401600 Len=0 SLE=1690941 SRE=1706351,0.0003800000004048343
1217780,2481.753717,192.168.0.2,104.25.202.21,TCP,66,4337  >  443 [ACK] Seq=20293 Ack=1657472 Win=1400064 Len=0 SLE=1690941 SRE=1706351,0.006221999999979744
1217782,2481.75377,192.168.0.2,104.25.202.21,TCP,66,4337  >  443 [ACK] Seq=20293 Ack=1658870 Win=1401600 Len=0 SLE=1690941 SRE=1706351,5.2999999752501026e-05
1217784,2481.753815,192.168.0.2,104.25.202.21,TCP,66,4337  >  443 [ACK] Seq=20293 Ack=1660318 Win=1400064 Len=0 SLE=1690941 SRE=1706351,4.5000000227446435e-05
1217786,2481.753857,192.168.0.2,104.25.202.21,TCP,66,4337  >  443 [ACK] Seq=20293 Ack=1661666 Win=1401600 Len=0 SLE=1690941 SRE=1706351,4.200000012133387e-05
1217788,2481.753893,192.168.0.2,104.25.202.21,TCP,66,4337  >  443 [ACK] Seq=20293 Ack=1663114 Win=1400064 Len=0 SLE=1690941 SRE=1706351,3.599999990910874e-05
1217790,2481.753926000001,192.168.0.2,104.25.202.21,TCP,74,[TCP Dup ACK 1217788#1] 4337  >  443 [ACK] Seq=20293 Ack=1663114 Win=1400064 Len=0 SLE=1637795 SRE=1639193 SLE=1690941 SRE=1706351,3.3000000712490873e-05
1217792,2481.75396,192.168.0.2,104.25.202.21,TCP,66,4337  >  443 [ACK] Seq=20293 Ack=1664562 Win=1401600 Len=0 SLE=1690941 SRE=1706351,3.3999999232037226e-05
1217794,2481.753994,192.168.0.2,104.25.202.21,TCP,66,4337  >  443 [ACK] Seq=20293 Ack=1666010 Win=1400064 Len=0 SLE=1690941 SRE=1706351,3.400000014153193e-05
1217796,2481.7540089999998,192.168.0.2,104.25.202.21,TCP,66,4337  >  443 [ACK] Seq=20293 Ack=1666046 Win=1401600 Len=0 SLE=1690941 SRE=1706351,1.4999999621068127e-05
1217798,2481.75404,192.168.0.2,104.25.202.21,TCP,66,4337  >  443 [ACK] Seq=20293 Ack=1667494 Win=1400064 Len=0 SLE=1690941 SRE=1706351,3.100000003541936e-05
1217800,2481.754165,192.168.0.2,104.25.202.21,TCP,66,4337  >  443 [ACK] Seq=20293 Ack=1668942 Win=1401600 Len=0 SLE=1690941 SRE=1706351,0.00012500000002546585
1217802,2481.754235000001,192.168.0.2,104.25.202.21,TCP,66,4337  >  443 [ACK] Seq=20293 Ack=1670390 Win=1400064 Len=0 SLE=1690941 SRE=1706351,7.000000096013537e-05
1217804,2481.754254,192.168.0.2,104.25.202.21,TCP,66,4337  >  443 [ACK] Seq=20293 Ack=1670426 Win=1401600 Len=0 SLE=1690941 SRE=1706351,1.8999999156221747e-05
1217807,2481.754486,192.168.0.2,188.49.129.56,GVSP,62,Unknown Format (0x34) [Block ID: 16862781017075794751 Packet ID: -1088919450] [RANGE_ERROR] [PACKET_RESEND] Unknown Payload Type (0x0) ,0.00023199999986900366
1217808,2481.75449,192.168.0.2,104.25.202.21,TCP,66,4337  >  443 [ACK] Seq=20293 Ack=1671874 Win=1400064 Len=0 SLE=1690941 SRE=1706351,3.999999989900971e-06
1217810,2481.7545370000007,192.168.0.2,104.25.202.21,TCP,66,4337  >  443 [ACK] Seq=20293 Ack=1673322 Win=1401600 Len=0 SLE=1690941 SRE=1706351,4.700000090451795e-05
1217812,2481.7575190000002,192.168.0.2,104.25.202.21,TCP,74,[TCP Dup ACK 1217810#1] 4337  >  443 [ACK] Seq=20293 Ack=1673322 Win=1401600 Len=0 SLE=1639193 SRE=1640591 SLE=1690941 SRE=1706351,0.0029819999995197577
1217814,2481.758068,192.168.0.2,104.25.202.21,TCP,66,4337  >  443 [ACK] Seq=20293 Ack=1674770 Win=1400064 Len=0 SLE=1690941 SRE=1706351,0.0005489999998644635
1217816,2481.758087,192.168.0.2,104.25.202.21,TCP,66,4337  >  443 [ACK] Seq=20293 Ack=1674806 Win=1401600 Len=0 SLE=1690941 SRE=1706351,1.900000006571645e-05
1217818,2481.758111,192.168.0.2,104.25.202.21,TCP,66,4337  >  443 [ACK] Seq=20293 Ack=1675208 Win=1401088 Len=0 SLE=1690941 SRE=1706351,2.3999999939405825e-05
1217820,2481.759858,192.168.0.2,104.25.202.21,TCP,66,4337  >  443 [ACK] Seq=20293 Ack=1676606 Win=1401600 Len=0 SLE=1690941 SRE=1706351,0.001746999999795662
1217822,2481.75991,192.168.0.2,104.25.202.21,TCP,66,4337  >  443 [ACK] Seq=20293 Ack=1678004 Win=1400064 Len=0 SLE=1690941 SRE=1706351,5.200000032345997e-05
1217824,2481.760511,192.168.0.2,104.25.202.21,TCP,66,4337  >  443 [ACK] Seq=20293 Ack=1679452 Win=1401600 Len=0 SLE=1690941 SRE=1706351,0.0006009999997331761
1217826,2481.7605559999997,192.168.0.2,104.25.202.21,TCP,66,4337  >  443 [ACK] Seq=20293 Ack=1680900 Win=1400064 Len=0 SLE=1690941 SRE=1706351,4.4999999772699084e-05
1217828,2481.760597,192.168.0.2,104.25.202.21,TCP,66,4337  >  443 [ACK] Seq=20293 Ack=1681755 Win=1401600 Len=0 SLE=1690941 SRE=1706351,4.1000000237545464e-05
1217830,2481.7606140000007,192.168.0.2,104.25.202.21,TCP,66,4337  >  443 [ACK] Seq=20293 Ack=1681793 Win=1401344 Len=0 SLE=1690941 SRE=1706351,1.700000075288699e-05
1217832,2481.760691,192.168.0.2,104.25.202.21,TCP,66,4337  >  443 [ACK] Seq=20293 Ack=1683241 Win=1401600 Len=0 SLE=1690941 SRE=1706351,7.69999992371595e-05
1217834,2481.7632489999996,192.168.0.2,104.25.202.21,TCP,66,4337  >  443 [ACK] Seq=20293 Ack=1684689 Win=1400064 Len=0 SLE=1690941 SRE=1706351,0.00255799999968076
1217836,2481.7634199999998,192.168.0.2,104.25.202.21,TCP,66,4337  >  443 [ACK] Seq=20293 Ack=1686051 Win=1401600 Len=0 SLE=1690941 SRE=1706351,0.0001710000001367007
1217838,2481.763453,192.168.0.2,104.25.202.21,TCP,74,[TCP Dup ACK 1217836#1] 4337  >  443 [ACK] Seq=20293 Ack=1686051 Win=1401600 Len=0 SLE=1640591 SRE=1642051 SLE=1690941 SRE=1706351,3.300000025774352e-05
1217840,2481.763489,192.168.0.2,104.25.202.21,TCP,66,4337  >  443 [ACK] Seq=20293 Ack=1686803 Win=1400832 Len=0 SLE=1690941 SRE=1706351,3.599999990910874e-05
1217842,2481.763506,192.168.0.2,104.25.202.21,TCP,66,4337  >  443 [ACK] Seq=20293 Ack=1686841 Win=1400576 Len=0 SLE=1690941 SRE=1706351,1.699999984339229e-05
1217844,2481.764925,192.168.0.2,104.25.202.21,TCP,66,4337  >  443 [ACK] Seq=20293 Ack=1688289 Win=1401600 Len=0 SLE=1690941 SRE=1706351,0.001419000000169035
1217846,2481.769507,192.168.0.2,104.25.202.21,TCP,74,[TCP Dup ACK 1217844#1] 4337  >  443 [ACK] Seq=20293 Ack=1688289 Win=1401600 Len=0 SLE=1642051 SRE=1643387 SLE=1690941 SRE=1706351,0.0045820000000276195
1217848,2481.771529,192.168.0.2,104.25.202.21,TCP,66,4337  >  443 [ACK] Seq=20293 Ack=1689737 Win=1400064 Len=0 SLE=1690941 SRE=1706351,0.0020220000001245353
1217850,2481.77158,192.168.0.2,104.25.202.21,TCP,66,4337  >  443 [ACK] Seq=20293 Ack=1690903 Win=1401600 Len=0 SLE=1690941 SRE=1706351,5.0999999984924216e-05
1217852,2481.771628,192.168.0.2,104.25.202.21,TCP,54,4337  >  443 [ACK] Seq=20293 Ack=1706351 Win=1401600 Len=0,4.799999987881165e-05
1217854,2481.774823,192.168.0.2,104.25.202.21,TCP,66,[TCP Dup ACK 1217852#1] 4337  >  443 [ACK] Seq=20293 Ack=1706351 Win=1401600 Len=0 SLE=1643387 SRE=1644847,0.0031950000002325396
1217855,2481.779514,192.168.0.2,188.49.129.56,GVSP,1468,Unknown Format (0x34) [Block ID: 16862781017075794768 Packet ID: -1088919450] [RANGE_ERROR] [PACKET_RESEND] MUTLIZONEIAMGE ,0.004690999999638734
1217857,2481.779582,192.168.0.2,104.25.202.21,TCP,66,[TCP Dup ACK 1217852#2] 4337  >  443 [ACK] Seq=20293 Ack=1706351 Win=1401600 Len=0 SLE=1644847 SRE=1646307,6.800000028306386e-05
1217858,2481.779588,192.168.0.2,188.49.129.56,GVSP,1468,Unknown Format (0x34) [Block ID: 16862781017075794768 Packet ID: -1088853914] [RANGE_ERROR] [PACKET_RESEND] Unknown Payload Type (0xbbb) ,5.999999757477781e-06
1217859,2481.779615,192.168.0.2,188.49.129.56,GVSP,1468,Unknown Format (0x34) [Block ID: 16862781017075794768 Packet ID: -1088788378] [RANGE_ERROR] [PACKET_RESEND] Unknown Payload Type (0x2eee) ,2.700000004551839e-05
1217860,2481.77966,192.168.0.2,188.49.129.56,GVSP,1468,Unknown Format (0x34) [Block ID: 16862781017075794768 Packet ID: -1088722842] [RANGE_ERROR] [PACKET_RESEND] Unknown Payload Type (0x1162) ,4.5000000227446435e-05
1217861,2481.779692,192.168.0.2,188.49.129.56,GVSP,1468,Unknown Format (0x34) [Block ID: 16862781017075794768 Packet ID: -1088657306] [RANGE_ERROR] [PACKET_RESEND] Unknown Payload Type (0x13f) ,3.199999991920777e-05
1217862,2481.779724,192.168.0.2,188.49.129.56,GVSP,1468,Unknown Format (0x34) [Block ID: 16862781017075794768 Packet ID: -1088591770] [RANGE_ERROR] [PACKET_RESEND] Unknown Payload Type (0x1d77) ,3.199999991920777e-05
1217863,2481.779759,192.168.0.2,188.49.129.56,GVSP,1468,Unknown Format (0x34) [Block ID: 16862781017075794768 Packet ID: -1088526234] [RANGE_ERROR] [PACKET_RESEND] Unknown Payload Type (0x175d) ,3.500000002532033e-05
1217864,2481.7797969999997,192.168.0.2,188.49.129.56,GVSP,1468,Unknown Format (0x34) [Block ID: 16862781017075794768 Packet ID: -1088460698] [RANGE_ERROR] [PACKET_RESEND] Unknown Payload Type (0x3cbb) ,3.799999967668555e-05
1217865,2481.779831,192.168.0.2,188.49.129.56,GVSP,1468,Unknown Format (0x34) [Block ID: 16862781017075794768 Packet ID: -1088395162] [RANGE_ERROR] [PACKET_RESEND] Unknown Payload Type (0x1520) ,3.400000014153193e-05
1217866,2481.779858,192.168.0.2,188.49.129.56,GVSP,1468,Unknown Format (0x34) [Block ID: 16862781017075794768 Packet ID: -1088329626] [RANGE_ERROR] [PACKET_RESEND] Unknown Payload Type (0x3a7b) ,2.700000004551839e-05
1217867,2481.779891,192.168.0.2,188.49.129.56,GVSP,1468,Unknown Format (0x34) [Block ID: 16862781017075794768 Packet ID: -1088264090] [RANGE_ERROR] [PACKET_RESEND] Unknown Payload Type (0x3080) ,3.300000025774352e-05
1217868,2481.780161,192.168.0.2,239.192.152.143,UDP,161,6771  >  6771 Len=119,0.00027000000000043656
1217869,2481.7806969999997,192.168.0.2,239.192.152.143,UDP,161,6771  >  6771 Len=119,0.0005359999995562248
1217871,2481.785198,192.168.0.2,104.25.202.21,TCP,66,[TCP Dup ACK 1217852#3] 4337  >  443 [ACK] Seq=20293 Ack=1706351 Win=1401600 Len=0 SLE=1646307 SRE=1647767,0.004501000000345812
1217873,2481.790672,192.168.0.2,104.25.202.21,TCP,66,[TCP Dup ACK 1217852#4] 4337  >  443 [ACK] Seq=20293 Ack=1706351 Win=1401600 Len=0 SLE=1647767 SRE=1649227,0.005474000000049273
1217875,2481.796297,192.168.0.2,104.25.202.21,TCP,66,[TCP Dup ACK 1217852#5] 4337  >  443 [ACK] Seq=20293 Ack=1706351 Win=1401600 Len=0 SLE=1649227 SRE=1650687,0.005624999999781721
1217876,2481.799586,192.168.0.2,201.52.67.173,TCP,66,[TCP Retransmission] 4352  >  12236 [SYN] Seq=0 Win=17520 Len=0 MSS=1460 WS=256 SACK_PERM=1,0.003289000000222586
1217878,2481.801806,192.168.0.2,104.25.202.21,TCP,66,[TCP Dup ACK 1217852#6] 4337  >  443 [ACK] Seq=20293 Ack=1706351 Win=1401600 Len=0 SLE=1650687 SRE=1652147,0.002219999999852007
1217880,2481.807855,192.168.0.2,104.25.202.21,TCP,66,[TCP Dup ACK 1217852#7] 4337  >  443 [ACK] Seq=20293 Ack=1706351 Win=1401600 Len=0 SLE=1652147 SRE=1653607,0.006049000000075466
1217882,2481.81339,192.168.0.2,104.25.202.21,TCP,66,[TCP Dup ACK 1217852#8] 4337  >  443 [ACK] Seq=20293 Ack=1706351 Win=1401600 Len=0 SLE=1653607 SRE=1655067,0.005534999999781576
1217884,2481.819682,192.168.0.2,104.25.202.21,TCP,66,[TCP Dup ACK 1217852#9] 4337  >  443 [ACK] Seq=20293 Ack=1706351 Win=1401600 Len=0 SLE=1655067 SRE=1656074,0.006292000000030384
1217886,2481.824468,192.168.0.2,104.25.202.21,TCP,66,[TCP Dup ACK 1217852#10] 4337  >  443 [ACK] Seq=20293 Ack=1706351 Win=1401600 Len=0 SLE=1656074 SRE=1657472,0.004785999999967316
1217888,2481.82987,192.168.0.2,104.25.202.21,TCP,66,[TCP Dup ACK 1217852#11] 4337  >  443 [ACK] Seq=20293 Ack=1706351 Win=1401600 Len=0 SLE=1657472 SRE=1658870,0.005402000000231055
1217890,2481.83556,192.168.0.2,104.25.202.21,TCP,66,[TCP Dup ACK 1217852#12] 4337  >  443 [ACK] Seq=20293 Ack=1706351 Win=1401600 Len=0 SLE=1658870 SRE=1660330,0.0056899999999586726
1217892,2481.840878,192.168.0.2,104.25.202.21,TCP,66,[TCP Dup ACK 1217852#13] 4337  >  443 [ACK] Seq=20293 Ack=1706351 Win=1401600 Len=0 SLE=1660330 SRE=1661666,0.005317999999988388
1217894,2481.8464870000007,192.168.0.2,104.25.202.21,TCP,66,[TCP Dup ACK 1217852#14] 4337  >  443 [ACK] Seq=20293 Ack=1706351 Win=1401600 Len=0 SLE=1661666 SRE=1663126,0.005609000000731612
1217896,2481.852031,192.168.0.2,104.25.202.21,TCP,66,[TCP Dup ACK 1217852#15] 4337  >  443 [ACK] Seq=20293 Ack=1706351 Win=1401600 Len=0 SLE=1663126 SRE=1664586,0.005543999999190419
1217898,2481.8580699999998,192.168.0.2,104.25.202.21,TCP,66,[TCP Dup ACK 1217852#16] 4337  >  443 [ACK] Seq=20293 Ack=1706351 Win=1401600 Len=0 SLE=1664586 SRE=1666046,0.00603899999987334
1217900,2481.863875,192.168.0.2,104.25.202.21,TCP,66,[TCP Dup ACK 1217852#17] 4337  >  443 [ACK] Seq=20293 Ack=1706351 Win=1401600 Len=0 SLE=1666046 SRE=1667506,0.00580500000023676
1217902,2481.8691949999998,192.168.0.2,104.25.202.21,TCP,66,[TCP Dup ACK 1217852#18] 4337  >  443 [ACK] Seq=20293 Ack=1706351 Win=1401600 Len=0 SLE=1667506 SRE=1668966,0.005319999999755964
1217904,2481.87477,192.168.0.2,104.25.202.21,TCP,66,[TCP Dup ACK 1217852#19] 4337  >  443 [ACK] Seq=20293 Ack=1706351 Win=1401600 Len=0 SLE=1668966 SRE=1670426,0.005575000000135333
1217906,2481.879982,192.168.0.2,104.25.202.21,TCP,54,[TCP Dup ACK 1217852#20] 4337  >  443 [ACK] Seq=20293 Ack=1706351 Win=1401600 Len=0,0.005212000000028638
1217908,2481.891214,192.168.0.2,104.25.202.21,TCP,54,[TCP Dup ACK 1217852#21] 4337  >  443 [ACK] Seq=20293 Ack=1706351 Win=1401600 Len=0,0.01123200000029101
1217910,2481.8976620000008,192.168.0.2,104.25.202.21,TCP,66,[TCP Dup ACK 1217852#22] 4337  >  443 [ACK] Seq=20293 Ack=1706351 Win=1401600 Len=0 SLE=1670426 SRE=1671874,0.006448000000546017
1217914,2481.90337,192.168.0.2,104.25.202.21,TCP,54,4337  >  443 [ACK] Seq=20293 Ack=1709271 Win=1401600 Len=0,0.005707999999231106
1217917,2481.9045170000004,192.168.0.2,104.25.202.21,TCP,66,4337  >  443 [ACK] Seq=20293 Ack=1710609 Win=1400064 Len=0 SLE=1671874 SRE=1673322,0.0011470000004010217
1217919,2481.904561,192.168.0.2,104.25.202.21,TCP,54,4337  >  443 [ACK] Seq=20293 Ack=1712069 Win=1401600 Len=0,4.399999943416333e-05
1217922,2481.905503,192.168.0.2,104.25.202.21,TCP,54,4337  >  443 [ACK] Seq=20293 Ack=1714568 Win=1401600 Len=0,0.0009420000001227891
1217925,2481.905546,192.168.0.2,104.25.202.21,TCP,54,4337  >  443 [ACK] Seq=20293 Ack=1715924 Win=1400064 Len=0,4.3000000005122274e-05
1217928,2481.905621,192.168.0.2,104.25.202.21,TCP,54,4337  >  443 [ACK] Seq=20293 Ack=1718844 Win=1401600 Len=0,7.499999992433004e-05
1217931,2481.906999,192.168.0.2,104.25.202.21,TCP,54,4337  >  443 [ACK] Seq=20293 Ack=1721642 Win=1401600 Len=0,0.0013779999999314896
1217934,2481.907065,192.168.0.2,104.25.202.21,TCP,54,4337  >  443 [ACK] Seq=20293 Ack=1724562 Win=1401600 Len=0,6.60000000607397e-05
1217937,2481.908078,192.168.0.2,104.25.202.21,TCP,54,4337  >  443 [ACK] Seq=20293 Ack=1727482 Win=1401600 Len=0,0.0010130000000572181
1217940,2481.9081579999997,192.168.0.2,104.25.202.21,TCP,54,4337  >  443 [ACK] Seq=20293 Ack=1730402 Win=1401600 Len=0,7.999999979801942e-05
1217943,2481.909402,192.168.0.2,104.25.202.21,TCP,54,4337  >  443 [ACK] Seq=20293 Ack=1733322 Win=1401600 Len=0,0.0012440000000424334
1217946,2481.909486,192.168.0.2,104.25.202.21,TCP,54,4337  >  443 [ACK] Seq=20293 Ack=1736242 Win=1401600 Len=0,8.400000024266774e-05
1217948,2481.910289,192.168.0.2,104.25.202.21,TCP,66,[TCP Dup ACK 1217946#1] 4337  >  443 [ACK] Seq=20293 Ack=1736242 Win=1401600 Len=0 SLE=1673322 SRE=1674770,0.0008029999999052961
1217951,2481.91035,192.168.0.2,104.25.202.21,TCP,54,4337  >  443 [ACK] Seq=20293 Ack=1739162 Win=1401600 Len=0,6.100000018705032e-05
1217954,2481.9115739999997,192.168.0.2,104.25.202.21,TCP,54,4337  >  443 [ACK] Seq=20293 Ack=1742082 Win=1401600 Len=0,0.0012239999996381812
1217957,2481.911626,192.168.0.2,104.25.202.21,TCP,54,4337  >  443 [ACK] Seq=20293 Ack=1745002 Win=1401600 Len=0,5.200000032345997e-05
1217960,2481.913698,192.168.0.2,104.25.202.21,TCP,54,4337  >  443 [ACK] Seq=20293 Ack=1747922 Win=1401600 Len=0,0.0020719999997709238
1217963,2481.913786,192.168.0.2,104.25.202.21,TCP,54,4337  >  443 [ACK] Seq=20293 Ack=1750842 Win=1401600 Len=0,8.800000023256871e-05
1217966,2481.914206,192.168.0.2,104.25.202.21,TCP,54,4337  >  443 [ACK] Seq=20293 Ack=1753762 Win=1401600 Len=0,0.00041999999984909664
1217969,2481.9142829999996,192.168.0.2,104.25.202.21,TCP,54,4337  >  443 [ACK] Seq=20293 Ack=1756682 Win=1401600 Len=0,7.699999969190685e-05
1217972,2481.914731,192.168.0.2,104.25.202.21,TCP,54,4337  >  443 [ACK] Seq=20293 Ack=1759602 Win=1401600 Len=0,0.0004480000002331508
1217974,2481.915054,192.168.0.2,104.25.202.21,TCP,54,[TCP Dup ACK 1217972#1] 4337  >  443 [ACK] Seq=20293 Ack=1759602 Win=1401600 Len=0,0.00032300000020768493
1217977,2481.915158,192.168.0.2,104.25.202.21,TCP,54,4337  >  443 [ACK] Seq=20293 Ack=1761357 Win=1401600 Len=0,0.00010399999973742524
1217979,2481.9199,192.168.0.2,104.25.202.21,TCP,54,[TCP Dup ACK 1217977#1] 4337  >  443 [ACK] Seq=20293 Ack=1761357 Win=1401600 Len=0,0.004742000000078406
1217981,2481.9254,192.168.0.2,104.25.202.21,TCP,54,[TCP Dup ACK 1217977#2] 4337  >  443 [ACK] Seq=20293 Ack=1761357 Win=1401600 Len=0,0.005500000000211003
1217983,2481.930885,192.168.0.2,104.25.202.21,TCP,54,[TCP Dup ACK 1217977#3] 4337  >  443 [ACK] Seq=20293 Ack=1761357 Win=1401600 Len=0,0.005485000000135187
1217984,2481.9325329999997,192.168.0.2,201.52.67.173,UDP,62,12236  >  12236 Len=20,0.0016479999994771788
1217986,2481.93644,192.168.0.2,104.25.202.21,TCP,66,[TCP Dup ACK 1217977#4] 4337  >  443 [ACK] Seq=20293 Ack=1761357 Win=1401600 Len=0 SLE=1674770 SRE=1674806,0.003907000000253902
1217988,2481.942646,192.168.0.2,104.25.202.21,TCP,66,[TCP Dup ACK 1217977#5] 4337  >  443 [ACK] Seq=20293 Ack=1761357 Win=1401600 Len=0 SLE=1674806 SRE=1675208,0.00620600000002014
1217990,2481.949208,192.168.0.2,104.25.202.21,TCP,66,[TCP Dup ACK 1217977#6] 4337  >  443 [ACK] Seq=20293 Ack=1761357 Win=1401600 Len=0 SLE=1675208 SRE=1676606,0.006562000000030821
1217992,2481.953993,192.168.0.2,104.25.202.21,TCP,66,[TCP Dup ACK 1217977#7] 4337  >  443 [ACK] Seq=20293 Ack=1761357 Win=1401600 Len=0 SLE=1676606 SRE=1678004,0.004785000000083528
1217994,2481.959437,192.168.0.2,104.25.202.21,TCP,66,[TCP Dup ACK 1217977#8] 4337  >  443 [ACK] Seq=20293 Ack=1761357 Win=1401600 Len=0 SLE=1678004 SRE=1679452,0.005443999999897642
1217996,2481.964948,192.168.0.2,104.25.202.21,TCP,66,[TCP Dup ACK 1217977#9] 4337  >  443 [ACK] Seq=20293 Ack=1761357 Win=1401600 Len=0 SLE=1679452 SRE=1680900,0.00551099999984217
1217998,2481.9703879999997,192.168.0.2,104.25.202.21,TCP,66,[TCP Dup ACK 1217977#10] 4337  >  443 [ACK] Seq=20293 Ack=1761357 Win=1401600 Len=0 SLE=1680900 SRE=1681755,0.005439999999907741
1218000,2481.9758469999997,192.168.0.2,104.25.202.21,TCP,66,[TCP Dup ACK 1217977#11] 4337  >  443 [ACK] Seq=20293 Ack=1761357 Win=1401600 Len=0 SLE=1681755 SRE=1681793,0.005458999999973457
1218002,2481.9812190000002,192.168.0.2,104.25.202.21,TCP,54,[TCP Dup ACK 1217977#12] 4337  >  443 [ACK] Seq=20293 Ack=1761357 Win=1401600 Len=0,0.005372000000534172
1218004,2481.987597,192.168.0.2,104.25.202.21,TCP,66,[TCP Dup ACK 1217977#13] 4337  >  443 [ACK] Seq=20293 Ack=1761357 Win=1401600 Len=0 SLE=1681793 SRE=1683241,0.006377999999585882
1218006,2481.9931579999998,192.168.0.2,104.25.202.21,TCP,66,[TCP Dup ACK 1217977#14] 4337  >  443 [ACK] Seq=20293 Ack=1761357 Win=1401600 Len=0 SLE=1683241 SRE=1684689,0.005560999999943306
1218008,2481.99856,192.168.0.2,104.25.202.21,TCP,66,[TCP Dup ACK 1217977#15] 4337  >  443 [ACK] Seq=20293 Ack=1761357 Win=1401600 Len=0 SLE=1684689 SRE=1686051,0.005402000000231055
1218010,2482.004057,192.168.0.2,104.25.202.21,TCP,66,[TCP Dup ACK 1217977#16] 4337  >  443 [ACK] Seq=20293 Ack=1761357 Win=1401600 Len=0 SLE=1686051 SRE=1686803,0.00549700000010489
1218012,2482.009313,192.168.0.2,104.25.202.21,TCP,66,[TCP Dup ACK 1217977#17] 4337  >  443 [ACK] Seq=20293 Ack=1761357 Win=1401600 Len=0 SLE=1686803 SRE=1686841,0.005255999999917549
1218014,2482.0149,192.168.0.2,104.25.202.21,TCP,54,[TCP Dup ACK 1217977#18] 4337  >  443 [ACK] Seq=20293 Ack=1761357 Win=1401600 Len=0,0.005587000000105036
1218016,2482.022516,192.168.0.2,104.25.202.21,TCP,66,[TCP Dup ACK 1217977#19] 4337  >  443 [ACK] Seq=20293 Ack=1761357 Win=1401600 Len=0 SLE=1686841 SRE=1688289,0.007615999999870837
1218018,2482.026371,192.168.0.2,104.25.202.21,TCP,66,[TCP Dup ACK 1217977#20] 4337  >  443 [ACK] Seq=20293 Ack=1761357 Win=1401600 Len=0 SLE=1688289 SRE=1689737,0.003854999999930442
1218020,2482.03172,192.168.0.2,104.25.202.21,TCP,66,[TCP Dup ACK 1217977#21] 4337  >  443 [ACK] Seq=20293 Ack=1761357 Win=1401600 Len=0 SLE=1689737 SRE=1690903,0.005349000000023807
1218022,2482.037703,192.168.0.2,104.25.202.21,TCP,66,[TCP Dup ACK 1217977#22] 4337  >  443 [ACK] Seq=20293 Ack=1761357 Win=1401600 Len=0 SLE=1690903 SRE=1690941,0.0059830000000147265
1218024,2482.043376,192.168.0.2,104.25.202.21,TCP,54,[TCP Dup ACK 1217977#23] 4337  >  443 [ACK] Seq=20293 Ack=1761357 Win=1401600 Len=0,0.00567300000011528
1218026,2482.076365,192.168.0.2,184.75.221.3,UDP,331,12236  >  45879 Len=289,0.03298899999981586
1218035,2482.105808,192.168.0.2,113.193.151.171,GVSP,1468,Unknown Format (0x34) [Block ID: 3232622906454360912 Packet ID: -1294302584] [BLOCK_DROPPED] [PACKET_RESEND] Unknown Payload Type (0x33ee) ,0.029442999999901076
1218036,2482.105887,192.168.0.2,113.193.151.171,GVSP,1468,Unknown Format (0x34) [Block ID: 3232622906454360912 Packet ID: -1294237048] [BLOCK_DROPPED] [PACKET_RESEND] Unknown Payload Type (0x63d) ,7.900000036897836e-05
1218045,2482.10617,192.168.0.2,113.193.151.171,GVSP,1468,Unknown Format (0x34) [Block ID: 3232622889274491728 Packet ID: -1294171512] [BLOCK_DROPPED] [PACKET_RESEND] Unknown Payload Type (0x710) ,0.0002829999998539279
1218046,2482.106214,192.168.0.2,113.193.151.171,GVSP,1468,Unknown Format (0x34) [Block ID: 3232621729633321808 Packet ID: -1294105976] [BLOCK_DROPPED] [PACKET_RESEND] Unknown Payload Type (0x284b) ,4.399999988891068e-05
1218047,2482.106264,192.168.0.2,113.193.151.171,GVSP,1468,Unknown Format (0x34) [Block ID: 3231738276335371088 Packet ID: -1294040440] [BLOCK_DROPPED] [PACKET_RESEND] Unknown Payload Type (0x3b7f) ,5.000000010113581e-05
1218048,2482.10631,192.168.0.2,113.193.151.171,GVSP,1468,Unknown Format (0x34) [Block ID: 3231514774827221840 Packet ID: -1293974904] [BLOCK_DROPPED] [PACKET_RESEND] Unknown Payload Type (0xf19) ,4.600000011123484e-05
1218053,2482.109349,192.168.0.2,188.49.129.56,GVSP,993,Unknown Format (0x34) [Block ID: 16862833849468502864 Packet ID: -1088198554] [RANGE_ERROR] [PACKET_RESEND] Unknown Payload Type (0x13de) ,0.003038999999716907
1218056,2482.41878,192.168.0.2,188.49.129.56,GVSP,62,Unknown Format (0x34) [Block ID: 16862816450555986742 Packet ID: -1088133017] [RANGE_ERROR] [PACKET_RESEND] Unknown Payload Type (0x0) ,0.30943100000013146
1218057,2482.444098,192.168.0.2,178.48.53.33,UDP,1468,12236  >  8999 Len=1426,0.025317999999970198
1218058,2482.444194,192.168.0.2,188.49.129.56,GVSP,1468,Unknown Format (0x34) [Block ID: 16862816450555986768 Packet ID: -1088133017] [RANGE_ERROR] [PACKET_RESEND] MUTLIZONEIAMGE ,9.600000021237065e-05
1218059,2482.444221,192.168.0.2,188.49.129.56,GVSP,1468,Unknown Format (0x34) [Block ID: 16862816450555986768 Packet ID: -1088067481] [RANGE_ERROR] [PACKET_RESEND] Unknown Payload Type (0x3be5) ,2.700000004551839e-05
1218060,2482.444257,192.168.0.2,188.49.129.56,GVSP,1468,Unknown Format (0x34) [Block ID: 16862816450555986768 Packet ID: -1088001945] [RANGE_ERROR] [PACKET_RESEND] Unknown Payload Type (0x35bf) ,3.599999990910874e-05
1218061,2482.44428,192.168.0.2,188.49.129.56,GVSP,1468,Unknown Format (0x34) [Block ID: 16862816450555986768 Packet ID: -1087936409] [RANGE_ERROR] [PACKET_RESEND] Unknown Payload Type (0x1439) ,2.300000005561742e-05
1218062,2482.444304,192.168.0.2,188.49.129.56,GVSP,1468,Unknown Format (0x34) [Block ID: 16862816450555986768 Packet ID: -1087870873] [RANGE_ERROR] [PACKET_RESEND] Unknown Payload Type (0x2232) ,2.3999999939405825e-05
1218063,2482.4443309999997,192.168.0.2,188.49.129.56,GVSP,1468,Unknown Format (0x34) [Block ID: 16862816450555986768 Packet ID: -1087805337] [RANGE_ERROR] [PACKET_RESEND] Unknown Payload Type (0x2dee) ,2.699999959077104e-05
1218064,2482.444356,192.168.0.2,188.49.129.56,GVSP,1468,Unknown Format (0x34) [Block ID: 16862816450555986768 Packet ID: -1087739801] [RANGE_ERROR] [PACKET_RESEND] Unknown Payload Type (0x1c37) ,2.500000027794158e-05
1218065,2482.44438,192.168.0.2,188.49.129.56,GVSP,1468,Unknown Format (0x34) [Block ID: 16862816450555986768 Packet ID: -1087674265] [RANGE_ERROR] [PACKET_RESEND] Unknown Payload Type (0x2ada) ,2.3999999939405825e-05
1218066,2482.444424,192.168.0.2,188.49.129.56,GVSP,1468,Unknown Format (0x34) [Block ID: 16862816450555986768 Packet ID: -1087608729] [RANGE_ERROR] [PACKET_RESEND] Unknown Payload Type (0xc16) ,4.399999988891068e-05
1218067,2482.444457,192.168.0.2,188.49.129.56,GVSP,1468,Unknown Format (0x34) [Block ID: 16862816450555986768 Packet ID: -1087543193] [RANGE_ERROR] [PACKET_RESEND] Unknown Payload Type (0x894) ,3.300000025774352e-05
1218068,2482.444481,192.168.0.2,188.49.129.56,GVSP,1468,Unknown Format (0x34) [Block ID: 16862816450555986768 Packet ID: -1087477657] [RANGE_ERROR] [PACKET_RESEND] Unknown Payload Type (0x311d) ,2.3999999939405825e-05
1218070,2482.643395,192.168.0.2,24.226.180.60,TCP,54,12236  >  54632 [ACK] Seq=331015 Ack=1788 Win=49664 Len=0,0.19891400000005888
1218073,2482.674999,192.168.0.2,224.0.0.22,IGMPv3,54,Membership Report / Leave group 224.0.0.252,0.03160399999978836
1218075,2482.678875,192.168.0.2,224.0.0.22,IGMPv3,54,Membership Report / Join group 224.0.0.252 for any sources,0.0038760000002184825
1218077,2482.679528,192.168.0.2,224.0.0.252,LLMNR,75,Standard query 0xd5db ANY DESKTOP-BNL0PME,0.000653000000056636
1218078,2482.7801440000007,192.168.0.2,37.134.222.6,UDP,145,12236  >  38185 Len=103,0.10061600000062754
1218092,2482.8696059999997,192.168.0.2,188.49.129.56,GVSP,993,Unknown Format (0x34) [Block ID: 16863256804962911056 Packet ID: -1087412121] [RANGE_ERROR] [PACKET_RESEND] Unknown Payload Type (0x5e8) ,0.08946199999900273
1218093,2482.869668,192.168.0.2,113.193.151.171,GVSP,647,Unknown Format (0x34) [Block ID: 3231006207749702480 Packet ID: -1293909368] [BLOCK_DROPPED] [PACKET_RESEND] Unknown Payload Type (0xd75) ,6.200000007083872e-05
1218094,2482.869698,192.168.0.2,113.193.151.171,GVSP,1468,Unknown Format (0x34) [Block ID: 3231006207749702480 Packet ID: -1293843832] [BLOCK_DROPPED] [PACKET_RESEND] Unknown Payload Type (0x1562) ,3.0000000151630957e-05
1218095,2482.869722,192.168.0.2,113.193.151.171,GVSP,1468,Unknown Format (0x34) [Block ID: 3231006207749702480 Packet ID: -1293778296] [BLOCK_DROPPED] [PACKET_RESEND] Unknown Payload Type (0x3fab) ,2.3999999939405825e-05
1218096,2482.86984,192.168.0.2,113.193.151.171,UDP,1312,62257  >  50670 Len=1270,0.00011799999992945231
1218097,2482.869891,192.168.0.2,113.193.151.171,UDP,1312,62257  >  50670 Len=1270,5.0999999984924216e-05
1218098,2482.869923,192.168.0.2,113.193.151.171,UDP,1312,62257  >  50670 Len=1270,3.200000037395512e-05
1218099,2482.869966,192.168.0.2,113.193.151.171,UDP,1312,62257  >  50670 Len=1270,4.3000000005122274e-05
1218100,2482.870021,192.168.0.2,113.193.151.171,UDP,1312,62257  >  50670 Len=1270,5.499999997482519e-05
